[{"id":301,"dateAddedLocal":"7/10/2016, 9:22:52 PM","dateAddedUTC":"2016-07-11T01:22:52.000Z","index":0,"parentId":"1","title":"","url":"https://www.google.com/"},{"id":1185,"dateAddedLocal":"12/26/2016, 8:41:00 AM","dateAddedUTC":"2016-12-26T13:41:00.000Z","index":1,"parentId":"1","title":"","url":"https://github.com/smithWEBtek"},{"id":1415,"dateAddedLocal":"3/5/2018, 8:35:21 AM","dateAddedUTC":"2018-03-05T13:35:21.889Z","index":2,"parentId":"1","title":"port"},{"id":302,"dateAddedLocal":"1/22/2018, 12:46:28 PM","dateAddedUTC":"2018-01-22T17:46:28.000Z","index":0,"parentId":"1415","title":"localhost:3000","url":"http://localhost:3000/"},{"id":303,"dateAddedLocal":"11/25/2017, 3:50:21 PM","dateAddedUTC":"2017-11-25T20:50:21.000Z","index":1,"parentId":"1415","title":"127.0.0.1:3001","url":"http://127.0.0.1:3001/"},{"id":304,"dateAddedLocal":"1/24/2018, 12:10:57 PM","dateAddedUTC":"2018-01-24T17:10:57.000Z","index":2,"parentId":"1415","title":"127.0.0.1:3002","url":"http://127.0.0.1:3002/"},{"id":305,"dateAddedLocal":"1/24/2018, 12:11:07 PM","dateAddedUTC":"2018-01-24T17:11:07.000Z","index":3,"parentId":"1415","title":"127.0.0.1:5000","url":"http://127.0.0.1:5000/"},{"id":1331,"dateAddedLocal":"2/16/2018, 3:49:53 PM","dateAddedUTC":"2018-02-16T20:49:53.166Z","index":4,"parentId":"1415","title":"localhost:9292","url":"http://localhost:9292/"},{"id":1417,"dateAddedLocal":"3/5/2018, 8:39:15 AM","dateAddedUTC":"2018-03-05T13:39:15.908Z","index":5,"parentId":"1415","title":"localhost:9393","url":"http://localhost:9393/"},{"id":306,"dateAddedLocal":"9/15/2017, 3:29:40 PM","dateAddedUTC":"2017-09-15T19:29:40.000Z","index":6,"parentId":"1415","title":"RailsRoutes:3000","url":"http://127.0.0.1:3000/rails/info/routes"},{"id":1416,"dateAddedLocal":"3/5/2018, 8:38:34 AM","dateAddedUTC":"2018-03-05T13:38:34.289Z","index":7,"parentId":"1415","title":"RailsRoutes:3001","url":"http://127.0.0.1:3001/rails/info/routes"},{"id":300,"dateAddedLocal":"2/9/2018, 5:47:29 PM","dateAddedUTC":"2018-02-09T22:47:29.688Z","index":3,"parentId":"1","title":"misc"},{"id":1340,"dateAddedLocal":"2/20/2018, 3:11:47 PM","dateAddedUTC":"2018-02-20T20:11:47.696Z","index":0,"parentId":"300","title":"Martha","url":"https://calendar.google.com/calendar/selfsched?sstoken=UUxPbzQ5Y2hoVGc0fGRlZmF1bHR8NThmZjNlYzhmNzJjM2Y1ZTBiZGE3YTBmNWI4YTUyYTU"},{"id":378,"dateAddedLocal":"9/12/2017, 1:11:10 PM","dateAddedUTC":"2017-09-12T17:11:10.000Z","index":1,"parentId":"300","title":"JST","url":"https://docs.google.com/spreadsheets/d/1CMFzB1zUQl_yR2ZO9kZdDjPZJEupsjULC6G_vRTUgnU/edit#gid=2065124896"},{"id":364,"dateAddedLocal":"2/9/2018, 5:47:29 PM","dateAddedUTC":"2018-02-09T22:47:29.696Z","index":2,"parentId":"300","title":"_career"},{"id":1464,"dateAddedLocal":"3/14/2018, 8:36:05 AM","dateAddedUTC":"2018-03-14T12:36:05.349Z","index":0,"parentId":"364","title":"gigs"},{"id":396,"dateAddedLocal":"9/12/2017, 1:11:10 PM","dateAddedUTC":"2017-09-12T17:11:10.000Z","index":0,"parentId":"1464","title":"Toptal Developers - Hire Freelance Developers from the Top 3%","url":"https://www.toptal.com/developers"},{"id":379,"dateAddedLocal":"9/12/2017, 1:11:10 PM","dateAddedUTC":"2017-09-12T17:11:10.000Z","index":1,"parentId":"1464","title":"Join as a Freelancer | Toptal","url":"https://www.toptal.com/talent/apply"},{"id":1459,"dateAddedLocal":"3/14/2018, 8:21:21 AM","dateAddedUTC":"2018-03-14T12:21:21.538Z","index":1,"parentId":"364","title":"interview-coding"},{"id":1323,"dateAddedLocal":"2/14/2018, 12:35:20 AM","dateAddedUTC":"2018-02-14T05:35:20.139Z","index":0,"parentId":"1459","title":"Top 10 Algorithms for Coding Interview","url":"https://www.programcreek.com/2012/11/top-10-algorithms-for-coding-interview/"},{"id":1327,"dateAddedLocal":"2/14/2018, 12:36:24 AM","dateAddedUTC":"2018-02-14T05:36:24.212Z","index":1,"parentId":"1459","title":"Sorting Algorithm Animations | Toptal","url":"https://www.toptal.com/developers/sorting-algorithms/"},{"id":1325,"dateAddedLocal":"2/14/2018, 12:35:48 AM","dateAddedUTC":"2018-02-14T05:35:48.375Z","index":2,"parentId":"1459","title":"Data Structures and Algorithm: Data structures and algorithm book","url":"http://www.dsalgo.com/2013/02/index.php.html?m=1"},{"id":1326,"dateAddedLocal":"2/14/2018, 12:35:56 AM","dateAddedUTC":"2018-02-14T05:35:56.691Z","index":3,"parentId":"1459","title":"Big-O Algorithm Complexity Cheat Sheet (Know Thy Complexities!) @ericdrowell","url":"http://bigocheatsheet.com/"},{"id":1322,"dateAddedLocal":"2/14/2018, 12:35:01 AM","dateAddedUTC":"2018-02-14T05:35:01.559Z","index":4,"parentId":"1459","title":"Data Structures - GeeksforGeeks","url":"https://www.geeksforgeeks.org/data-structures/"},{"id":1319,"dateAddedLocal":"2/14/2018, 12:34:36 AM","dateAddedUTC":"2018-02-14T05:34:36.260Z","index":5,"parentId":"1459","title":"Problems - LeetCode","url":"https://leetcode.com/problemset/algorithms/"},{"id":1317,"dateAddedLocal":"2/14/2018, 12:33:47 AM","dateAddedUTC":"2018-02-14T05:33:47.447Z","index":6,"parentId":"1459","title":"Code Interview Prep & Programming Questions | Pramp","url":"https://www.pramp.com/#/"},{"id":1306,"dateAddedLocal":"2/12/2018, 5:21:56 PM","dateAddedUTC":"2018-02-12T22:21:56.823Z","index":7,"parentId":"1459","title":"Big O Notation | Interview Cake","url":"https://www.interviewcake.com/article/java/big-o-notation-time-and-space-complexity"},{"id":1303,"dateAddedLocal":"2/12/2018, 5:21:35 PM","dateAddedUTC":"2018-02-12T22:21:35.982Z","index":8,"parentId":"1459","title":"About - Project Euler","url":"https://projecteuler.net/"},{"id":1302,"dateAddedLocal":"2/12/2018, 5:16:57 PM","dateAddedUTC":"2018-02-12T22:16:57.350Z","index":9,"parentId":"1459","title":"Big O Notation | Interview Cake","url":"https://www.interviewcake.com/article/ruby/big-o-notation-time-and-space-complexity"},{"id":1293,"dateAddedLocal":"2/11/2018, 3:58:19 PM","dateAddedUTC":"2018-02-11T20:58:19.318Z","index":10,"parentId":"1459","title":"37 Essential JavaScript Interview Questions and Answers","url":"https://www.toptal.com/javascript/interview-questions"},{"id":1324,"dateAddedLocal":"2/14/2018, 12:35:27 AM","dateAddedUTC":"2018-02-14T05:35:27.067Z","index":11,"parentId":"1459","title":"kennyledet/Algorithm-Implementations: Share, discuss and learn about algorithm implementations!","url":"https://github.com/kennyledet/Algorithm-Implementations"},{"id":1321,"dateAddedLocal":"2/14/2018, 12:34:54 AM","dateAddedUTC":"2018-02-14T05:34:54.337Z","index":12,"parentId":"1459","title":"FitCoding - Interview Questions | Problem Solving | Java | PHP | JavaScript | Software","url":"https://www.fitcoding.com/"},{"id":383,"dateAddedLocal":"10/19/2017, 11:59:17 AM","dateAddedUTC":"2017-10-19T15:59:17.000Z","index":13,"parentId":"1459","title":"mr-mig/every-programmer-should-know: A collection of (mostly) technical things every software developer should know","url":"https://github.com/mr-mig/every-programmer-should-know"},{"id":1330,"dateAddedLocal":"2/16/2018, 11:47:01 AM","dateAddedUTC":"2018-02-16T16:47:01.893Z","index":2,"parentId":"364","title":"interview-prep"},{"id":1329,"dateAddedLocal":"2/16/2018, 11:46:27 AM","dateAddedUTC":"2018-02-16T16:46:27.971Z","index":0,"parentId":"1330","title":"Linked list - Wikipedia","url":"https://en.wikipedia.org/wiki/Linked_list"},{"id":1395,"dateAddedLocal":"3/2/2018, 12:43:30 PM","dateAddedUTC":"2018-03-02T17:43:30.521Z","index":1,"parentId":"1330","title":"Four Semesters of Computer Science in Six Hours v2 Workshop","url":"https://frontendmasters.com/workshops/computer-science-v2/"},{"id":369,"dateAddedLocal":"9/12/2017, 1:11:10 PM","dateAddedUTC":"2017-09-12T17:11:10.000Z","index":2,"parentId":"1330","title":"3 Steps to a Perfect Informational Interview","url":"https://www.themuse.com/advice/3-steps-to-a-perfect-informational-interview?utm_medium=email&utm_campaign=weekly_20170407&utm_source=blueshift&bsft_eid=c7fee705-de41-4462-9dc0-d7d3c78ba382&bsft_pid=ffb458c9-9c5d-4e94-930f-15d30646ca5a&bsft_clkid=ab86f205-daf9-4881-ab93-2f71af299a16&bsft_uid=11a0bd8b-d47a-4d56-94dd-efdffc5e1484&bsft_mid=006df803-f84a-4b5d-81ff-28cefc7af911&bsft_pp=2&p=2"},{"id":377,"dateAddedLocal":"9/12/2017, 1:11:10 PM","dateAddedUTC":"2017-09-12T17:11:10.000Z","index":3,"parentId":"1330","title":"Interview Cake","url":"https://www.interviewcake.com/"},{"id":370,"dateAddedLocal":"9/12/2017, 1:11:10 PM","dateAddedUTC":"2017-09-12T17:11:10.000Z","index":4,"parentId":"1330","title":"4 Ways to Handle Interview Questions You Don't Know How to Answer","url":"https://www.themuse.com/advice/4-ways-to-handle-interview-questions-you-dont-know-how-to-answer?utm_medium=email&utm_campaign=weekly_20170407&utm_source=blueshift&bsft_eid=c7fee705-de41-4462-9dc0-d7d3c78ba382&bsft_pid=3ccf07d5-00fa-4342-b6ca-c2f59a7fd019&bsft_clkid=df6f283e-972d-418c-b3b5-88370b41424f&bsft_uid=11a0bd8b-d47a-4d56-94dd-efdffc5e1484&bsft_mid=006df803-f84a-4b5d-81ff-28cefc7af911&bsft_pp=1&p=1"},{"id":1309,"dateAddedLocal":"2/12/2018, 5:22:08 PM","dateAddedUTC":"2018-02-12T22:22:08.659Z","index":5,"parentId":"1330","title":"How to pass a programming interview - Triplebyte Blog","url":"https://triplebyte.com/blog/how-to-pass-a-programming-interview"},{"id":1308,"dateAddedLocal":"2/12/2018, 5:22:04 PM","dateAddedUTC":"2018-02-12T22:22:04.791Z","index":6,"parentId":"1330","title":"Coding Interview Advice | Interview Cake","url":"https://www.interviewcake.com/coding-interview-tips"},{"id":1304,"dateAddedLocal":"2/12/2018, 5:21:47 PM","dateAddedUTC":"2018-02-12T22:21:47.348Z","index":7,"parentId":"1330","title":"Ruby Technical Interview Questions | Interview Cake","url":"https://www.interviewcake.com/all-questions/ruby"},{"id":1300,"dateAddedLocal":"2/12/2018, 3:31:45 PM","dateAddedUTC":"2018-02-12T20:31:45.875Z","index":8,"parentId":"1330","title":"h5bp/Front-end-Developer-Interview-Questions: A list of helpful front-end related questions you can use to interview potential candidates, test yourself or completely ignore.","url":"https://github.com/h5bp/Front-end-Developer-Interview-Questions"},{"id":1315,"dateAddedLocal":"2/14/2018, 12:33:29 AM","dateAddedUTC":"2018-02-14T05:33:29.162Z","index":9,"parentId":"1330","title":"Gainlo - Mock Interview With Professionals","url":"http://www.gainlo.co/#!/"},{"id":1316,"dateAddedLocal":"2/14/2018, 12:33:37 AM","dateAddedUTC":"2018-02-14T05:33:37.971Z","index":10,"parentId":"1330","title":"Programmer Mock Interviews | CareerCup","url":"https://www.careercup.com/interview"},{"id":395,"dateAddedLocal":"9/27/2017, 7:19:01 PM","dateAddedUTC":"2017-09-27T23:19:01.000Z","index":11,"parentId":"1330","title":"Top 50 React Interview Questions and Answers | Edureka","url":"https://www.edureka.co/blog/interview-questions/react-interview-questions/?utm_source=facebook&utm_medium=crosspost&utm_campaign=social-media-edureka-sep-sc"},{"id":1307,"dateAddedLocal":"2/12/2018, 5:22:01 PM","dateAddedUTC":"2018-02-12T22:22:01.164Z","index":12,"parentId":"1330","title":"How to Make the Most Out of Your Next Technical Interview, Even if You Bomb it - Flatiron School Flatiron School","url":"http://blog.flatironschool.com/how-to-make-the-most-out-of-your-next-technical/"},{"id":392,"dateAddedLocal":"9/12/2017, 1:11:10 PM","dateAddedUTC":"2017-09-12T17:11:10.000Z","index":13,"parentId":"1330","title":"Stack Overflow Trends","url":"https://insights.stackoverflow.com/trends?tags="},{"id":393,"dateAddedLocal":"9/12/2017, 1:11:10 PM","dateAddedUTC":"2017-09-12T17:11:10.000Z","index":14,"parentId":"1330","title":"The Best-Ever Response to \"Why Did You Leave Your Last Job?\"","url":"https://www.themuse.com/advice/the-bestever-response-to-why-did-you-leave-your-last-job?utm_medium=email&utm_campaign=weekly_20170407&utm_source=blueshift&bsft_eid=c7fee705-de41-4462-9dc0-d7d3c78ba382&bsft_pid=76c53af0-c381-499b-a28c-3e564ea22aea&bsft_clkid=f4314a00-8d71-4ee0-83e8-ff14df33ba1e&bsft_uid=11a0bd8b-d47a-4d56-94dd-efdffc5e1484&bsft_mid=006df803-f84a-4b5d-81ff-28cefc7af911&bsft_pp=3&p=3"},{"id":1305,"dateAddedLocal":"2/12/2018, 5:21:53 PM","dateAddedUTC":"2018-02-12T22:21:53.059Z","index":15,"parentId":"1330","title":"free anonymous technical interview practice | free anonymous technical interview practice | interviewing.io","url":"https://interviewing.io/"},{"id":1314,"dateAddedLocal":"2/14/2018, 12:33:20 AM","dateAddedUTC":"2018-02-14T05:33:20.768Z","index":16,"parentId":"1330","title":"software interview coaching","url":"http://www.impactinterview.com/software-engineering-interview-coaching/"},{"id":1462,"dateAddedLocal":"3/14/2018, 8:25:57 AM","dateAddedUTC":"2018-03-14T12:25:57.362Z","index":3,"parentId":"364","title":"junior"},{"id":400,"dateAddedLocal":"9/12/2017, 1:11:10 PM","dateAddedUTC":"2017-09-12T17:11:10.000Z","index":0,"parentId":"1462","title":"What skill set should a junior Rails developer have? - Quora","url":"https://www.quora.com/What-skill-set-should-a-junior-Rails-developer-have"},{"id":401,"dateAddedLocal":"9/12/2017, 1:11:10 PM","dateAddedUTC":"2017-09-12T17:11:10.000Z","index":1,"parentId":"1462","title":"What skills must a Junior Rails Developer need know in order to be successful in getting an entry level position? - Quora","url":"https://www.quora.com/What-skills-must-a-Junior-Rails-Developer-need-know-in-order-to-be-successful-in-getting-an-entry-level-position"},{"id":398,"dateAddedLocal":"9/12/2017, 1:11:10 PM","dateAddedUTC":"2017-09-12T17:11:10.000Z","index":2,"parentId":"1462","title":"What Every Junior Rails Developer Should Know | Rails Mama","url":"https://railsmama.wordpress.com/2015/06/13/what-every-junior-rails-developer-should-know/"},{"id":397,"dateAddedLocal":"9/12/2017, 1:11:10 PM","dateAddedUTC":"2017-09-12T17:11:10.000Z","index":3,"parentId":"1462","title":"What Employers are looking for in a junior rails developer","url":"http://blog.teamtreehouse.com/employers-looking-junior-rails-developer"},{"id":365,"dateAddedLocal":"9/12/2017, 1:11:10 PM","dateAddedUTC":"2017-09-12T17:11:10.000Z","index":4,"parentId":"1462","title":"12 Things Web Developers Must Include in Their Portfolios | Codementor","url":"https://www.codementor.io/learn-programming/12-important-things-to-include-in-web-dev-portfolios"},{"id":366,"dateAddedLocal":"9/12/2017, 1:11:10 PM","dateAddedUTC":"2017-09-12T17:11:10.000Z","index":5,"parentId":"1462","title":"12 Things You Must Do to Land a Junior Web Developer Job","url":"http://skillcrush.com/2015/04/09/land-junior-web-developer-job/"},{"id":374,"dateAddedLocal":"9/12/2017, 1:11:10 PM","dateAddedUTC":"2017-09-12T17:11:10.000Z","index":6,"parentId":"1462","title":"Getting Your First Job As A Software Developer","url":"https://dev.to/jennifer/getting-your-first-job-as-a-software-developer"},{"id":381,"dateAddedLocal":"9/12/2017, 1:11:10 PM","dateAddedUTC":"2017-09-12T17:11:10.000Z","index":7,"parentId":"1462","title":"Landing Your First Job as a Junior Web Developer","url":"http://blog.thefirehoseproject.com/posts/getting-your-first-junior-web-developer-job/"},{"id":372,"dateAddedLocal":"9/12/2017, 1:11:10 PM","dateAddedUTC":"2017-09-12T17:11:10.000Z","index":8,"parentId":"1462","title":"Becoming a Ruby on Rails developer | Infinum","url":"https://infinum.co/the-capsized-eight/becoming-a-ruby-on-rails-developer"},{"id":391,"dateAddedLocal":"9/12/2017, 1:11:10 PM","dateAddedUTC":"2017-09-12T17:11:10.000Z","index":9,"parentId":"1462","title":"So you want to become a full-stack developer... - RubySteps","url":"https://www.rubysteps.com/articles/2014/so-you-want-to-become-a-full-stack-developer/"},{"id":390,"dateAddedLocal":"9/12/2017, 1:11:10 PM","dateAddedUTC":"2017-09-12T17:11:10.000Z","index":10,"parentId":"1462","title":"So You Just Finished a Bootcamp, Now What?","url":"http://frontside.io/blog/2016/05/17/so-you-just-finished-a-bootcamp-now-what.html"},{"id":1465,"dateAddedLocal":"3/14/2018, 8:38:14 AM","dateAddedUTC":"2018-03-14T12:38:14.274Z","index":4,"parentId":"364","title":"networking"},{"id":1461,"dateAddedLocal":"3/14/2018, 8:22:45 AM","dateAddedUTC":"2018-03-14T12:22:45.277Z","index":5,"parentId":"364","title":"portfolio"},{"id":375,"dateAddedLocal":"9/12/2017, 1:11:10 PM","dateAddedUTC":"2017-09-12T17:11:10.000Z","index":0,"parentId":"1461","title":"How to Build an Impressive Portfolio When You're New to Tech","url":"https://skillcrush.com/2015/03/12/impressive-tech-portfolio/"},{"id":1460,"dateAddedLocal":"3/14/2018, 8:21:44 AM","dateAddedUTC":"2018-03-14T12:21:44.275Z","index":6,"parentId":"364","title":"recruiter"},{"id":1318,"dateAddedLocal":"2/14/2018, 12:34:10 AM","dateAddedUTC":"2018-02-14T05:34:10.994Z","index":0,"parentId":"1460","title":"HackerRank | Technical Recruiting | Hiring the Best Engineers","url":"https://www.hackerrank.com/"},{"id":394,"dateAddedLocal":"9/12/2017, 1:11:10 PM","dateAddedUTC":"2017-09-12T17:11:10.000Z","index":1,"parentId":"1460","title":"Tips From a Recruiter: Optimize Your Resume - Levo","url":"http://www.levo.com/articles/career-advice/how-to-fit-your-resume-onto-just-one-page"},{"id":1463,"dateAddedLocal":"3/14/2018, 8:32:36 AM","dateAddedUTC":"2018-03-14T12:32:36.936Z","index":7,"parentId":"364","title":"research"},{"id":388,"dateAddedLocal":"9/12/2017, 1:11:10 PM","dateAddedUTC":"2017-09-12T17:11:10.000Z","index":0,"parentId":"1463","title":"Ruby on Rails Jobs","url":"https://www.rorjobs.com/"},{"id":387,"dateAddedLocal":"9/12/2017, 1:11:10 PM","dateAddedUTC":"2017-09-12T17:11:10.000Z","index":1,"parentId":"1463","title":"RoRJobs.com","url":"https://www.rorjobs.com/pages/43-about"},{"id":386,"dateAddedLocal":"9/12/2017, 1:11:10 PM","dateAddedUTC":"2017-09-12T17:11:10.000Z","index":2,"parentId":"1463","title":"Rapportive-email finder","url":"http://rapportive.com/"},{"id":385,"dateAddedLocal":"9/12/2017, 1:11:10 PM","dateAddedUTC":"2017-09-12T17:11:10.000Z","index":3,"parentId":"1463","title":"RailsJobs.com","url":"https://www.railsjobs.com/"},{"id":376,"dateAddedLocal":"9/12/2017, 1:11:10 PM","dateAddedUTC":"2017-09-12T17:11:10.000Z","index":4,"parentId":"1463","title":"How to Find Email Addresses | Scott Britton | Pulse | LinkedIn","url":"https://www.linkedin.com/pulse/20140915184621-60525567-how-to-find-email-addresses?trk=hb_ntf_MEGAPHONE_ARTICLE_POST&trk=hb_ntf_MEGAPHONE_ARTICLE_POST"},{"id":373,"dateAddedLocal":"9/12/2017, 1:11:10 PM","dateAddedUTC":"2017-09-12T17:11:10.000Z","index":5,"parentId":"1463","title":"Boston Ruby Companies","url":"https://github.com/bostonrb/bostonrb/wiki/Companies"},{"id":402,"dateAddedLocal":"1/10/2018, 7:53:21 AM","dateAddedUTC":"2018-01-10T12:53:21.000Z","index":6,"parentId":"1463","title":"Shapr - Meet Inspiring People, Shape Your Life","url":"http://www.shapr.co/"},{"id":367,"dateAddedLocal":"9/12/2017, 1:11:10 PM","dateAddedUTC":"2017-09-12T17:11:10.000Z","index":7,"parentId":"1463","title":"13 Meetup Groups You Should Join If You're New To Code","url":"http://skillcrush.com/2015/02/17/13-tech-meetup-groups-for-beginners/"},{"id":384,"dateAddedLocal":"9/12/2017, 1:11:10 PM","dateAddedUTC":"2017-09-12T17:11:10.000Z","index":8,"parentId":"1463","title":"Namechk | Username, Domain & Trademark Search","url":"https://namechk.com/"},{"id":399,"dateAddedLocal":"9/12/2017, 1:11:10 PM","dateAddedUTC":"2017-09-12T17:11:10.000Z","index":9,"parentId":"1463","title":"What is a Full Stack developer? | Laurence Gellert's Blog","url":"http://www.laurencegellert.com/2012/08/what-is-a-full-stack-developer/"},{"id":1458,"dateAddedLocal":"3/14/2018, 8:20:52 AM","dateAddedUTC":"2018-03-14T12:20:52.130Z","index":8,"parentId":"364","title":"resume-cover-letter"},{"id":368,"dateAddedLocal":"9/12/2017, 1:11:10 PM","dateAddedUTC":"2017-09-12T17:11:10.000Z","index":0,"parentId":"1458","title":"15 Steps for Updating Your Resumé","url":"http://skillcrush.com/2014/07/30/15-steps-updating-resume/"},{"id":380,"dateAddedLocal":"9/12/2017, 1:11:10 PM","dateAddedUTC":"2017-09-12T17:11:10.000Z","index":1,"parentId":"1458","title":"Killer Cover Letters: Startup Edition - Levo","url":"https://www.levo.com/posts/killer-cover-letters-startup-edition"},{"id":371,"dateAddedLocal":"9/12/2017, 1:11:10 PM","dateAddedUTC":"2017-09-12T17:11:10.000Z","index":9,"parentId":"364","title":"Assignments format","url":"https://learn.co/tracks/career-prep/career-prep/the-job-search/welcome-to-career-prep"},{"id":382,"dateAddedLocal":"9/12/2017, 1:11:10 PM","dateAddedUTC":"2017-09-12T17:11:10.000Z","index":10,"parentId":"364","title":"Learn - Managing Your Job Search","url":"https://learn.co/tracks/career-prep/career-prep/effective-networking/cover-letters"},{"id":1320,"dateAddedLocal":"2/14/2018, 12:34:46 AM","dateAddedUTC":"2018-02-14T05:34:46.995Z","index":11,"parentId":"364","title":"Past Contests | Google Code Jam","url":"https://code.google.com/codejam/past-contests"},{"id":422,"dateAddedLocal":"2/9/2018, 5:47:29 PM","dateAddedUTC":"2018-02-09T22:47:29.703Z","index":3,"parentId":"300","title":"companies"},{"id":423,"dateAddedLocal":"1/2/2018, 12:03:51 AM","dateAddedUTC":"2018-01-02T05:03:51.000Z","index":0,"parentId":"422","title":"20 Best Ruby On Rails Developer jobs in Boston, MA (Hiring Now!) | Simply Hired","url":"https://www.simplyhired.com/search?q=ruby+on+rails+developer&l=boston%2C+ma&job=-xClrbWSpoDJ8SSmr4Sk4oNOf7FTJa9d01uk8xtu3d0bvp5PpoYzZQ"},{"id":424,"dateAddedLocal":"12/28/2017, 1:45:19 AM","dateAddedUTC":"2017-12-28T06:45:19.000Z","index":1,"parentId":"422","title":"Artaic - Custom Tile Made Simply Beautiful","url":"https://artaic.com/"},{"id":425,"dateAddedLocal":"1/1/2018, 11:16:47 PM","dateAddedUTC":"2018-01-02T04:16:47.000Z","index":2,"parentId":"422","title":"Boston Logic | Careers - Build with us. Learn with us. Grow with us.","url":"http://www.bostonlogic.com/careers/"},{"id":426,"dateAddedLocal":"9/12/2017, 1:11:10 PM","dateAddedUTC":"2017-09-12T17:11:10.000Z","index":3,"parentId":"422","title":"Boston Logic | Real Estate Marketing Automation Digital Software Suite","url":"http://www.bostonlogic.com/"},{"id":427,"dateAddedLocal":"1/4/2018, 9:26:24 PM","dateAddedUTC":"2018-01-05T02:26:24.000Z","index":4,"parentId":"422","title":"Careers - KAYAK","url":"https://www.kayak.com/careers"},{"id":428,"dateAddedLocal":"1/1/2018, 11:25:32 PM","dateAddedUTC":"2018-01-02T04:25:32.000Z","index":5,"parentId":"422","title":"Careers | Annkissam","url":"http://www.annkissam.com/careers"},{"id":429,"dateAddedLocal":"1/1/2018, 11:49:14 PM","dateAddedUTC":"2018-01-02T04:49:14.000Z","index":6,"parentId":"422","title":"Careers | Bullhorn","url":"https://www.bullhorn.com/careers/"},{"id":430,"dateAddedLocal":"1/1/2018, 11:22:45 PM","dateAddedUTC":"2018-01-02T04:22:45.000Z","index":7,"parentId":"422","title":"Careers | CollegeVine","url":"https://www.collegevine.com/about/careers/"},{"id":431,"dateAddedLocal":"1/1/2018, 11:58:44 PM","dateAddedUTC":"2018-01-02T04:58:44.000Z","index":8,"parentId":"422","title":"Careers – Careport Health","url":"https://careporthealth.com/careers/"},{"id":432,"dateAddedLocal":"1/1/2018, 11:09:06 PM","dateAddedUTC":"2018-01-02T04:09:06.000Z","index":9,"parentId":"422","title":"College Town Insider","url":"https://collegetowninsider.com/"},{"id":433,"dateAddedLocal":"9/12/2017, 1:11:10 PM","dateAddedUTC":"2017-09-12T17:11:10.000Z","index":10,"parentId":"422","title":"Customer Communication Management Solutions | Sefas","url":"http://sefas.com/"},{"id":434,"dateAddedLocal":"9/12/2017, 1:11:10 PM","dateAddedUTC":"2017-09-12T17:11:10.000Z","index":11,"parentId":"422","title":"EverQuote Careers, Job Openings | EverQuote.com","url":"https://www.everquote.com/careers/?p=job%2FoyJj5fwp"},{"id":435,"dateAddedLocal":"12/28/2017, 1:49:31 AM","dateAddedUTC":"2017-12-28T06:49:31.000Z","index":12,"parentId":"422","title":"Front End Developer - software / qa / dba / etc - job employment","url":"https://boston.craigslist.org/nos/sof/d/front-end-developer/6403883622.html"},{"id":436,"dateAddedLocal":"12/28/2017, 1:51:53 AM","dateAddedUTC":"2017-12-28T06:51:53.000Z","index":13,"parentId":"422","title":"Front End React.JS Developer - 110-120k + bonus - software / qa / dba / etc - job employment","url":"https://boston.craigslist.org/gbs/sof/d/front-end-reactjs-developerk/6423616316.html"},{"id":437,"dateAddedLocal":"12/28/2017, 1:52:38 AM","dateAddedUTC":"2017-12-28T06:52:38.000Z","index":14,"parentId":"422","title":"Full Stack Developer - software / qa / dba / etc - job employment","url":"https://boston.craigslist.org/gbs/sof/d/full-stack-developer/6402467848.html"},{"id":438,"dateAddedLocal":"1/1/2018, 11:13:35 PM","dateAddedUTC":"2018-01-02T04:13:35.000Z","index":15,"parentId":"422","title":"Full Stack Ruby on Rails Developer (API) | Elevano","url":"http://jobs.elevano.com/index.php?m=portal&a=details&jobOrderID=10049618&portalID=13401"},{"id":439,"dateAddedLocal":"1/1/2018, 11:14:38 PM","dateAddedUTC":"2018-01-02T04:14:38.000Z","index":16,"parentId":"422","title":"Good&Co Careers - Good & Co","url":"https://good.co/goodco-careers/"},{"id":440,"dateAddedLocal":"12/16/2017, 8:59:13 PM","dateAddedUTC":"2017-12-17T01:59:13.000Z","index":17,"parentId":"422","title":"HelloFresh | Careers - Front-end Engineer","url":"https://www.hellofresh.com/careers/listings/769156?country=us"},{"id":441,"dateAddedLocal":"1/1/2018, 11:25:24 PM","dateAddedUTC":"2018-01-02T04:25:24.000Z","index":18,"parentId":"422","title":"Helping Nonprofits with data management","url":"http://www.annkissam.com/about-us"},{"id":442,"dateAddedLocal":"9/12/2017, 1:11:10 PM","dateAddedUTC":"2017-09-12T17:11:10.000Z","index":19,"parentId":"422","title":"ideometry","url":"https://ideometry.com/"},{"id":443,"dateAddedLocal":"12/16/2017, 8:59:34 PM","dateAddedUTC":"2017-12-17T01:59:34.000Z","index":20,"parentId":"422","title":"iMarc - Jr. UX Engineer","url":"https://imarc.bamboohr.com/jobs/view.php?id=3"},{"id":444,"dateAddedLocal":"1/1/2018, 11:48:21 PM","dateAddedUTC":"2018-01-02T04:48:21.000Z","index":21,"parentId":"422","title":"Innovating from the Start | Bullhorn","url":"https://www.bullhorn.com/about/"},{"id":445,"dateAddedLocal":"1/4/2018, 8:59:49 PM","dateAddedUTC":"2018-01-05T01:59:49.000Z","index":22,"parentId":"422","title":"Intrepid Pursuits - Web Developer Apprentice","url":"https://jobs.lever.co/intrepid/70a89a60-8982-4d40-8188-5d19b6f6f20a"},{"id":446,"dateAddedLocal":"12/16/2017, 9:18:13 PM","dateAddedUTC":"2017-12-17T02:18:13.000Z","index":23,"parentId":"422","title":"Junior Software Engineer job at foodpanda | Monster.com","url":"https://job-openings.monster.com/Junior-Software-Engineer-Berlin-NH-US-foodpanda/31/44b6b678-e7a2-42bf-933a-9e8c172582a6"},{"id":447,"dateAddedLocal":"9/12/2017, 1:11:10 PM","dateAddedUTC":"2017-09-12T17:11:10.000Z","index":24,"parentId":"422","title":"Junior Web Developer at VC-Backed Startup","url":"http://jobpages.crowded.com/Junior-Web-Developer-at-VC-Backed-Startup2?subid=CL_Boston&cat=developers&platform=cl_39"},{"id":448,"dateAddedLocal":"1/1/2018, 11:56:18 PM","dateAddedUTC":"2018-01-02T04:56:18.000Z","index":25,"parentId":"422","title":"KoBoToolbox | Data Collection Tools for Challenging Environments","url":"http://www.kobotoolbox.org/"},{"id":449,"dateAddedLocal":"12/28/2017, 1:50:19 AM","dateAddedUTC":"2017-12-28T06:50:19.000Z","index":26,"parentId":"422","title":"MembersFirst, Inc. - Capturing the identity of your club through innovative digital experience","url":"https://www.membersfirst.com/"},{"id":450,"dateAddedLocal":"9/12/2017, 1:11:10 PM","dateAddedUTC":"2017-09-12T17:11:10.000Z","index":27,"parentId":"422","title":"My-Take","url":"https://my-take.com/company"},{"id":451,"dateAddedLocal":"9/12/2017, 1:11:10 PM","dateAddedUTC":"2017-09-12T17:11:10.000Z","index":28,"parentId":"422","title":"My-Take - Private Online Insight Communities","url":"https://my-take.com/"},{"id":452,"dateAddedLocal":"1/4/2018, 9:19:13 PM","dateAddedUTC":"2018-01-05T02:19:13.000Z","index":29,"parentId":"422","title":"Novartis Pharmaceuticals","url":"https://www.ziprecruiter.com/ojob/4fea45664b7d1e8a9313078ba30b7a36?u=wnuBW-XHcFquqMf_ehHQUQgw7R2Le1WFFP-4PPVyOIHTP6IzF9zRWA98QGuXOzktz0XfKmnl-KF1tddB7oFocvHd_afQu6-oTR3Y1WdpLP0WY6DX3EUThVMuhDv5UcUR9oUg0zYMkS83gXodo0tj4rOjpr0E4vrIqvTXf9telVkwNhWwriFYEMBGVU1q3B8SU9wUtAq2QrbdNqyL7vG8a5zYWRiVQRTrwvg_Ebl04mCkmtbbhNIiG31tde-yKPzuiqQgHkIOfRiPgen3Oi3H6DhGWLgVIKUAOUTMzVs2LejfvEEvbkHvHKRPDTfPSistB_JiacMBgiibyCmSFHmMUtd-FnWG78rlGIQfWqj7gT8Ok-XKYOGQQUtK8C8EZn1f__rYPsbGoSxSvUYgTa5R0WWMQjnrmuQu8GX_q6JP__CXbxiU1bLeLoCRR60A3pxGFzo6hsVgka7Zd64yywk5b9UTg3KD87OQ-pFMvtPaLh-35pyI011IiTang3A9dPxR85CyWTSEDP_ZmQowCuytN_yigYgvRIHQfFYh4U4SdID0JR1ToO6WMYYuP_ELA0WX39M9NQGIgyl1-7MbQyW7QpvxxlHSEs_acJ6WYSMB1A77dzwjsrX_Vv-QH3d7_ts7efcCCQ2mEvsPjqc-vDt0_PCZfqoevOzL8UtBUYy8R2-tWJ38avqR-rOkZOka_LvmjU9jnLw2MEXO8ptKWW3w4uyX8fiL2Mm-G-O_uABjkD8ZuAqQvYbT_US67b6deL-pQX4maEnnZYq0QRCo0NV2p3OdvL7WMAZzAK-y9r_Z8fMaFHIHja6PQk9ImFs2KmdrRlN24McQVmhLsbDfj8Qewm5Vr81yY7xti7GI2deJeORSP-tML4fut0I5yv0xUfhlEpwt9XMLiaXeoT1oH7mmvEVXKdYAg02UFGNSWTGPlVqhq0z9aogiQdnrCV8I3QLMOFxly1ClindMt8409KdicJunSgEvw5oj4TFCiUZFagSz8qgidT2RI1VZj4DUz60yvpcP6mgyDZnX92g60mhzPQ"},{"id":453,"dateAddedLocal":"9/12/2017, 1:11:10 PM","dateAddedUTC":"2017-09-12T17:11:10.000Z","index":30,"parentId":"422","title":"Now Hiring - Software Engineers | Multiple Openings| Revature.com","url":"https://revature.com/jobs/launch-technology-career/"},{"id":454,"dateAddedLocal":"9/12/2017, 1:11:10 PM","dateAddedUTC":"2017-09-12T17:11:10.000Z","index":31,"parentId":"422","title":"oneZero | Low-latency Software for Foreign Exchange, Commodities, and Futures Markets","url":"http://www.onezero.com/"},{"id":455,"dateAddedLocal":"12/28/2017, 1:49:51 AM","dateAddedUTC":"2017-12-28T06:49:51.000Z","index":32,"parentId":"422","title":"Raybeam, Inc. - Careers","url":"http://www.raybeam.com/#careers"},{"id":456,"dateAddedLocal":"9/12/2017, 1:11:10 PM","dateAddedUTC":"2017-09-12T17:11:10.000Z","index":33,"parentId":"422","title":"Ruby on Rails Developer - Boston Logic | Jobs.com","url":"http://job-openings.monster.com/monster/7b81b88f-74dc-40c5-8d11-875e273dea93?mescoid=1500129001001&jobPosition=6"},{"id":457,"dateAddedLocal":"9/12/2017, 1:11:10 PM","dateAddedUTC":"2017-09-12T17:11:10.000Z","index":34,"parentId":"422","title":"Stackry","url":"https://www.stackry.com/"},{"id":458,"dateAddedLocal":"9/12/2017, 1:11:10 PM","dateAddedUTC":"2017-09-12T17:11:10.000Z","index":35,"parentId":"422","title":"StartWire | Junior Web Applications Developer","url":"https://www.startwire.com/express_apply_jobs/MjEyNF9lOTJjNTg0OTA1NThiNTBjOWI2MjFiMGFjMTRhNjE1MF9sdXVhX2k=?source=ziprecruiter_l2"},{"id":459,"dateAddedLocal":"9/12/2017, 1:11:10 PM","dateAddedUTC":"2017-09-12T17:11:10.000Z","index":36,"parentId":"422","title":"StartWire | Ruby on Rails Developer","url":"http://www.startwire.com/express_apply_jobs/MjEyNF9lY2Q5NWI0ZThkYjdjNzc2NjUzMGI2NzBkOTljODc2MV9sdXVhX2k=?source=ziprecruiter_l2"},{"id":460,"dateAddedLocal":"12/28/2017, 1:48:06 AM","dateAddedUTC":"2017-12-28T06:48:06.000Z","index":37,"parentId":"422","title":"Teach Kids to Code! - web / html / info design - job employment","url":"https://boston.craigslist.org/bmw/web/d/teach-kids-to-code/6426944449.html"},{"id":461,"dateAddedLocal":"1/4/2018, 9:33:29 PM","dateAddedUTC":"2018-01-05T02:33:29.000Z","index":38,"parentId":"422","title":"Transperfect","url":"https://careers-transperfect.icims.com/jobs/8970/entry-level-web-developer/job"},{"id":462,"dateAddedLocal":"9/12/2017, 1:11:10 PM","dateAddedUTC":"2017-09-12T17:11:10.000Z","index":39,"parentId":"422","title":"Try RazorSync software for yourself and sign up for a free 30-day trial","url":"http://www.razorsync.com/free-trial/"},{"id":463,"dateAddedLocal":"9/12/2017, 1:11:10 PM","dateAddedUTC":"2017-09-12T17:11:10.000Z","index":40,"parentId":"422","title":"Web Developer Jobs in Bedford, MA | Glassdoor","url":"https://www.glassdoor.com/Job/bedford-web-developer-jobs-SRCH_IL.0,7_IC1154527_KO8,21_IP2.htm"},{"id":464,"dateAddedLocal":"9/12/2017, 1:11:10 PM","dateAddedUTC":"2017-09-12T17:11:10.000Z","index":41,"parentId":"422","title":"web developer ruby Jr jobs in Massachusetts (MA)","url":"http://www.jobvertise.com/jobs/search?query=porn+web+developer+ruby+Jr&city=&radius=30&state=MA&button=Search+Jobs"},{"id":465,"dateAddedLocal":"12/16/2017, 9:30:43 PM","dateAddedUTC":"2017-12-17T02:30:43.000Z","index":42,"parentId":"422","title":"Web Developer | Sociomantic Labs","url":"https://www.sociomantic.com/jobs/web-developer-css-specialist/#.WjXWylQ-eDU"},{"id":466,"dateAddedLocal":"1/2/2018, 12:07:14 AM","dateAddedUTC":"2018-01-02T05:07:14.000Z","index":43,"parentId":"422","title":"Welltok - Job Board","url":"http://welltok.applytojob.com/"},{"id":467,"dateAddedLocal":"2/7/2018, 12:57:59 AM","dateAddedUTC":"2018-02-07T05:57:59.000Z","index":44,"parentId":"422","title":"Careers - Tank Design","url":"https://tankdesign.com/careers/"},{"id":1367,"dateAddedLocal":"2/21/2018, 3:57:01 PM","dateAddedUTC":"2018-02-21T20:57:01.342Z","index":45,"parentId":"422","title":"MuckRock API","url":"https://www.muckrock.com/api/"},{"id":1368,"dateAddedLocal":"2/21/2018, 5:04:08 PM","dateAddedUTC":"2018-02-21T22:04:08.424Z","index":46,"parentId":"422","title":"Follain","url":"https://follain.com/careers"},{"id":1383,"dateAddedLocal":"2/27/2018, 11:40:22 PM","dateAddedUTC":"2018-02-28T04:40:22.923Z","index":47,"parentId":"422","title":"Jobs - thoughtbot","url":"https://thoughtbot.com/jobs"},{"id":1384,"dateAddedLocal":"2/27/2018, 11:40:53 PM","dateAddedUTC":"2018-02-28T04:40:53.595Z","index":48,"parentId":"422","title":"Pivotal","url":"https://pivotal.io/"},{"id":1483,"dateAddedLocal":"3/16/2018, 10:26:04 PM","dateAddedUTC":"2018-03-17T02:26:04.473Z","index":49,"parentId":"422","title":"Remote Ruby on Rails Developer job at Strategic IT Staffing | Monster.com","url":"https://job-openings.monster.com/Remote-Ruby-on-Rails-Developer-Boston-MA-US-Strategic-IT-Staffing/11/193702387?jvs=cf,can-21513,can,0&WT.mc_n=olm_sk_feed_restorationmedia"},{"id":470,"dateAddedLocal":"2/9/2018, 5:47:29 PM","dateAddedUTC":"2018-02-09T22:47:29.710Z","index":4,"parentId":"300","title":"_mentors"},{"id":471,"dateAddedLocal":"2/9/2018, 5:47:29 PM","dateAddedUTC":"2018-02-09T22:47:29.710Z","index":0,"parentId":"470","title":"machild"},{"id":472,"dateAddedLocal":"9/12/2017, 1:11:11 PM","dateAddedUTC":"2017-09-12T17:11:11.000Z","index":0,"parentId":"471","title":"CodeKit - THE Mac App For Web Developers","url":"https://codekitapp.com/"},{"id":473,"dateAddedLocal":"9/12/2017, 1:11:11 PM","dateAddedUTC":"2017-09-12T17:11:11.000Z","index":1,"parentId":"471","title":"Emmet — the essential toolkit for web-developers","url":"https://emmet.io/"},{"id":474,"dateAddedLocal":"9/12/2017, 1:11:11 PM","dateAddedUTC":"2017-09-12T17:11:11.000Z","index":2,"parentId":"471","title":"https://hipsum.co","url":"https://hipsum.co/"},{"id":475,"dateAddedLocal":"9/12/2017, 1:11:11 PM","dateAddedUTC":"2017-09-12T17:11:11.000Z","index":3,"parentId":"471","title":"Normalize.css: Make browsers render all elements more consistently.","url":"https://necolas.github.io/normalize.css/"},{"id":476,"dateAddedLocal":"9/12/2017, 1:11:11 PM","dateAddedUTC":"2017-09-12T17:11:11.000Z","index":4,"parentId":"471","title":"Raleway - Google Fonts","url":"https://fonts.google.com/specimen/Raleway"},{"id":478,"dateAddedLocal":"2/9/2018, 5:47:29 PM","dateAddedUTC":"2018-02-09T22:47:29.711Z","index":1,"parentId":"470","title":"uncle bob martin"},{"id":479,"dateAddedLocal":"9/12/2017, 1:11:11 PM","dateAddedUTC":"2017-09-12T17:11:11.000Z","index":0,"parentId":"478","title":"","url":"http://manifesto.softwarecraftsmanship.org/"},{"id":483,"dateAddedLocal":"9/12/2017, 1:11:10 PM","dateAddedUTC":"2017-09-12T17:11:10.000Z","index":2,"parentId":"470","title":"Sandi Metz","url":"https://www.sandimetz.com/speaking/"},{"id":480,"dateAddedLocal":"9/12/2017, 1:11:11 PM","dateAddedUTC":"2017-09-12T17:11:11.000Z","index":3,"parentId":"470","title":"Clean Coder","url":"https://sites.google.com/site/unclebobconsultingllc/"},{"id":484,"dateAddedLocal":"2/9/2018, 5:47:29 PM","dateAddedUTC":"2018-02-09T22:47:29.711Z","index":5,"parentId":"300","title":"_ntwk"},{"id":485,"dateAddedLocal":"9/12/2017, 1:11:10 PM","dateAddedUTC":"2017-09-12T17:11:10.000Z","index":0,"parentId":"484","title":"Boston Ruby Group","url":"http://bostonrb.org/"},{"id":486,"dateAddedLocal":"9/12/2017, 1:11:10 PM","dateAddedUTC":"2017-09-12T17:11:10.000Z","index":1,"parentId":"484","title":"CodeForBoston","url":"https://github.com/codeforboston/legalhousing"},{"id":489,"dateAddedLocal":"12/9/2017, 10:22:55 AM","dateAddedUTC":"2017-12-09T15:22:55.000Z","index":2,"parentId":"484","title":"Ken Steinberg - Cambridge Research & Development","url":"http://cambridgerad.com/"},{"id":490,"dateAddedLocal":"10/28/2017, 1:26:51 PM","dateAddedUTC":"2017-10-28T17:26:51.000Z","index":3,"parentId":"484","title":"projectJS","url":"https://trello.com/b/CPFK2AcL/projectjs-planning"},{"id":493,"dateAddedLocal":"2/6/2018, 1:33:48 PM","dateAddedUTC":"2018-02-06T18:33:48.000Z","index":4,"parentId":"484","title":"Ask a Dev","url":"https://askadev.org/#can-i-join"},{"id":330,"dateAddedLocal":"2/9/2018, 5:47:29 PM","dateAddedUTC":"2018-02-09T22:47:29.691Z","index":6,"parentId":"300","title":"_accts"},{"id":333,"dateAddedLocal":"9/12/2017, 1:11:09 PM","dateAddedUTC":"2017-09-12T17:11:09.000Z","index":0,"parentId":"330","title":"","url":"https://launchschool.com/blog/a-glimpse-into-the-launch-school-curriculum"},{"id":334,"dateAddedLocal":"9/12/2017, 1:11:09 PM","dateAddedUTC":"2017-09-12T17:11:09.000Z","index":1,"parentId":"330","title":"Amazon Web Services (AWS) - Cloud Computing Services","url":"https://aws.amazon.com/"},{"id":335,"dateAddedLocal":"12/3/2017, 10:02:17 PM","dateAddedUTC":"2017-12-04T03:02:17.000Z","index":2,"parentId":"330","title":"CodeFights","url":"https://codefights.com/"},{"id":336,"dateAddedLocal":"9/12/2017, 1:11:09 PM","dateAddedUTC":"2017-09-12T17:11:09.000Z","index":3,"parentId":"330","title":"Coursera","url":"https://www.coursera.org/"},{"id":337,"dateAddedLocal":"9/12/2017, 1:11:09 PM","dateAddedUTC":"2017-09-12T17:11:09.000Z","index":4,"parentId":"330","title":"edX","url":"https://courses.edx.org/u/SmithPiano"},{"id":338,"dateAddedLocal":"9/12/2017, 1:11:09 PM","dateAddedUTC":"2017-09-12T17:11:09.000Z","index":5,"parentId":"330","title":"envatostudio","url":"https://studio.envato.com/"},{"id":339,"dateAddedLocal":"9/12/2017, 1:11:09 PM","dateAddedUTC":"2017-09-12T17:11:09.000Z","index":6,"parentId":"330","title":"Git Video Tutorial - Derek Banas","url":"https://www.youtube.com/watch?v=r63f51ce84A"},{"id":340,"dateAddedLocal":"9/12/2017, 1:11:09 PM","dateAddedUTC":"2017-09-12T17:11:09.000Z","index":7,"parentId":"330","title":"Koans","url":"http://rubykoans.com/"},{"id":341,"dateAddedLocal":"9/12/2017, 1:11:09 PM","dateAddedUTC":"2017-09-12T17:11:09.000Z","index":8,"parentId":"330","title":"Learn Ruby The Hard Way","url":"http://learnrubythehardway.org/book/index.html"},{"id":342,"dateAddedLocal":"9/12/2017, 1:11:09 PM","dateAddedUTC":"2017-09-12T17:11:09.000Z","index":9,"parentId":"330","title":"MacProVideo: JavaScript 101","url":"https://www.macprovideo.com/tutorial/absolute-beginners-guide-to-javascript"},{"id":343,"dateAddedLocal":"9/12/2017, 1:11:09 PM","dateAddedUTC":"2017-09-12T17:11:09.000Z","index":10,"parentId":"330","title":"Nitrous Community","url":"https://community.nitrous.io/docs"},{"id":344,"dateAddedLocal":"9/12/2017, 1:11:09 PM","dateAddedUTC":"2017-09-12T17:11:09.000Z","index":11,"parentId":"330","title":"Pixabay","url":"https://pixabay.com/en/accounts/media/"},{"id":345,"dateAddedLocal":"9/12/2017, 1:11:09 PM","dateAddedUTC":"2017-09-12T17:11:09.000Z","index":12,"parentId":"330","title":"Podcasts To Help You Learn About Technology","url":"http://skillcrush.com/2014/01/07/best-podcasts-that-help-you-keep-up-technology/"},{"id":349,"dateAddedLocal":"9/12/2017, 1:11:09 PM","dateAddedUTC":"2017-09-12T17:11:09.000Z","index":13,"parentId":"330","title":"SitePoint","url":"https://www.sitepoint.com/"},{"id":350,"dateAddedLocal":"9/12/2017, 1:11:09 PM","dateAddedUTC":"2017-09-12T17:11:09.000Z","index":14,"parentId":"330","title":"The Ruby Toolbox - Welcome to the Ruby Toolbox, Brad!","url":"https://www.ruby-toolbox.com/account"},{"id":351,"dateAddedLocal":"9/12/2017, 1:11:09 PM","dateAddedUTC":"2017-09-12T17:11:09.000Z","index":15,"parentId":"330","title":"Udacity","url":"https://www.udacity.com/course/full-stack-foundations--ud088"},{"id":352,"dateAddedLocal":"9/12/2017, 1:11:09 PM","dateAddedUTC":"2017-09-12T17:11:09.000Z","index":16,"parentId":"330","title":"Udemy","url":"https://www.udemy.com/courses/"},{"id":313,"dateAddedLocal":"2/9/2018, 5:47:29 PM","dateAddedUTC":"2018-02-09T22:47:29.689Z","index":7,"parentId":"300","title":"_learn-videos"},{"id":314,"dateAddedLocal":"9/12/2017, 1:11:11 PM","dateAddedUTC":"2017-09-12T17:11:11.000Z","index":0,"parentId":"313","title":"* learn-verified | Learn.co Slack","url":"https://learn-co.slack.com/messages/learn-verified/team/smithwebtek/"},{"id":315,"dateAddedLocal":"9/12/2017, 1:11:11 PM","dateAddedUTC":"2017-09-12T17:11:11.000Z","index":1,"parentId":"313","title":"A guide explaining Learn-Verified Lectures","url":"https://gist.github.com/aviflombaum/423cd7ccec1531673704"},{"id":316,"dateAddedLocal":"9/12/2017, 1:11:11 PM","dateAddedUTC":"2017-09-12T17:11:11.000Z","index":2,"parentId":"313","title":"Learn Google Drive","url":"https://drive.google.com/folderview?id=0B-tirJPDhz8BYVE1R0gycTlNdjQ&usp=drive_web"},{"id":317,"dateAddedLocal":"9/12/2017, 1:11:11 PM","dateAddedUTC":"2017-09-12T17:11:11.000Z","index":3,"parentId":"313","title":"Learn Lectures (Recovered) - Google Docs","url":"https://docs.google.com/document/d/1PIxkXQK9sUrwc_zqeqIHuP-XXWm_U2TwvCjcAOu2Wog/edit?copiedFromTrash#heading=h.t1uh9nri9zbl"},{"id":318,"dateAddedLocal":"9/12/2017, 1:11:11 PM","dateAddedUTC":"2017-09-12T17:11:11.000Z","index":4,"parentId":"313","title":"Learn Lectures - Google Docs","url":"https://docs.google.com/document/d/1HgYcmBY4Yem9gbkx4dJr67wqTFfzBHLhV1_3BtX5-9U/edit"},{"id":319,"dateAddedLocal":"9/12/2017, 1:11:11 PM","dateAddedUTC":"2017-09-12T17:11:11.000Z","index":5,"parentId":"313","title":"Learn Lectures - Google Docs","url":"https://docs.google.com/document/d/1HgYcmBY4Yem9gbkx4dJr67wqTFfzBHLhV1_3BtX5-9U/edit#"},{"id":320,"dateAddedLocal":"9/12/2017, 1:11:11 PM","dateAddedUTC":"2017-09-12T17:11:11.000Z","index":6,"parentId":"313","title":"Learn Student Information","url":"https://drive.google.com/folderview?id=0B-tirJPDhz8BYVE1R0gycTlNdjQ&usp=drive_web"},{"id":321,"dateAddedLocal":"9/12/2017, 1:11:11 PM","dateAddedUTC":"2017-09-12T17:11:11.000Z","index":7,"parentId":"313","title":"Mountain West Ruby 2016 - Sharpening The Axe: Self-Teaching For Developers Aja Hammerly - YouTube","url":"https://www.youtube.com/watch?v=3Ee1WYl51TM&feature=youtu.be"},{"id":322,"dateAddedLocal":"9/12/2017, 1:11:11 PM","dateAddedUTC":"2017-09-12T17:11:11.000Z","index":8,"parentId":"313","title":"Ruby-006-videos.md","url":"https://gist.github.com/aviflombaum/2656242e0cb0243537dd"},{"id":323,"dateAddedLocal":"12/23/2017, 8:15:56 AM","dateAddedUTC":"2017-12-23T13:15:56.000Z","index":9,"parentId":"313","title":"snsavage/flatiron_study_groups: Notes from Flatiron School study groups.","url":"https://github.com/snsavage/flatiron_study_groups"},{"id":325,"dateAddedLocal":"9/12/2017, 1:11:11 PM","dateAddedUTC":"2017-09-12T17:11:11.000Z","index":10,"parentId":"313","title":"videos.md","url":"https://gist.github.com/aviflombaum/df6c9c68439de6873b55"},{"id":1189,"dateAddedLocal":"2/9/2018, 5:47:29 PM","dateAddedUTC":"2018-02-09T22:47:29.806Z","index":8,"parentId":"300","title":"listen"},{"id":1196,"dateAddedLocal":"11/14/2017, 12:08:13 PM","dateAddedUTC":"2017-11-14T17:08:13.000Z","index":0,"parentId":"1189","title":"WGIR","url":"https://www.iheart.com/live/wgir-am-610-2752/?autoplay=true&pname=15400&campid=header&cid=index.html"},{"id":1190,"dateAddedLocal":"11/14/2017, 10:27:37 AM","dateAddedUTC":"2017-11-14T15:27:37.000Z","index":1,"parentId":"1189","title":"Bill Evans - Village Vanguard","url":"https://www.youtube.com/watch?v=Nh4nXEiHpBw&list=PLhq_uu2458_xwfeisa6KZE7dyAAMdhYmk"},{"id":1191,"dateAddedLocal":"10/30/2017, 12:31:42 PM","dateAddedUTC":"2017-10-30T16:31:42.000Z","index":2,"parentId":"1189","title":"Binaural Beat","url":"https://www.youtube.com/watch?v=Qd3N_r0VUWQ&index=2&t=41706s&list=PL9w_rZsxQQNYNUCE8CX5SNNxWWw-YDquE"},{"id":1192,"dateAddedLocal":"11/14/2017, 10:26:37 AM","dateAddedUTC":"2017-11-14T15:26:37.000Z","index":3,"parentId":"1189","title":"Chopin - Nocturnes","url":"https://www.youtube.com/watch?v=liTSRH4fix4"},{"id":1193,"dateAddedLocal":"11/14/2017, 10:53:52 AM","dateAddedUTC":"2017-11-14T15:53:52.000Z","index":4,"parentId":"1189","title":"Debussy","url":"https://www.youtube.com/watch?v=qRZmdzCGLYw"},{"id":1194,"dateAddedLocal":"11/14/2017, 10:29:52 AM","dateAddedUTC":"2017-11-14T15:29:52.000Z","index":5,"parentId":"1189","title":"Glenn Gould - Goldberg 1981 ","url":"https://www.youtube.com/watch?v=aEkXet4WX_c"},{"id":1195,"dateAddedLocal":"12/19/2017, 11:11:02 AM","dateAddedUTC":"2017-12-19T16:11:02.000Z","index":6,"parentId":"1189","title":"This American Life","url":"https://www.thisamericanlife.org/"},{"id":1348,"dateAddedLocal":"2/21/2018, 3:35:38 AM","dateAddedUTC":"2018-02-21T08:35:38.476Z","index":9,"parentId":"300","title":"pod"},{"id":1350,"dateAddedLocal":"2/21/2018, 3:35:50 AM","dateAddedUTC":"2018-02-21T08:35:50.095Z","index":0,"parentId":"1348","title":"RR Episodes Archive - Devchat.tv","url":"https://devchat.tv/ruby-rogues"},{"id":1351,"dateAddedLocal":"2/21/2018, 3:35:55 AM","dateAddedUTC":"2018-02-21T08:35:55.295Z","index":1,"parentId":"1348","title":"NSScreencast: Bite-sized Screencasts for iOS Development","url":"http://nsscreencast.com/episodes"},{"id":1352,"dateAddedLocal":"2/21/2018, 3:36:03 AM","dateAddedUTC":"2018-02-21T08:36:03.883Z","index":2,"parentId":"1348","title":"CodeNewbie","url":"https://www.codenewbie.org/podcast"},{"id":1353,"dateAddedLocal":"2/21/2018, 3:36:39 AM","dateAddedUTC":"2018-02-21T08:36:39.178Z","index":3,"parentId":"1348","title":"HANSEL MINUTES","url":"https://hanselminutes.com/"},{"id":1354,"dateAddedLocal":"2/21/2018, 3:40:14 AM","dateAddedUTC":"2018-02-21T08:40:14.717Z","index":4,"parentId":"1348","title":"Mislav's blog","url":"https://mislav.net/blog/"},{"id":1356,"dateAddedLocal":"2/21/2018, 3:40:24 AM","dateAddedUTC":"2018-02-21T08:40:24.979Z","index":5,"parentId":"1348","title":"A List Apart: For People Who Make Websites","url":"http://alistapart.com/"},{"id":1357,"dateAddedLocal":"2/21/2018, 3:40:29 AM","dateAddedUTC":"2018-02-21T08:40:29.001Z","index":6,"parentId":"1348","title":"Joel on Software","url":"https://www.joelonsoftware.com/"},{"id":1359,"dateAddedLocal":"2/21/2018, 3:43:25 AM","dateAddedUTC":"2018-02-21T08:43:25.654Z","index":7,"parentId":"1348","title":"Crunch Daily | TechCrunch","url":"https://techcrunch.com/crunch-daily/"},{"id":1360,"dateAddedLocal":"2/21/2018, 3:43:31 AM","dateAddedUTC":"2018-02-21T08:43:31.820Z","index":8,"parentId":"1348","title":"You are seconds away from signing up for the hottest list in NYC Tech - AlleyWatch","url":"http://www.alleywatch.com/email/"},{"id":1361,"dateAddedLocal":"2/21/2018, 3:43:36 AM","dateAddedUTC":"2018-02-21T08:43:36.732Z","index":9,"parentId":"1348","title":"VentureBeat Newsletters | VentureBeat","url":"https://venturebeat.com/newsletters/"},{"id":1362,"dateAddedLocal":"2/21/2018, 3:43:41 AM","dateAddedUTC":"2018-02-21T08:43:41.741Z","index":10,"parentId":"1348","title":"Startup Digest | The personalized insider newsletter for all things startup in your area.","url":"https://www.startupdigest.com/"},{"id":1363,"dateAddedLocal":"2/21/2018, 3:43:45 AM","dateAddedUTC":"2018-02-21T08:43:45.770Z","index":11,"parentId":"1348","title":"Alley Coworking Community - Workspace and Services","url":"https://youralley.com/"},{"id":1364,"dateAddedLocal":"2/21/2018, 3:43:51 AM","dateAddedUTC":"2018-02-21T08:43:51.165Z","index":12,"parentId":"1348","title":"Hacker Newsletter - The Hacker News Newsletter","url":"http://www.hackernewsletter.com/"},{"id":1369,"dateAddedLocal":"2/22/2018, 10:35:17 AM","dateAddedUTC":"2018-02-22T15:35:17.984Z","index":13,"parentId":"1348","title":"Second Career Devs | Home","url":"https://secondcareerdevs.com/"},{"id":1370,"dateAddedLocal":"2/22/2018, 11:04:40 AM","dateAddedUTC":"2018-02-22T16:04:40.380Z","index":14,"parentId":"1348","title":"CS50 Video","url":"https://video.cs50.net/2017/fall/lectures/3?t=1h8m56s"},{"id":1283,"dateAddedLocal":"2/9/2018, 5:47:29 PM","dateAddedUTC":"2018-02-09T22:47:29.819Z","index":10,"parentId":"300","title":"network"},{"id":1284,"dateAddedLocal":"1/24/2018, 2:16:30 AM","dateAddedUTC":"2018-01-24T07:16:30.000Z","index":0,"parentId":"1283","title":"AngelList - Where the world meets startups","url":"https://angel.co/"},{"id":1285,"dateAddedLocal":"1/24/2018, 2:25:03 AM","dateAddedUTC":"2018-01-24T07:25:03.000Z","index":1,"parentId":"1283","title":"BuiltWith Technology Lookup","url":"https://builtwith.com/"},{"id":1286,"dateAddedLocal":"1/24/2018, 2:25:15 AM","dateAddedUTC":"2018-01-24T07:25:15.000Z","index":2,"parentId":"1283","title":"TechCrunch - The latest technology news and information on startups","url":"https://techcrunch.com/"},{"id":1287,"dateAddedLocal":"1/24/2018, 3:08:21 AM","dateAddedUTC":"2018-01-24T08:08:21.000Z","index":3,"parentId":"1283","title":"9 Things Interviewers Never Tell Job Candidates, But Should | LinkedIn","url":"https://www.linkedin.com/pulse/20140916123750-20017018-9-things-interviewers-never-tell-job-candidates-but-should/"},{"id":1186,"dateAddedLocal":"12/25/2016, 8:10:59 AM","dateAddedUTC":"2016-12-25T13:10:59.000Z","index":11,"parentId":"300","title":"","url":"https://learn-co.slack.com/messages/learn-verified/search/study%20groups/"},{"id":1187,"dateAddedLocal":"9/4/2016, 7:47:53 PM","dateAddedUTC":"2016-09-04T23:47:53.000Z","index":12,"parentId":"300","title":"","url":"https://www.youtube.com/user/bradsmithpiano"},{"id":418,"dateAddedLocal":"2/9/2018, 5:47:29 PM","dateAddedUTC":"2018-02-09T22:47:29.703Z","index":13,"parentId":"300","title":"rails-react-heroku"},{"id":421,"dateAddedLocal":"1/21/2018, 2:02:25 AM","dateAddedUTC":"2018-01-21T07:02:25.000Z","index":0,"parentId":"418","title":"Deploying a React App with Rails API to Heroku - Flatiron School","url":"http://alexandrawright.net/deploying_a_react_app_with_rails_api_to_heroku"},{"id":419,"dateAddedLocal":"1/21/2018, 2:01:38 AM","dateAddedUTC":"2018-01-21T07:01:38.000Z","index":1,"parentId":"418","title":"reactjs - How do I deploy a React app and a Rails API to Heroku? - Stack Overflow","url":"https://stackoverflow.com/questions/42657694/how-do-i-deploy-a-react-app-and-a-rails-api-to-heroku"},{"id":420,"dateAddedLocal":"1/21/2018, 2:02:04 AM","dateAddedUTC":"2018-01-21T07:02:04.000Z","index":2,"parentId":"418","title":"Deploying App to Heroku (Rails backend, React Frontend)","url":"https://codeburst.io/deploying-app-to-heroku-rails-backend-react-frontend-8f7e5c1ffc19"},{"id":1310,"dateAddedLocal":"2/12/2018, 10:53:38 PM","dateAddedUTC":"2018-02-13T03:53:38.697Z","index":3,"parentId":"418","title":"javascript - React Routing works in local machine but not Heroku - Stack Overflow","url":"https://stackoverflow.com/questions/41772411/react-routing-works-in-local-machine-but-not-heroku"},{"id":1311,"dateAddedLocal":"2/13/2018, 12:30:50 AM","dateAddedUTC":"2018-02-13T05:30:50.638Z","index":4,"parentId":"418","title":"node.js - React Routing works in locally but not Heroku - Stack Overflow","url":"https://stackoverflow.com/questions/44723509/react-routing-works-in-locally-but-not-heroku"},{"id":1197,"dateAddedLocal":"2/9/2018, 5:47:29 PM","dateAddedUTC":"2018-02-09T22:47:29.807Z","index":14,"parentId":"300","title":"msc"},{"id":1198,"dateAddedLocal":"2/9/2018, 5:47:29 PM","dateAddedUTC":"2018-02-09T22:47:29.807Z","index":0,"parentId":"1197","title":"glasses"},{"id":1199,"dateAddedLocal":"4/25/2017, 7:40:56 PM","dateAddedUTC":"2017-04-25T23:40:56.000Z","index":0,"parentId":"1198","title":"Amazon.com: RadTech OmniCleanz MultiPurpose Cleaner - 1oz Bottle with Wipe: Electronics","url":"https://www.amazon.com/gp/product/B000QDQ06E/ref=s9_dcacsd_dcoop_bw_c_x_3_w"},{"id":1200,"dateAddedLocal":"4/25/2017, 7:40:39 PM","dateAddedUTC":"2017-04-25T23:40:39.000Z","index":1,"parentId":"1198","title":"Online Eyeglasses & Sunglasses – Rx Glasses | Warby Parker","url":"https://www.warbyparker.com/?cvosrc=ppc.google.warby%20parker&network=g&mobile=&searchntwk=1&content=&creative=107175727648&adposition=1t1&placement=&target=&keyword=warby%20parker&matchtype=e&mkwid=sQwFlGtnS&pmt=e&pdv=c&product_category=&utm_source=google&utm_medium=cpc&utm_term=warby%20parker&utm_campaign=Google_Branded_Search_Alpha_US&cvo_campaign=Google_Branded_Search_Alpha_US&cvo_adgroup=warby+parker"},{"id":1202,"dateAddedLocal":"3/23/2016, 12:06:02 PM","dateAddedUTC":"2016-03-23T16:06:02.000Z","index":1,"parentId":"1197","title":"Animal minds | The Economist","url":"http://www.economist.com/news/essays/21676961-inner-lives-animals-are-hard-study-there-evidence-they-may-be-lot-richer-science-once-thought"},{"id":1203,"dateAddedLocal":"3/23/2016, 12:06:02 PM","dateAddedUTC":"2016-03-23T16:06:02.000Z","index":2,"parentId":"1197","title":"CuriosityStream","url":"https://app.curiositystream.com/"},{"id":1204,"dateAddedLocal":"3/24/2016, 10:27:23 AM","dateAddedUTC":"2016-03-24T14:27:23.000Z","index":3,"parentId":"1197","title":"Four Ways of Letting Go | by Ajahn Brahm - YouTube","url":"https://www.youtube.com/watch?v=USC5MJVZLy8&feature=youtu.be"},{"id":1205,"dateAddedLocal":"3/23/2016, 12:06:02 PM","dateAddedUTC":"2016-03-23T16:06:02.000Z","index":4,"parentId":"1197","title":"How important it is the way we live. (Insight on Alzheimer's) - YouTube","url":"https://www.youtube.com/watch?v=EeOHPZV4ZKI"},{"id":1206,"dateAddedLocal":"3/23/2016, 12:06:02 PM","dateAddedUTC":"2016-03-23T16:06:02.000Z","index":5,"parentId":"1197","title":"How to Avoid Anger? Sadhguru - YouTube","url":"https://www.youtube.com/watch?v=QAsJvKsd2Xk&feature=youtu.be"},{"id":1207,"dateAddedLocal":"3/23/2016, 12:06:02 PM","dateAddedUTC":"2016-03-23T16:06:02.000Z","index":6,"parentId":"1197","title":"Stop Being Dead Serious About Life - YouTube","url":"https://www.youtube.com/watch?v=cfsuose6EaM"},{"id":1209,"dateAddedLocal":"2/9/2018, 5:47:29 PM","dateAddedUTC":"2018-02-09T22:47:29.809Z","index":7,"parentId":"1197","title":"mus"},{"id":1210,"dateAddedLocal":"2/9/2018, 5:47:29 PM","dateAddedUTC":"2018-02-09T22:47:29.809Z","index":0,"parentId":"1209","title":"Aida"},{"id":1211,"dateAddedLocal":"8/30/2017, 4:44:27 PM","dateAddedUTC":"2017-08-30T20:44:27.000Z","index":0,"parentId":"1210","title":"Hoy Tengo Ganas De Ti (Original) - Miguel Gallardo - YouTube","url":"https://www.youtube.com/watch?v=itnXU5-jFXc"},{"id":1212,"dateAddedLocal":"8/30/2017, 4:37:07 PM","dateAddedUTC":"2017-08-30T20:37:07.000Z","index":1,"parentId":"1210","title":"Los Angeles Negros: Y Volveré - Jango","url":"http://www.jango.com/music/Los+Angeles+Negros"},{"id":1213,"dateAddedLocal":"8/30/2017, 4:47:40 PM","dateAddedUTC":"2017-08-30T20:47:40.000Z","index":2,"parentId":"1210","title":"Luis Fonsi - Despacito ft. Daddy Yankee - YouTube","url":"https://www.youtube.com/watch?v=kJQP7kiw5Fk"},{"id":1214,"dateAddedLocal":"8/30/2017, 5:42:06 PM","dateAddedUTC":"2017-08-30T21:42:06.000Z","index":3,"parentId":"1210","title":"Marc Anthony - Hipocresía - YouTube","url":"https://www.youtube.com/watch?v=cCt1qAML8ZQ"},{"id":1215,"dateAddedLocal":"8/30/2017, 4:39:14 PM","dateAddedUTC":"2017-08-30T20:39:14.000Z","index":4,"parentId":"1210","title":"Sabu, Hoy tengo ganas de tí: Letra y Acordes","url":"http://acordes.lacuerda.net/sabu/hoy_tengo_ganas_de_ti.shtml"},{"id":1216,"dateAddedLocal":"2/9/2018, 5:47:29 PM","dateAddedUTC":"2018-02-09T22:47:29.809Z","index":1,"parentId":"1209","title":"bands"},{"id":1217,"dateAddedLocal":"7/26/2017, 12:57:34 PM","dateAddedUTC":"2017-07-26T16:57:34.000Z","index":0,"parentId":"1216","title":"Dirty Loops Dirty Loops - Official Website","url":"http://www.dirty-loops.com/"},{"id":1218,"dateAddedLocal":"4/22/2016, 10:51:49 AM","dateAddedUTC":"2016-04-22T14:51:49.000Z","index":1,"parentId":"1216","title":"TOUR DATES | Kardia","url":"http://kardiaband.com/?page_id=54"},{"id":1219,"dateAddedLocal":"2/9/2018, 5:47:29 PM","dateAddedUTC":"2018-02-09T22:47:29.810Z","index":2,"parentId":"1209","title":"career"},{"id":1220,"dateAddedLocal":"9/12/2016, 12:13:42 AM","dateAddedUTC":"2016-09-12T04:13:42.000Z","index":0,"parentId":"1219","title":"Berklee College of Music External Career","url":"https://berklee.silkroad.com/epostings/index.cfm?fuseaction=app.jobinfo&jobid=980&source=ONLINE&JobOwner=992479&company_id=16215&version=1&byBusinessUnit=NULL&bycountry=1&bystate=1&byRegion=US_MA&bylocation=US&keywords=&byCat=&proximityCountry=&postalCode=&radiusDistance=&isKilometers=&tosearch=yes&city="},{"id":1221,"dateAddedLocal":"2/9/2018, 5:47:29 PM","dateAddedUTC":"2018-02-09T22:47:29.810Z","index":3,"parentId":"1209","title":"cirque"},{"id":1222,"dateAddedLocal":"7/29/2017, 9:51:58 AM","dateAddedUTC":"2017-07-29T13:51:58.000Z","index":0,"parentId":"1221","title":"Cirque du Soleil | Casting","url":"http://en.ext.casting.cirquedusoleil.com/"},{"id":1223,"dateAddedLocal":"2/9/2018, 5:47:29 PM","dateAddedUTC":"2018-02-09T22:47:29.810Z","index":4,"parentId":"1209","title":"keyboard rig"},{"id":1224,"dateAddedLocal":"5/28/2015, 6:54:46 AM","dateAddedUTC":"2015-05-28T10:54:46.000Z","index":0,"parentId":"1223","title":"510 - Light Weight Composite Panels - 510 - Laminate Panels - TCH","url":"http://www.tchweb.com/tchstore/category/composite-laminate/s0/510---Light-Weight-Composite-Panels.html"},{"id":1225,"dateAddedLocal":"7/10/2017, 12:12:44 AM","dateAddedUTC":"2017-07-10T04:12:44.000Z","index":1,"parentId":"1223","title":"Crumar Mojo vs. 1956 Hammond B3 - YouTube","url":"https://www.youtube.com/watch?v=rrpKiB9Fa94"},{"id":1226,"dateAddedLocal":"3/26/2017, 10:01:06 AM","dateAddedUTC":"2017-03-26T14:01:06.000Z","index":2,"parentId":"1223","title":"D5C_4571 | So my KeyB Duo Mark III never came after waiting … | Flickr","url":"https://www.flickr.com/photos/jrsone/8048855779/in/album-72157628753374687/"},{"id":1227,"dateAddedLocal":"7/10/2017, 12:14:22 AM","dateAddedUTC":"2017-07-10T04:14:22.000Z","index":3,"parentId":"1223","title":"Just Another Blues, because I can - Frank Montis (Crumar Mojo) - YouTube","url":"https://www.youtube.com/watch?v=OUd5Efu8R7k"},{"id":1228,"dateAddedLocal":"3/26/2017, 10:03:17 AM","dateAddedUTC":"2017-03-26T14:03:17.000Z","index":4,"parentId":"1223","title":"Making old organs more portable with MIDI | Hackaday","url":"http://hackaday.com/2012/04/24/making-old-organs-more-portable-with-midi/"},{"id":1229,"dateAddedLocal":"3/26/2017, 10:12:06 AM","dateAddedUTC":"2017-03-26T14:12:06.000Z","index":5,"parentId":"1223","title":"Raspberry Pi • View topic - Pipedal","url":"https://www.raspberrypi.org/forums/viewtopic.php?f=41&t=136985"},{"id":1230,"dateAddedLocal":"5/28/2015, 7:07:13 AM","dateAddedUTC":"2015-05-28T11:07:13.000Z","index":6,"parentId":"1223","title":"Shipping & Carrying Case Hardware Parts","url":"http://www.starcase.com/casehardwareparts.htm"},{"id":1231,"dateAddedLocal":"2/9/2018, 5:47:29 PM","dateAddedUTC":"2018-02-09T22:47:29.811Z","index":5,"parentId":"1209","title":"Listen"},{"id":1232,"dateAddedLocal":"12/5/2015, 8:28:50 AM","dateAddedUTC":"2015-12-05T13:28:50.000Z","index":0,"parentId":"1231","title":"1000 Recordings to Hear Before You Die (Tom Moon's list) | Listology","url":"http://www.listology.com/betaylor73/list/1000-recordings-hear-you-die-tom-moons-list"},{"id":1233,"dateAddedLocal":"11/28/2015, 6:36:19 PM","dateAddedUTC":"2015-11-28T23:36:19.000Z","index":1,"parentId":"1231","title":"Bill Evans - The Complete Village Vanguard Recordings, 1961: All Of You (Take 1) - YouTube","url":"https://www.youtube.com/watch?v=Nh4nXEiHpBw&list=PLhq_uu2458_xwfeisa6KZE7dyAAMdhYmk"},{"id":1234,"dateAddedLocal":"2/15/2016, 8:27:04 AM","dateAddedUTC":"2016-02-15T13:27:04.000Z","index":2,"parentId":"1231","title":"Glenn Gould  1955 Goldberg Variations","url":"https://www.youtube.com/watch?v=Ah392lnFHxM"},{"id":1235,"dateAddedLocal":"2/15/2016, 8:28:12 AM","dateAddedUTC":"2016-02-15T13:28:12.000Z","index":3,"parentId":"1231","title":"Glenn Gould - 1980 Goldberg Variation","url":"https://www.youtube.com/watch?v=CrPrJ0ih8Kc"},{"id":1236,"dateAddedLocal":"11/29/2015, 1:57:38 PM","dateAddedUTC":"2015-11-29T18:57:38.000Z","index":4,"parentId":"1231","title":"Glenn Gould - Goldberg Variations (1981) ","url":"https://www.youtube.com/watch?v=aEkXet4WX_c"},{"id":1237,"dateAddedLocal":"11/28/2015, 6:33:06 PM","dateAddedUTC":"2015-11-28T23:33:06.000Z","index":5,"parentId":"1231","title":"Glenn Gould 1932 - 1982 Bach Toccatas BWV 910 - 916.wmv - YouTube","url":"https://www.youtube.com/watch?v=JNjNuQJG9xY"},{"id":1238,"dateAddedLocal":"1/19/2016, 1:46:03 PM","dateAddedUTC":"2016-01-19T18:46:03.000Z","index":6,"parentId":"1231","title":"Listen to WGIR AM 610 Radio Live | Stream Online Free | iHeartRadio","url":"http://www.iheart.com/live/wgir-am-610-2752/"},{"id":1239,"dateAddedLocal":"7/26/2017, 12:57:25 PM","dateAddedUTC":"2017-07-26T16:57:25.000Z","index":7,"parentId":"1231","title":"Pretty Simple Music, LLC","url":"https://www.prettysimplemusic.com/"},{"id":1240,"dateAddedLocal":"12/1/2015, 7:40:40 PM","dateAddedUTC":"2015-12-02T00:40:40.000Z","index":8,"parentId":"1231","title":"Richter Bach The Well-Tempered Clavier Book BWV 846 - 893.wmv & bonus - YouTube","url":"https://www.youtube.com/watch?v=Ej5rGGTHy54"},{"id":1241,"dateAddedLocal":"7/26/2017, 12:56:47 PM","dateAddedUTC":"2017-07-26T16:56:47.000Z","index":9,"parentId":"1231","title":"The Art of Synth Soloing: Cory Henry’s “Lingus” Solo | KeyboardMag","url":"http://www.keyboardmag.com/lessons/1251/the-art-of-synth-soloing---cory-henrys-lingus-solo/62901"},{"id":1242,"dateAddedLocal":"2/9/2018, 5:47:29 PM","dateAddedUTC":"2018-02-09T22:47:29.813Z","index":6,"parentId":"1209","title":"logic pro x"},{"id":1243,"dateAddedLocal":"8/1/2017, 10:48:34 AM","dateAddedUTC":"2017-08-01T14:48:34.000Z","index":0,"parentId":"1242","title":"logic pro tutorial - - Yahoo Video Search Results","url":"https://video.search.yahoo.com/yhs/search?fr=yhs-blp-default&hsimp=yhs-default&hspart=blp&p=logic+pro+tutorial#id=1&vid=ea2800ca1b30286dd835139259b7199f&action=click"},{"id":1244,"dateAddedLocal":"8/4/2017, 8:53:06 AM","dateAddedUTC":"2017-08-04T12:53:06.000Z","index":1,"parentId":"1242","title":"MainStage 3 Tips - Record MainStage Patches In Logic - YouTube","url":"https://www.youtube.com/watch?v=XpjfQIVEaKQ"},{"id":1245,"dateAddedLocal":"8/2/2017, 9:50:22 AM","dateAddedUTC":"2017-08-02T13:50:22.000Z","index":2,"parentId":"1242","title":"MPCC-sq6 —","url":"http://advancedmusicproduction.com/mpcc-sq-6/"},{"id":1246,"dateAddedLocal":"8/1/2017, 10:49:07 AM","dateAddedUTC":"2017-08-01T14:49:07.000Z","index":3,"parentId":"1242","title":"percusionfundamentals of latin music for the rhythm section - poncho sanchez - YouTube","url":"https://www.youtube.com/watch?v=0j23EFFzFF8&t=268s"},{"id":1247,"dateAddedLocal":"8/20/2017, 11:19:47 AM","dateAddedUTC":"2017-08-20T15:19:47.000Z","index":4,"parentId":"1242","title":"Tutorial: Recording Multiple MIDI Controllers In Logic - YouTube","url":"https://www.youtube.com/watch?v=Ck7mF7B0YXw&t=335s"},{"id":1248,"dateAddedLocal":"2/9/2018, 5:47:29 PM","dateAddedUTC":"2018-02-09T22:47:29.814Z","index":7,"parentId":"1209","title":"mainstage"},{"id":1249,"dateAddedLocal":"8/4/2017, 8:53:15 AM","dateAddedUTC":"2017-08-04T12:53:15.000Z","index":0,"parentId":"1248","title":"Synthsation Vol 1 For Logic Pro X/MainStage 3 (Full demo) - YouTube","url":"https://www.youtube.com/watch?v=iTEhlXzxgY8"},{"id":1250,"dateAddedLocal":"2/9/2018, 5:47:29 PM","dateAddedUTC":"2018-02-09T22:47:29.814Z","index":8,"parentId":"1209","title":"sheetmusic"},{"id":1251,"dateAddedLocal":"7/8/2017, 9:52:34 AM","dateAddedUTC":"2017-07-08T13:52:34.000Z","index":0,"parentId":"1250","title":"CLASSICA(land): How to download files?","url":"http://classicaland.com/texts/how-to-download.asp"},{"id":1252,"dateAddedLocal":"7/8/2017, 9:42:37 AM","dateAddedUTC":"2017-07-08T13:42:37.000Z","index":1,"parentId":"1250","title":"CLASSICA(land): Sheet Music Books Archive in PDF format. Classical music.","url":"http://classicaland.com/"},{"id":1253,"dateAddedLocal":"7/10/2017, 12:44:15 PM","dateAddedUTC":"2017-07-10T16:44:15.000Z","index":2,"parentId":"1250","title":"File:J.S. Bach - The Well-Tempered Clavier, Book 1 - OpenWTC.pdf - Wikimedia Commons","url":"https://commons.wikimedia.org/wiki/File:J.S._Bach_-_The_Well-Tempered_Clavier,_Book_1_-_OpenWTC.pdf"},{"id":1254,"dateAddedLocal":"7/8/2017, 9:12:07 AM","dateAddedUTC":"2017-07-08T13:12:07.000Z","index":3,"parentId":"1250","title":"IMSLP/Petrucci Music Library: Free Public Domain Sheet Music","url":"http://imslp.org/"},{"id":1255,"dateAddedLocal":"7/8/2017, 9:50:57 AM","dateAddedUTC":"2017-07-08T13:50:57.000Z","index":4,"parentId":"1250","title":"Kunstderfuge Panel of 17848 / BradSmith","url":"http://www.kunstderfuge.com/-/db/panel.asp"},{"id":1256,"dateAddedLocal":"10/17/2015, 12:09:40 AM","dateAddedUTC":"2015-10-17T04:09:40.000Z","index":5,"parentId":"1250","title":"SCRIBD","url":"https://www.scribd.com/"},{"id":1257,"dateAddedLocal":"2/9/2018, 5:47:29 PM","dateAddedUTC":"2018-02-09T22:47:29.815Z","index":9,"parentId":"1209","title":"ship"},{"id":1258,"dateAddedLocal":"7/13/2017, 2:17:33 AM","dateAddedUTC":"2017-07-13T06:17:33.000Z","index":0,"parentId":"1257","title":"Amazon.com: SKB 2SKB-R5017W","url":"https://www.amazon.com/s/ref=nb_sb_noss?url=search-alias%3Daps&field-keywords=SKB+2SKB-R5017W"},{"id":1259,"dateAddedLocal":"6/24/2017, 3:24:05 PM","dateAddedUTC":"2017-06-24T19:24:05.000Z","index":1,"parentId":"1257","title":"Blackburn","url":"http://www.blackburninternational.com/about_us"},{"id":1260,"dateAddedLocal":"6/24/2017, 3:23:13 PM","dateAddedUTC":"2017-06-24T19:23:13.000Z","index":2,"parentId":"1257","title":"Cruise Ship Musicians & Entertainers | Landau Music","url":"http://www.landaumusic.com/"},{"id":1261,"dateAddedLocal":"7/7/2017, 5:19:47 PM","dateAddedUTC":"2017-07-07T21:19:47.000Z","index":3,"parentId":"1257","title":"David Carter","url":"http://www.davidcarter.biz/"},{"id":1262,"dateAddedLocal":"6/24/2017, 3:22:54 PM","dateAddedUTC":"2017-06-24T19:22:54.000Z","index":4,"parentId":"1257","title":"Flagship Entertainment | Cruise Ship Musicians | Jobs & Auditions","url":"http://www.flagshipentertainment.co/"},{"id":1263,"dateAddedLocal":"7/7/2017, 8:19:43 PM","dateAddedUTC":"2017-07-08T00:19:43.000Z","index":5,"parentId":"1257","title":"Home | John Hinchey","url":"https://hincheymusic.com/"},{"id":1264,"dateAddedLocal":"6/24/2017, 3:23:54 PM","dateAddedUTC":"2017-06-24T19:23:54.000Z","index":6,"parentId":"1257","title":"mmec","url":"http://mmec.com/home"},{"id":1265,"dateAddedLocal":"6/24/2017, 3:19:45 PM","dateAddedUTC":"2017-06-24T19:19:45.000Z","index":7,"parentId":"1257","title":"Proship Entertainment - Your #1 worldwide resource of musicians, entertainers, bands, dancers and technical staff for your event or entertainment venue.","url":"http://www.proship.com/"},{"id":1266,"dateAddedLocal":"6/25/2017, 8:49:29 AM","dateAddedUTC":"2017-06-25T12:49:29.000Z","index":8,"parentId":"1257","title":"STCW Courses -- New England Maritime","url":"http://www.nemaritime.com/safety.html"},{"id":1267,"dateAddedLocal":"7/7/2017, 5:17:56 PM","dateAddedUTC":"2017-07-07T21:17:56.000Z","index":9,"parentId":"1257","title":"Studio Orchestrations Case Study - Nicola Benedetti","url":"http://www.studio-orchestrations.com/nicola-benedetti"},{"id":1268,"dateAddedLocal":"6/24/2017, 3:20:28 PM","dateAddedUTC":"2017-06-24T19:20:28.000Z","index":10,"parentId":"1257","title":"Suman Entertainment Group | Cruise Ship & Land Entertainment","url":"http://sumanent.com/"},{"id":1269,"dateAddedLocal":"6/24/2017, 3:24:56 PM","dateAddedUTC":"2017-06-24T19:24:56.000Z","index":11,"parentId":"1257","title":"The Cruise Ship Gig – Jon Kratzer","url":"http://jonkratzer.com/cruiseships/"},{"id":1270,"dateAddedLocal":"6/24/2017, 3:23:48 PM","dateAddedUTC":"2017-06-24T19:23:48.000Z","index":12,"parentId":"1257","title":"www.oceanbound.com","url":"http://www.oceanbound.com/"},{"id":1271,"dateAddedLocal":"2/9/2018, 5:47:29 PM","dateAddedUTC":"2018-02-09T22:47:29.817Z","index":10,"parentId":"1209","title":"sibelius"},{"id":1272,"dateAddedLocal":"8/5/2017, 2:17:11 PM","dateAddedUTC":"2017-08-05T18:17:11.000Z","index":0,"parentId":"1271","title":"Sibelius 7/8 Tips, Tricks & Shortcuts for a Faster Workflow - YouTube","url":"https://www.youtube.com/watch?v=b5PgcOlh5w0"},{"id":1273,"dateAddedLocal":"2/9/2018, 5:47:29 PM","dateAddedUTC":"2018-02-09T22:47:29.817Z","index":11,"parentId":"1209","title":"teaching"},{"id":1274,"dateAddedLocal":"4/21/2016, 7:28:25 AM","dateAddedUTC":"2016-04-21T11:28:25.000Z","index":0,"parentId":"1273","title":"Best iPad apps for piano teachers - timtopham.com","url":"https://timtopham.com/blog/best-ipad-apps-for-piano-teachers/"},{"id":1275,"dateAddedLocal":"8/22/2015, 6:56:30 PM","dateAddedUTC":"2015-08-22T22:56:30.000Z","index":1,"parentId":"1273","title":"How to Sight-Read Music: 5 Steps to Mastering Sight-Reading | jazzadvice.com","url":"http://www.jazzadvice.com/5-steps-to-mastering-sight-reading/"},{"id":1276,"dateAddedLocal":"5/8/2017, 6:01:55 AM","dateAddedUTC":"2017-05-08T10:01:55.000Z","index":2,"parentId":"1273","title":"Online Ear Training with Intervals, Melodies, and Jazz Chord Progressions | IWasDoingAllRight","url":"https://www.iwasdoingallright.com/tools/ear_training/online/#"},{"id":1277,"dateAddedLocal":"5/8/2017, 5:57:05 AM","dateAddedUTC":"2017-05-08T09:57:05.000Z","index":3,"parentId":"1273","title":"Online Polyrhythm Generator","url":"https://mynoise.net/NoiseMachines/polyrhythmBeatGenerator.php"},{"id":1278,"dateAddedLocal":"5/8/2017, 5:54:15 AM","dateAddedUTC":"2017-05-08T09:54:15.000Z","index":4,"parentId":"1273","title":"Random Rhythm Reader","url":"http://insidemusicteaching.com/random-rhythm-reader/"},{"id":1279,"dateAddedLocal":"6/13/2016, 6:40:43 AM","dateAddedUTC":"2016-06-13T10:40:43.000Z","index":5,"parentId":"1273","title":"Sight Reading","url":"http://www.soundswell.co.uk/pages/swsightr.htm"},{"id":1280,"dateAddedLocal":"5/8/2017, 5:53:10 AM","dateAddedUTC":"2017-05-08T09:53:10.000Z","index":6,"parentId":"1273","title":"Sight Reading with Practice Sight Reading.com","url":"https://practicesightreading.com/index.php"},{"id":1281,"dateAddedLocal":"5/8/2017, 6:09:09 AM","dateAddedUTC":"2017-05-08T10:09:09.000Z","index":7,"parentId":"1273","title":"♫ Tony-b Machine ♫","url":"http://www.tony-b.org/?tbm=4"},{"id":1282,"dateAddedLocal":"9/4/2017, 1:17:24 PM","dateAddedUTC":"2017-09-04T17:17:24.000Z","index":12,"parentId":"1209","title":"Sight Reading Fundamentals","url":"http://fundamentals-of-piano-practice.readthedocs.io/en/latest/chapter1/ch1_topics/III.11.html"},{"id":1208,"dateAddedLocal":"1/14/2018, 1:21:20 AM","dateAddedUTC":"2018-01-14T06:21:20.000Z","index":15,"parentId":"300","title":"ActiveAdmin","url":"https://medium.com/superhighfives/a-top-shelf-web-stack-rails-5-api-activeadmin-create-react-app-de5481b7ec0b"},{"id":1288,"dateAddedLocal":"9/12/2017, 1:11:10 PM","dateAddedUTC":"2017-09-12T17:11:10.000Z","index":16,"parentId":"300","title":"Mac cmd","url":"https://github.com/0nn0/terminal-mac-cheatsheet"},{"id":1289,"dateAddedLocal":"1/29/2018, 7:24:10 PM","dateAddedUTC":"2018-01-30T00:24:10.000Z","index":17,"parentId":"300","title":"RailsAPI/React","url":"https://www.fullstackreact.com/articles/how-to-get-create-react-app-to-work-with-your-rails-api/"},{"id":1489,"dateAddedLocal":"3/31/2017, 11:36:23 AM","dateAddedUTC":"2017-03-31T15:36:23.000Z","index":18,"parentId":"300","title":"Learn","url":"https://learn.co/tracks/full-stack-web-dev-with-react"},{"id":311,"dateAddedLocal":"2/9/2018, 5:47:29 PM","dateAddedUTC":"2018-02-09T22:47:29.689Z","index":4,"parentId":"1","title":"tek"},{"id":582,"dateAddedLocal":"2/9/2018, 5:47:29 PM","dateAddedUTC":"2018-02-09T22:47:29.724Z","index":0,"parentId":"311","title":"accessibility"},{"id":583,"dateAddedLocal":"9/12/2017, 1:11:10 PM","dateAddedUTC":"2017-09-12T17:11:10.000Z","index":0,"parentId":"582","title":"The A11Y Project","url":"http://a11yproject.com/"},{"id":584,"dateAddedLocal":"9/12/2017, 1:11:10 PM","dateAddedUTC":"2017-09-12T17:11:10.000Z","index":1,"parentId":"582","title":"Welcome to A11y.me! | Accessibility & Me","url":"http://a11y.me/"},{"id":585,"dateAddedLocal":"2/9/2018, 5:47:29 PM","dateAddedUTC":"2018-02-09T22:47:29.724Z","index":1,"parentId":"311","title":"administration"},{"id":586,"dateAddedLocal":"9/12/2017, 1:11:11 PM","dateAddedUTC":"2017-09-12T17:11:11.000Z","index":0,"parentId":"585","title":"Active Admin","url":"https://github.com/activeadmin/activeadmin"},{"id":587,"dateAddedLocal":"10/25/2017, 12:21:46 AM","dateAddedUTC":"2017-10-25T04:21:46.000Z","index":1,"parentId":"585","title":"justinfrench/formtastic: A Rails form builder plugin with semantically rich and accessible markup.","url":"https://github.com/justinfrench/formtastic"},{"id":588,"dateAddedLocal":"2/9/2018, 5:47:29 PM","dateAddedUTC":"2018-02-09T22:47:29.724Z","index":2,"parentId":"311","title":"algorithms"},{"id":589,"dateAddedLocal":"11/30/2017, 1:42:55 PM","dateAddedUTC":"2017-11-30T18:42:55.000Z","index":0,"parentId":"588","title":"Largest Sum Contiguous Subarray - GeeksforGeeks","url":"http://www.geeksforgeeks.org/largest-sum-contiguous-subarray/"},{"id":590,"dateAddedLocal":"2/9/2018, 5:47:29 PM","dateAddedUTC":"2018-02-09T22:47:29.725Z","index":3,"parentId":"311","title":"amazon"},{"id":591,"dateAddedLocal":"9/12/2017, 1:11:10 PM","dateAddedUTC":"2017-09-12T17:11:10.000Z","index":0,"parentId":"590","title":"(1) Introduction to AWS EC2 - How to deploy a Rails App to EC2 for the first time - YouTube","url":"https://www.youtube.com/watch?v=jFBbcleSPoY"},{"id":592,"dateAddedLocal":"1/23/2018, 3:28:11 PM","dateAddedUTC":"2018-01-23T20:28:11.000Z","index":1,"parentId":"590","title":"AWS in Plain English","url":"https://www.expeditedssl.com/aws-in-plain-english"},{"id":1506,"dateAddedLocal":"3/26/2018, 5:22:01 PM","dateAddedUTC":"2018-03-26T21:22:01.695Z","index":2,"parentId":"590","title":"Getting Started with AWS | Amazon Web Services BASICS - YouTube","url":"https://www.youtube.com/watch?v=ubCNZRNjhyo"},{"id":593,"dateAddedLocal":"2/9/2018, 5:47:29 PM","dateAddedUTC":"2018-02-09T22:47:29.725Z","index":4,"parentId":"311","title":"analytics"},{"id":594,"dateAddedLocal":"9/12/2017, 1:11:10 PM","dateAddedUTC":"2017-09-12T17:11:10.000Z","index":0,"parentId":"593","title":"Analytics API and Customer Data Platform | Segment","url":"https://segment.com/"},{"id":595,"dateAddedLocal":"9/12/2017, 1:11:10 PM","dateAddedUTC":"2017-09-12T17:11:10.000Z","index":1,"parentId":"593","title":"Audience Overview - Analytics","url":"https://analytics.google.com/analytics/web/#report/defaultid/a38216775w66803952p68711783/"},{"id":596,"dateAddedLocal":"9/12/2017, 1:11:10 PM","dateAddedUTC":"2017-09-12T17:11:10.000Z","index":2,"parentId":"593","title":"Heap | Mobile and Web Analytics","url":"https://heapanalytics.com/?utm_source=adwords&utm_medium=keyword&utm_campaign=cpc_text&utm_term=heap%20analytics"},{"id":597,"dateAddedLocal":"9/12/2017, 1:11:10 PM","dateAddedUTC":"2017-09-12T17:11:10.000Z","index":3,"parentId":"593","title":"Mixpanel | Product analytics for mobile, web, and beyond","url":"https://mixpanel.com/"},{"id":598,"dateAddedLocal":"9/12/2017, 1:11:10 PM","dateAddedUTC":"2017-09-12T17:11:10.000Z","index":4,"parentId":"593","title":"Weather Forecast & Reports - Long Range & Local | Wunderground | Weather Underground","url":"https://www.wunderground.com/"},{"id":1382,"dateAddedLocal":"2/27/2018, 6:08:36 PM","dateAddedUTC":"2018-02-27T23:08:36.200Z","index":5,"parentId":"311","title":"angular"},{"id":1381,"dateAddedLocal":"2/27/2018, 6:08:12 PM","dateAddedUTC":"2018-02-27T23:08:12.190Z","index":0,"parentId":"1382","title":"Angular - QuickStart","url":"https://angular.io/guide/quickstart"},{"id":599,"dateAddedLocal":"2/9/2018, 5:47:29 PM","dateAddedUTC":"2018-02-09T22:47:29.726Z","index":6,"parentId":"311","title":"api"},{"id":600,"dateAddedLocal":"11/29/2017, 5:12:09 PM","dateAddedUTC":"2017-11-29T22:12:09.000Z","index":0,"parentId":"599","title":"Cloudinary - Management Console Login","url":"https://cloudinary.com/users/login"},{"id":601,"dateAddedLocal":"11/29/2017, 5:11:02 PM","dateAddedUTC":"2017-11-29T22:11:02.000Z","index":1,"parentId":"599","title":"Dark Sky for iOS and Android","url":"https://darksky.net/app"},{"id":602,"dateAddedLocal":"11/29/2017, 5:11:59 PM","dateAddedUTC":"2017-11-29T22:11:59.000Z","index":2,"parentId":"599","title":"Postman | API Development Environment","url":"https://www.getpostman.com/"},{"id":1436,"dateAddedLocal":"3/10/2018, 4:44:50 PM","dateAddedUTC":"2018-03-10T21:44:50.173Z","index":3,"parentId":"599","title":"Faraday: One HTTP Client to Rule Them All |","url":"https://www.mobomo.com/2012/03/faraday-one-http-client-to-rule-them-all/"},{"id":1441,"dateAddedLocal":"3/11/2018, 4:48:06 PM","dateAddedUTC":"2018-03-11T20:48:06.869Z","index":4,"parentId":"599","title":"TheCatAPI.com Documentation","url":"http://thecatapi.com/docs.html#get"},{"id":1442,"dateAddedLocal":"3/11/2018, 5:24:11 PM","dateAddedUTC":"2018-03-11T21:24:11.261Z","index":5,"parentId":"599","title":"Spotify","url":"https://developer.spotify.com/web-api/endpoint-reference/"},{"id":1472,"dateAddedLocal":"3/16/2018, 8:30:09 AM","dateAddedUTC":"2018-03-16T12:30:09.316Z","index":6,"parentId":"599","title":"Firebase Auth REST API  |  Firebase","url":"https://firebase.google.com/docs/reference/rest/auth/"},{"id":603,"dateAddedLocal":"2/9/2018, 5:47:29 PM","dateAddedUTC":"2018-02-09T22:47:29.726Z","index":7,"parentId":"311","title":"asset pipeline"},{"id":604,"dateAddedLocal":"9/12/2017, 1:11:10 PM","dateAddedUTC":"2017-09-12T17:11:10.000Z","index":0,"parentId":"603","title":"DHH RailsConf 2011","url":"https://www.youtube.com/watch?v=cGdCI2HhfAU"},{"id":605,"dateAddedLocal":"9/12/2017, 1:11:10 PM","dateAddedUTC":"2017-09-12T17:11:10.000Z","index":1,"parentId":"603","title":"The Asset Pipeline — Ruby on Rails Guides","url":"http://guides.rubyonrails.org/asset_pipeline.html"},{"id":1172,"dateAddedLocal":"2/9/2018, 5:47:29 PM","dateAddedUTC":"2018-02-09T22:47:29.804Z","index":8,"parentId":"311","title":"async"},{"id":1173,"dateAddedLocal":"2/3/2018, 11:16:45 PM","dateAddedUTC":"2018-02-04T04:16:45.000Z","index":0,"parentId":"1172","title":"Fetch API - Web APIs | MDN","url":"https://developer.mozilla.org/en-US/docs/Web/API/Fetch_API"},{"id":1174,"dateAddedLocal":"2/3/2018, 11:19:32 PM","dateAddedUTC":"2018-02-04T04:19:32.000Z","index":1,"parentId":"1172","title":"Body - Web APIs | MDN","url":"https://developer.mozilla.org/en-US/docs/Web/API/Body"},{"id":606,"dateAddedLocal":"2/9/2018, 5:47:29 PM","dateAddedUTC":"2018-02-09T22:47:29.727Z","index":9,"parentId":"311","title":"babel"},{"id":607,"dateAddedLocal":"9/12/2017, 1:11:10 PM","dateAddedUTC":"2017-09-12T17:11:10.000Z","index":0,"parentId":"606","title":"Babel · a JavaScript compiler","url":"http://babeljs.io/"},{"id":608,"dateAddedLocal":"9/12/2017, 1:11:10 PM","dateAddedUTC":"2017-09-12T17:11:10.000Z","index":1,"parentId":"606","title":"babel/babelify: Browserify transform for Babel","url":"https://github.com/babel/babelify"},{"id":609,"dateAddedLocal":"11/3/2017, 11:50:36 PM","dateAddedUTC":"2017-11-04T03:50:36.000Z","index":2,"parentId":"606","title":"Plugins · Babel","url":"https://babeljs.io/docs/plugins/"},{"id":610,"dateAddedLocal":"9/12/2017, 1:11:10 PM","dateAddedUTC":"2017-09-12T17:11:10.000Z","index":3,"parentId":"606","title":"substack/node-browserify: browser-side require() the node.js way","url":"https://github.com/substack/node-browserify"},{"id":611,"dateAddedLocal":"2/9/2018, 5:47:29 PM","dateAddedUTC":"2018-02-09T22:47:29.727Z","index":10,"parentId":"311","title":"benchmarking"},{"id":612,"dateAddedLocal":"9/12/2017, 1:11:10 PM","dateAddedUTC":"2017-09-12T17:11:10.000Z","index":0,"parentId":"611","title":"benchmark Ruby code? // RubyLearning Blog","url":"http://rubylearning.com/blog/2013/06/19/how-do-i-benchmark-ruby-code/"},{"id":613,"dateAddedLocal":"9/12/2017, 1:11:10 PM","dateAddedUTC":"2017-09-12T17:11:10.000Z","index":1,"parentId":"611","title":"Learn - Collect and Return Values","url":"https://learn.co/tracks/full-stack-web-dev-with-react/procedural-ruby/iteration/prime-lab"},{"id":353,"dateAddedLocal":"2/9/2018, 5:47:29 PM","dateAddedUTC":"2018-02-09T22:47:29.694Z","index":11,"parentId":"311","title":"books"},{"id":354,"dateAddedLocal":"9/12/2017, 1:11:10 PM","dateAddedUTC":"2017-09-12T17:11:10.000Z","index":0,"parentId":"353","title":"Beyond This Tutorial - Learn to Program","url":"https://pine.fm/LearnToProgram/chap_11.html"},{"id":361,"dateAddedLocal":"9/12/2017, 1:11:09 PM","dateAddedUTC":"2017-09-12T17:11:09.000Z","index":1,"parentId":"353","title":"The Pragmatic Programmer: From Journeyman to Master: 0785342616224: Computer Science Books @ Amazon.com","url":"http://www.amazon.com/The-Pragmatic-Programmer-Journeyman-Master/dp/020161622X"},{"id":363,"dateAddedLocal":"9/12/2017, 1:11:10 PM","dateAddedUTC":"2017-09-12T17:11:10.000Z","index":2,"parentId":"353","title":"You-Dont-Know-JS: A book series on JavaScript. @YDKJS on twitter.","url":"https://github.com/getify/You-Dont-Know-JS"},{"id":1328,"dateAddedLocal":"2/14/2018, 5:43:10 PM","dateAddedUTC":"2018-02-14T22:43:10.454Z","index":3,"parentId":"353","title":"Free Resources for Developers – dvlprstash – Medium","url":"https://medium.com/dvlprstash/free-resources-for-developers-dec-2017-d23eddd83f5"},{"id":1373,"dateAddedLocal":"2/22/2018, 11:26:31 AM","dateAddedUTC":"2018-02-22T16:26:31.861Z","index":4,"parentId":"353","title":"GoalKicker.com – Free Programming Books","url":"http://goalkicker.com/"},{"id":614,"dateAddedLocal":"2/9/2018, 5:47:29 PM","dateAddedUTC":"2018-02-09T22:47:29.727Z","index":12,"parentId":"311","title":"bootstrap"},{"id":615,"dateAddedLocal":"9/12/2017, 1:11:10 PM","dateAddedUTC":"2017-09-12T17:11:10.000Z","index":0,"parentId":"614","title":"Bootstrap vs Foundation - Top 2 CSS Frameworks","url":"https://www.keycdn.com/blog/bootstrap-vs-foundation/"},{"id":616,"dateAddedLocal":"9/12/2017, 1:11:10 PM","dateAddedUTC":"2017-09-12T17:11:10.000Z","index":1,"parentId":"614","title":"bootstrap-learn-lab","url":"https://learn.co/tracks/full-stack-web-dev-with-react/rails-and-javascript/asset-pipeline/bootstrap-and-the-asset-pipeline"},{"id":617,"dateAddedLocal":"10/24/2017, 5:32:21 AM","dateAddedUTC":"2017-10-24T09:32:21.000Z","index":2,"parentId":"614","title":"twbs/bootstrap-sass: Official Sass port of Bootstrap 2 and 3.","url":"https://github.com/twbs/bootstrap-sass"},{"id":1491,"dateAddedLocal":"3/20/2018, 7:07:25 PM","dateAddedUTC":"2018-03-20T23:07:25.348Z","index":3,"parentId":"614","title":"Bootstrap 4 Cheat Sheet - The ultimate list of Bootstrap classes","url":"https://hackerthemes.com/bootstrap-cheatsheet/"},{"id":618,"dateAddedLocal":"2/9/2018, 5:47:29 PM","dateAddedUTC":"2018-02-09T22:47:29.728Z","index":13,"parentId":"311","title":"cartography"},{"id":619,"dateAddedLocal":"9/12/2017, 1:11:10 PM","dateAddedUTC":"2017-09-12T17:11:10.000Z","index":0,"parentId":"618","title":"Make Maps People Want to Look At","url":"http://www.esri.com/news/arcuser/0112/make-maps-people-want-to-look-at.html"},{"id":620,"dateAddedLocal":"9/12/2017, 1:11:10 PM","dateAddedUTC":"2017-09-12T17:11:10.000Z","index":1,"parentId":"618","title":"Principles of Cartographic Design ~ GIS Lounge","url":"https://www.gislounge.com/principles-of-cartographic-design/"},{"id":1507,"dateAddedLocal":"3/27/2018, 11:37:44 AM","dateAddedUTC":"2018-03-27T15:37:44.637Z","index":14,"parentId":"311","title":"cheatsheet"},{"id":1485,"dateAddedLocal":"3/17/2018, 12:56:09 PM","dateAddedUTC":"2018-03-17T16:56:09.599Z","index":0,"parentId":"1507","title":"OverAPI","url":"http://overapi.com/"},{"id":621,"dateAddedLocal":"2/9/2018, 5:47:29 PM","dateAddedUTC":"2018-02-09T22:47:29.728Z","index":15,"parentId":"311","title":"chirp"},{"id":622,"dateAddedLocal":"9/12/2017, 1:11:10 PM","dateAddedUTC":"2017-09-12T17:11:10.000Z","index":0,"parentId":"621","title":"Beginners Guide - CHIRP","url":"http://chirp.danplanet.com/projects/chirp/wiki/Beginners_Guide"},{"id":623,"dateAddedLocal":"9/12/2017, 1:11:10 PM","dateAddedUTC":"2017-09-12T17:11:10.000Z","index":1,"parentId":"621","title":"Chirp for JavaScript · Chirp","url":"http://developers.chirp.io/docs/chirp-for-javascript"},{"id":624,"dateAddedLocal":"2/9/2018, 5:47:29 PM","dateAddedUTC":"2018-02-09T22:47:29.729Z","index":16,"parentId":"311","title":"chrome"},{"id":625,"dateAddedLocal":"9/12/2017, 1:11:10 PM","dateAddedUTC":"2017-09-12T17:11:10.000Z","index":0,"parentId":"624","title":"","url":"https://docs.google.com/a/smithwebtek.com/document/d/1Pk4_cOmiwR91HpXhNRcuvMfNQEoBgdrJUUu7y8ajCC4/edit?usp=notify&ts=58f004fc"},{"id":626,"dateAddedLocal":"9/12/2017, 1:11:10 PM","dateAddedUTC":"2017-09-12T17:11:10.000Z","index":1,"parentId":"624","title":"chrome.bookmarks - Google Chrome","url":"https://developer.chrome.com/extensions/bookmarks"},{"id":627,"dateAddedLocal":"2/9/2018, 5:47:29 PM","dateAddedUTC":"2018-02-09T22:47:29.729Z","index":17,"parentId":"311","title":"cmd line"},{"id":628,"dateAddedLocal":"9/12/2017, 1:11:10 PM","dateAddedUTC":"2017-09-12T17:11:10.000Z","index":0,"parentId":"627","title":"Calling shell commands from Ruby - Stack Overflow","url":"http://stackoverflow.com/questions/2232/calling-shell-commands-from-ruby"},{"id":629,"dateAddedLocal":"2/9/2018, 5:47:29 PM","dateAddedUTC":"2018-02-09T22:47:29.729Z","index":18,"parentId":"311","title":"cms"},{"id":630,"dateAddedLocal":"9/20/2017, 6:56:35 PM","dateAddedUTC":"2017-09-20T22:56:35.000Z","index":0,"parentId":"629","title":"Getting Started - Guides - Refinery CMS","url":"http://www.refinerycms.com/guides/getting-started"},{"id":631,"dateAddedLocal":"2/9/2018, 5:47:29 PM","dateAddedUTC":"2018-02-09T22:47:29.729Z","index":19,"parentId":"311","title":"coffeeScript"},{"id":632,"dateAddedLocal":"10/23/2017, 10:07:02 PM","dateAddedUTC":"2017-10-24T02:07:02.000Z","index":0,"parentId":"631","title":"CoffeeScript","url":"http://coffeescript.org/"},{"id":633,"dateAddedLocal":"2/9/2018, 5:47:29 PM","dateAddedUTC":"2018-02-09T22:47:29.730Z","index":20,"parentId":"311","title":"continuous integration"},{"id":634,"dateAddedLocal":"9/12/2017, 1:11:10 PM","dateAddedUTC":"2017-09-12T17:11:10.000Z","index":0,"parentId":"633","title":"Continuous Integration and Deployment service for Windows developers | AppVeyor","url":"https://www.appveyor.com/"},{"id":635,"dateAddedLocal":"2/9/2018, 5:47:29 PM","dateAddedUTC":"2018-02-09T22:47:29.730Z","index":21,"parentId":"311","title":"cookies"},{"id":636,"dateAddedLocal":"9/12/2017, 1:11:10 PM","dateAddedUTC":"2017-09-12T17:11:10.000Z","index":0,"parentId":"635","title":"All About Computer Cookies - Session Cookies, Persistent Cookies,How to Enable/Disable/Manage Cookies","url":"http://www.allaboutcookies.org/"},{"id":637,"dateAddedLocal":"9/12/2017, 1:11:10 PM","dateAddedUTC":"2017-09-12T17:11:10.000Z","index":1,"parentId":"635","title":"Cookie properties - EditThisCookie","url":"http://www.editthiscookie.com/blog/2014/03/cookie-properties/"},{"id":638,"dateAddedLocal":"9/12/2017, 1:11:10 PM","dateAddedUTC":"2017-09-12T17:11:10.000Z","index":2,"parentId":"635","title":"Getting Started with EditThisCookie - EditThisCookie","url":"http://www.editthiscookie.com/start/"},{"id":639,"dateAddedLocal":"9/12/2017, 1:11:10 PM","dateAddedUTC":"2017-09-12T17:11:10.000Z","index":3,"parentId":"635","title":"HTTP cookie - Wikipedia, the free encyclopedia","url":"https://en.wikipedia.org/wiki/HTTP_cookie#Session_cookie"},{"id":640,"dateAddedLocal":"9/12/2017, 1:11:10 PM","dateAddedUTC":"2017-09-12T17:11:10.000Z","index":4,"parentId":"635","title":"Support EditThisCookie","url":"chrome-extension://fngmhnnpilhplaeedifhccceomclgfbg/options_pages/support.html"},{"id":641,"dateAddedLocal":"2/9/2018, 5:47:29 PM","dateAddedUTC":"2018-02-09T22:47:29.731Z","index":22,"parentId":"311","title":"cors"},{"id":642,"dateAddedLocal":"9/12/2017, 1:11:10 PM","dateAddedUTC":"2017-09-12T17:11:10.000Z","index":0,"parentId":"641","title":"Cross-origin resource sharing - Wikipedia","url":"https://en.wikipedia.org/wiki/Cross-origin_resource_sharing"},{"id":643,"dateAddedLocal":"10/30/2017, 8:38:06 AM","dateAddedUTC":"2017-10-30T12:38:06.000Z","index":1,"parentId":"641","title":"Cross-origin resource sharing - Wikipedia","url":"https://en.wikipedia.org/wiki/Cross-origin_resource_sharing#CORS_vs_JSONP"},{"id":644,"dateAddedLocal":"9/12/2017, 1:11:10 PM","dateAddedUTC":"2017-09-12T17:11:10.000Z","index":2,"parentId":"641","title":"cyu/rack-cors: Rack Middleware for handling Cross-Origin Resource Sharing (CORS), which makes cross-origin AJAX possible.","url":"https://github.com/cyu/rack-cors"},{"id":645,"dateAddedLocal":"10/30/2017, 8:38:26 AM","dateAddedUTC":"2017-10-30T12:38:26.000Z","index":3,"parentId":"641","title":"Same-origin policy - Wikipedia","url":"https://en.wikipedia.org/wiki/Same-origin_policy#JSONP"},{"id":646,"dateAddedLocal":"2/9/2018, 5:47:29 PM","dateAddedUTC":"2018-02-09T22:47:29.731Z","index":23,"parentId":"311","title":"css"},{"id":647,"dateAddedLocal":"9/12/2017, 1:11:10 PM","dateAddedUTC":"2017-09-12T17:11:10.000Z","index":0,"parentId":"646","title":"30 CSS Selectors you Must Memorize - Envato Tuts+ Code Tutorial","url":"http://code.tutsplus.com/tutorials/the-30-css-selectors-you-must-memorize--net-16048"},{"id":648,"dateAddedLocal":"9/12/2017, 1:11:10 PM","dateAddedUTC":"2017-09-12T17:11:10.000Z","index":1,"parentId":"646","title":"Attribute selectors - CSS | MDN","url":"https://developer.mozilla.org/en-US/docs/Web/CSS/Attribute_selectors"},{"id":649,"dateAddedLocal":"9/12/2017, 1:11:11 PM","dateAddedUTC":"2017-09-12T17:11:11.000Z","index":2,"parentId":"646","title":"Basscss","url":"http://basscss.com/"},{"id":650,"dateAddedLocal":"9/12/2017, 1:11:10 PM","dateAddedUTC":"2017-09-12T17:11:10.000Z","index":3,"parentId":"646","title":"CSS - Pseudo Class Selectors | CSS-Tricks","url":"https://css-tricks.com/pseudo-class-selectors/"},{"id":651,"dateAddedLocal":"9/12/2017, 1:11:10 PM","dateAddedUTC":"2017-09-12T17:11:10.000Z","index":4,"parentId":"646","title":"CSS reference - CSS | MDN","url":"https://developer.mozilla.org/en-US/docs/Web/CSS/Reference"},{"id":652,"dateAddedLocal":"9/12/2017, 1:11:10 PM","dateAddedUTC":"2017-09-12T17:11:10.000Z","index":5,"parentId":"646","title":"CSS | Mozilla.org","url":"https://developer.mozilla.org/en-US/docs/Web/CSS"},{"id":653,"dateAddedLocal":"9/12/2017, 1:11:10 PM","dateAddedUTC":"2017-09-12T17:11:10.000Z","index":6,"parentId":"646","title":"Flat UI Colors - Color Pallette from Flat UI Theme","url":"http://flatuicolors.com/"},{"id":654,"dateAddedLocal":"10/16/2017, 9:35:36 PM","dateAddedUTC":"2017-10-17T01:35:36.000Z","index":7,"parentId":"646","title":"Foundation: The most advanced responsive front-end framework in the world. | Foundation","url":"https://foundation.zurb.com/"},{"id":655,"dateAddedLocal":"12/18/2017, 9:11:41 AM","dateAddedUTC":"2017-12-18T14:11:41.000Z","index":8,"parentId":"646","title":"Single Element CSS Spinners","url":"https://projects.lukehaas.me/css-loaders/"},{"id":656,"dateAddedLocal":"9/12/2017, 1:11:10 PM","dateAddedUTC":"2017-09-12T17:11:10.000Z","index":9,"parentId":"646","title":"Video Screencasts | CSS-Tricks","url":"https://css-tricks.com/video-screencasts/"},{"id":1496,"dateAddedLocal":"3/23/2018, 6:34:38 PM","dateAddedUTC":"2018-03-23T22:34:38.594Z","index":10,"parentId":"646","title":"Learn HTML & CSS - a book that teaches you in a nicer way","url":"http://www.htmlandcssbook.com/"},{"id":657,"dateAddedLocal":"2/9/2018, 5:47:29 PM","dateAddedUTC":"2018-02-09T22:47:29.733Z","index":24,"parentId":"311","title":"csv"},{"id":658,"dateAddedLocal":"10/25/2017, 12:29:54 PM","dateAddedUTC":"2017-10-25T16:29:54.000Z","index":0,"parentId":"657","title":"Class: CSV (Ruby 1.9.3)","url":"http://ruby-doc.org/stdlib-1.9.3/libdoc/csv/rdoc/CSV.html"},{"id":659,"dateAddedLocal":"10/25/2017, 12:29:21 PM","dateAddedUTC":"2017-10-25T16:29:21.000Z","index":1,"parentId":"657","title":"Learn - Paperclip","url":"https://learn.co/tracks/full-stack-web-development-v3/rails-and-javascript/workers/long-running-tasks-in-rails"},{"id":660,"dateAddedLocal":"2/9/2018, 5:47:29 PM","dateAddedUTC":"2018-02-09T22:47:29.733Z","index":25,"parentId":"311","title":"curl"},{"id":661,"dateAddedLocal":"9/12/2017, 1:11:10 PM","dateAddedUTC":"2017-09-12T17:11:10.000Z","index":0,"parentId":"660","title":"curl - Manual","url":"https://curl.haxx.se/docs/manual.html"},{"id":662,"dateAddedLocal":"9/12/2017, 1:11:10 PM","dateAddedUTC":"2017-09-12T17:11:10.000Z","index":1,"parentId":"660","title":"How to Use cURL to Test RESTful Rails // RailsTips by John Nunemaker","url":"http://www.railstips.org/blog/archives/2006/08/04/how-to-use-curl-to-test-restful-rails/"},{"id":663,"dateAddedLocal":"9/12/2017, 1:11:10 PM","dateAddedUTC":"2017-09-12T17:11:10.000Z","index":2,"parentId":"660","title":"ruby on rails - curl command line POST - Stack Overflow","url":"http://stackoverflow.com/questions/5826690/curl-command-line-post"},{"id":664,"dateAddedLocal":"1/16/2018, 5:42:52 PM","dateAddedUTC":"2018-01-16T22:42:52.000Z","index":3,"parentId":"660","title":"libcurl - What Developers Say About It","url":"https://curl.haxx.se/libcurl/theysay.html"},{"id":1118,"dateAddedLocal":"2/9/2018, 5:47:29 PM","dateAddedUTC":"2018-02-09T22:47:29.796Z","index":26,"parentId":"311","title":"d3"},{"id":1119,"dateAddedLocal":"9/12/2017, 1:11:10 PM","dateAddedUTC":"2017-09-12T17:11:10.000Z","index":0,"parentId":"1118","title":"D3.js - Data-Driven Documents","url":"https://d3js.org/"},{"id":1120,"dateAddedLocal":"11/3/2017, 11:11:13 AM","dateAddedUTC":"2017-11-03T15:11:13.000Z","index":1,"parentId":"1118","title":"d3/d3-scale: Encodings that map abstract data to visual representation.","url":"https://github.com/d3/d3-scale"},{"id":1121,"dateAddedLocal":"9/12/2017, 1:11:10 PM","dateAddedUTC":"2017-09-12T17:11:10.000Z","index":2,"parentId":"1118","title":"Introduction to D3 - YouTube","url":"https://www.youtube.com/watch?v=8jvoTV54nXw"},{"id":1122,"dateAddedLocal":"9/12/2017, 1:11:10 PM","dateAddedUTC":"2017-09-12T17:11:10.000Z","index":3,"parentId":"1118","title":"Simple column chart with D3 | Socrata","url":"https://dev.socrata.com/blog/2013/08/13/simple-chart-with-d3.html"},{"id":665,"dateAddedLocal":"2/9/2018, 5:47:29 PM","dateAddedUTC":"2018-02-09T22:47:29.734Z","index":27,"parentId":"311","title":"dashapp"},{"id":666,"dateAddedLocal":"9/12/2017, 1:11:10 PM","dateAddedUTC":"2017-09-12T17:11:10.000Z","index":0,"parentId":"665","title":"Dash for macOS - API Documentation Browser, Snippet Manager - Kapeli","url":"https://kapeli.com/dash"},{"id":307,"dateAddedLocal":"2/9/2018, 5:47:29 PM","dateAddedUTC":"2018-02-09T22:47:29.689Z","index":28,"parentId":"311","title":"data"},{"id":667,"dateAddedLocal":"2/9/2018, 5:47:29 PM","dateAddedUTC":"2018-02-09T22:47:29.734Z","index":29,"parentId":"311","title":"data-id*"},{"id":668,"dateAddedLocal":"10/30/2017, 9:35:52 AM","dateAddedUTC":"2017-10-30T13:35:52.000Z","index":0,"parentId":"667","title":"Using data attributes - Learn web development | MDN","url":"https://developer.mozilla.org/en-US/docs/Learn/HTML/Howto/Use_data_attributes"},{"id":669,"dateAddedLocal":"2/9/2018, 5:47:29 PM","dateAddedUTC":"2018-02-09T22:47:29.735Z","index":30,"parentId":"311","title":"date and time syntax"},{"id":670,"dateAddedLocal":"9/12/2017, 1:11:10 PM","dateAddedUTC":"2017-09-12T17:11:10.000Z","index":0,"parentId":"669","title":"strftime (ActiveSupport::TimeWithZone) - APIdock","url":"http://apidock.com/rails/ActiveSupport/TimeWithZone/strftime"},{"id":671,"dateAddedLocal":"2/9/2018, 5:47:29 PM","dateAddedUTC":"2018-02-09T22:47:29.735Z","index":31,"parentId":"311","title":"debug"},{"id":672,"dateAddedLocal":"9/28/2017, 8:22:16 PM","dateAddedUTC":"2017-09-29T00:22:16.000Z","index":0,"parentId":"671","title":"Debugging","url":"https://curriculum-content.s3.amazonaws.com/web-development/js/basics/intro-to-debugging-readme/nick_parlante_debugging_zen_1996.pdf"},{"id":673,"dateAddedLocal":"2/9/2018, 5:47:29 PM","dateAddedUTC":"2018-02-09T22:47:29.735Z","index":32,"parentId":"311","title":"design"},{"id":674,"dateAddedLocal":"9/12/2017, 1:11:10 PM","dateAddedUTC":"2017-09-12T17:11:10.000Z","index":0,"parentId":"673","title":"Balsamiq. Rapid, effective and fun wireframing software. | Balsamiq","url":"https://balsamiq.com/"},{"id":675,"dateAddedLocal":"9/12/2017, 1:11:10 PM","dateAddedUTC":"2017-09-12T17:11:10.000Z","index":1,"parentId":"673","title":"Bootstrap","url":"http://getbootstrap.com/getting-started/#download"},{"id":676,"dateAddedLocal":"9/12/2017, 1:11:10 PM","dateAddedUTC":"2017-09-12T17:11:10.000Z","index":2,"parentId":"673","title":"Bootstrap-Getting started TEMPLATE","url":"http://getbootstrap.com/getting-started/#template"},{"id":677,"dateAddedLocal":"9/12/2017, 1:11:10 PM","dateAddedUTC":"2017-09-12T17:11:10.000Z","index":3,"parentId":"673","title":"BootstrapCDN by MaxCDN","url":"http://www.bootstrapcdn.com/"},{"id":678,"dateAddedLocal":"9/12/2017, 1:11:10 PM","dateAddedUTC":"2017-09-12T17:11:10.000Z","index":4,"parentId":"673","title":"Complete Guide to Reducing Page Weight","url":"http://www.sitepoint.com/complete-guide-reducing-page-weight/"},{"id":679,"dateAddedLocal":"9/12/2017, 1:11:10 PM","dateAddedUTC":"2017-09-12T17:11:10.000Z","index":5,"parentId":"673","title":"CSS Gradient Generator - ColorZilla.com","url":"http://www.colorzilla.com/gradient-editor/"},{"id":680,"dateAddedLocal":"9/12/2017, 1:11:10 PM","dateAddedUTC":"2017-09-12T17:11:10.000Z","index":6,"parentId":"673","title":"CSS Validation Service - W3C","url":"http://jigsaw.w3.org/css-validator/#validate_by_input"},{"id":681,"dateAddedLocal":"9/12/2017, 1:11:10 PM","dateAddedUTC":"2017-09-12T17:11:10.000Z","index":7,"parentId":"673","title":"Design for Developers","url":"http://designfordevelopers.co/"},{"id":682,"dateAddedLocal":"9/12/2017, 1:11:10 PM","dateAddedUTC":"2017-09-12T17:11:10.000Z","index":8,"parentId":"673","title":"Google Fonts","url":"https://www.google.com/fonts"},{"id":683,"dateAddedLocal":"9/12/2017, 1:11:10 PM","dateAddedUTC":"2017-09-12T17:11:10.000Z","index":9,"parentId":"673","title":"Gradient CSS Generator | CSSmatic","url":"http://www.cssmatic.com/gradient-generator#'\\-moz\\-linear\\-gradient\\%28left\\%2C\\%20rgba\\%28248\\%2C80\\%2C50\\%2C1\\%29\\%200\\%25\\%2C\\%20rgba\\%28241\\%2C111\\%2C92\\%2C1\\%29\\%2050\\%25\\%2C\\%20rgba\\%28246\\%2C41\\%2C12\\%2C1\\%29\\%2051\\%25\\%2C\\%20rgba\\%28240\\%2C47\\%2C23\\%2C1\\%29\\%2071\\%25\\%2C\\%20rgba\\%28231\\%2C56\\%2C39\\%2C1\\%29\\%20100\\%25\\%29\\%3B'"},{"id":684,"dateAddedLocal":"9/12/2017, 1:11:10 PM","dateAddedUTC":"2017-09-12T17:11:10.000Z","index":10,"parentId":"673","title":"HTML UTF-8 Reference","url":"http://www.w3schools.com/charsets/ref_html_utf8.asp"},{"id":685,"dateAddedLocal":"9/12/2017, 1:11:10 PM","dateAddedUTC":"2017-09-12T17:11:10.000Z","index":11,"parentId":"673","title":"ISO 2 Letter Language Codes - SitePoint","url":"http://www.sitepoint.com/web-foundations/iso-2-letter-language-codes/"},{"id":686,"dateAddedLocal":"9/12/2017, 1:11:10 PM","dateAddedUTC":"2017-09-12T17:11:10.000Z","index":12,"parentId":"673","title":"JavaScript · Bootstrap","url":"http://getbootstrap.com/javascript/"},{"id":687,"dateAddedLocal":"9/12/2017, 1:11:10 PM","dateAddedUTC":"2017-09-12T17:11:10.000Z","index":13,"parentId":"673","title":"Mockingbird - wireframe","url":"https://gomockingbird.com/projects/g7artlo/4gXVnC"},{"id":688,"dateAddedLocal":"9/12/2017, 1:11:10 PM","dateAddedUTC":"2017-09-12T17:11:10.000Z","index":14,"parentId":"673","title":"Modernizr: the feature detection library for HTML5/CSS3","url":"https://modernizr.com/"},{"id":689,"dateAddedLocal":"9/12/2017, 1:11:10 PM","dateAddedUTC":"2017-09-12T17:11:10.000Z","index":15,"parentId":"673","title":"normalize - cdnjs.com - The free and open source CDN for web related libraries to speed up your website!","url":"https://cdnjs.com/libraries/normalize"},{"id":690,"dateAddedLocal":"9/12/2017, 1:11:10 PM","dateAddedUTC":"2017-09-12T17:11:10.000Z","index":16,"parentId":"673","title":"normalize.css – Nicolas Gallagher","url":"http://nicolasgallagher.com/about-normalize-css/"},{"id":691,"dateAddedLocal":"9/12/2017, 1:11:10 PM","dateAddedUTC":"2017-09-12T17:11:10.000Z","index":17,"parentId":"673","title":"Opera browser - The fast, safe web browser - Download free","url":"http://www.opera.com/"},{"id":692,"dateAddedLocal":"9/12/2017, 1:11:10 PM","dateAddedUTC":"2017-09-12T17:11:10.000Z","index":18,"parentId":"673","title":"transform - CSS","url":"https://developer.mozilla.org/en-US/docs/Web/CSS/transform#Live_example"},{"id":693,"dateAddedLocal":"9/12/2017, 1:11:10 PM","dateAddedUTC":"2017-09-12T17:11:10.000Z","index":19,"parentId":"673","title":"twbs/bootstrap","url":"https://github.com/twbs/bootstrap"},{"id":694,"dateAddedLocal":"9/12/2017, 1:11:10 PM","dateAddedUTC":"2017-09-12T17:11:10.000Z","index":20,"parentId":"673","title":"twitter-bootstrap - cdnjs.com - The free and open source CDN for web related libraries to speed up your website!","url":"http://cdnjs.com/libraries/twitter-bootstrap"},{"id":695,"dateAddedLocal":"9/12/2017, 1:11:10 PM","dateAddedUTC":"2017-09-12T17:11:10.000Z","index":21,"parentId":"673","title":"Using Jekyll with Pages - User Documentation","url":"https://help.github.com/articles/using-jekyll-with-pages/"},{"id":696,"dateAddedLocal":"9/12/2017, 1:11:10 PM","dateAddedUTC":"2017-09-12T17:11:10.000Z","index":22,"parentId":"673","title":"Validation Service","url":"https://validator.w3.org/"},{"id":697,"dateAddedLocal":"1/22/2018, 12:48:50 PM","dateAddedUTC":"2018-01-22T17:48:50.000Z","index":23,"parentId":"673","title":"draw.io","url":"https://www.draw.io/"},{"id":1486,"dateAddedLocal":"3/17/2018, 1:15:56 PM","dateAddedUTC":"2018-03-17T17:15:56.536Z","index":24,"parentId":"673","title":"Free stock photos · Pexels","url":"https://www.pexels.com/"},{"id":1487,"dateAddedLocal":"3/17/2018, 1:16:45 PM","dateAddedUTC":"2018-03-17T17:16:45.995Z","index":25,"parentId":"673","title":"PlaceCorgi","url":"http://placecorgi.com/"},{"id":1295,"dateAddedLocal":"2/12/2018, 11:21:03 AM","dateAddedUTC":"2018-02-12T16:21:03.627Z","index":26,"parentId":"673","title":"Everything Easy is Hard Again – Frank Chimero","url":"https://frankchimero.com/writing/everything-easy-is-hard-again/"},{"id":698,"dateAddedLocal":"2/9/2018, 5:47:29 PM","dateAddedUTC":"2018-02-09T22:47:29.739Z","index":33,"parentId":"311","title":"devise"},{"id":699,"dateAddedLocal":"9/20/2017, 5:38:06 PM","dateAddedUTC":"2017-09-20T21:38:06.000Z","index":0,"parentId":"698","title":"Devise RDOCS","url":"http://www.rubydoc.info/github/plataformatec/devise/master/frames"},{"id":700,"dateAddedLocal":"9/20/2017, 6:49:49 PM","dateAddedUTC":"2017-09-20T22:49:49.000Z","index":1,"parentId":"698","title":"https://launchschool.com/blog/how-to-use-devise-in-rails-for-authentication","url":"https://launchschool.com/blog/how-to-use-devise-in-rails-for-authentication"},{"id":701,"dateAddedLocal":"9/20/2017, 6:47:58 PM","dateAddedUTC":"2017-09-20T22:47:58.000Z","index":2,"parentId":"698","title":"Learn - Devise","url":"https://learn.co/tracks/full-stack-web-dev-with-react/rails/authentication/devise"},{"id":702,"dateAddedLocal":"9/20/2017, 7:00:06 PM","dateAddedUTC":"2017-09-20T23:00:06.000Z","index":3,"parentId":"698","title":"Module: Devise::Models::DatabaseAuthenticatable — Documentation for plataformatec/devise (master)","url":"http://www.rubydoc.info/github/plataformatec/devise/master/Devise/Models/DatabaseAuthenticatable"},{"id":703,"dateAddedLocal":"9/20/2017, 5:33:36 PM","dateAddedUTC":"2017-09-20T21:33:36.000Z","index":4,"parentId":"698","title":"plataformatec/devise: Flexible authentication solution for Rails with Warden.","url":"https://github.com/plataformatec/devise"},{"id":704,"dateAddedLocal":"2/9/2018, 5:47:29 PM","dateAddedUTC":"2018-02-09T22:47:29.740Z","index":34,"parentId":"311","title":"document conversion"},{"id":705,"dateAddedLocal":"9/12/2017, 1:11:10 PM","dateAddedUTC":"2017-09-12T17:11:10.000Z","index":0,"parentId":"704","title":"using pandoc with rails - Google Search","url":"https://www.google.com/webhp?sourceid=chrome-instant&rlz=1C5CHFA_enUS700US700&ion=1&espv=2&ie=UTF-8#q=using+pandoc+with+rails"},{"id":706,"dateAddedLocal":"2/9/2018, 5:47:29 PM","dateAddedUTC":"2018-02-09T22:47:29.740Z","index":35,"parentId":"311","title":"editors"},{"id":707,"dateAddedLocal":"2/9/2018, 5:47:29 PM","dateAddedUTC":"2018-02-09T22:47:29.740Z","index":0,"parentId":"706","title":"editor-markdown"},{"id":708,"dateAddedLocal":"9/12/2017, 1:11:10 PM","dateAddedUTC":"2017-09-12T17:11:10.000Z","index":0,"parentId":"707","title":"Mastering Markdown · GitHub Guides","url":"https://guides.github.com/features/mastering-markdown/"},{"id":709,"dateAddedLocal":"2/9/2018, 5:47:29 PM","dateAddedUTC":"2018-02-09T22:47:29.741Z","index":1,"parentId":"706","title":"editor-sublime"},{"id":710,"dateAddedLocal":"9/12/2017, 1:11:10 PM","dateAddedUTC":"2017-09-12T17:11:10.000Z","index":0,"parentId":"709","title":"10 Essential SublimeText Plugins for JavaScript Developers","url":"https://www.sitepoint.com/essential-sublime-text-javascript-plugins/"},{"id":711,"dateAddedLocal":"9/12/2017, 1:11:11 PM","dateAddedUTC":"2017-09-12T17:11:11.000Z","index":1,"parentId":"709","title":"SublimeLinter 3.4.24 documentation","url":"http://sublimelinter.readthedocs.io/en/latest/troubleshooting.html#debugging-path-problems"},{"id":712,"dateAddedLocal":"2/9/2018, 5:47:29 PM","dateAddedUTC":"2018-02-09T22:47:29.741Z","index":2,"parentId":"706","title":"editor-vscode"},{"id":713,"dateAddedLocal":"9/12/2017, 1:11:10 PM","dateAddedUTC":"2017-09-12T17:11:10.000Z","index":0,"parentId":"712","title":"Documentation for Visual Studio Code","url":"https://code.visualstudio.com/docs"},{"id":714,"dateAddedLocal":"9/12/2017, 1:11:10 PM","dateAddedUTC":"2017-09-12T17:11:10.000Z","index":1,"parentId":"712","title":"keyboard-shortcuts-macos.pdf","url":"https://code.visualstudio.com/shortcuts/keyboard-shortcuts-macos.pdf"},{"id":715,"dateAddedLocal":"2/9/2018, 5:47:29 PM","dateAddedUTC":"2018-02-09T22:47:29.741Z","index":3,"parentId":"706","title":"emmet"},{"id":716,"dateAddedLocal":"10/16/2017, 7:57:26 AM","dateAddedUTC":"2017-10-16T11:57:26.000Z","index":0,"parentId":"715","title":"Emmet 2.0 in Visual Studio Code","url":"https://code.visualstudio.com/blogs/2017/08/07/emmet-2.0"},{"id":717,"dateAddedLocal":"2/9/2018, 5:47:29 PM","dateAddedUTC":"2018-02-09T22:47:29.741Z","index":36,"parentId":"311","title":"emmet"},{"id":718,"dateAddedLocal":"10/16/2017, 7:57:26 AM","dateAddedUTC":"2017-10-16T11:57:26.000Z","index":0,"parentId":"717","title":"Emmet 2.0 in Visual Studio Code","url":"https://code.visualstudio.com/blogs/2017/08/07/emmet-2.0"},{"id":719,"dateAddedLocal":"2/9/2018, 5:47:29 PM","dateAddedUTC":"2018-02-09T22:47:29.742Z","index":37,"parentId":"311","title":"env"},{"id":720,"dateAddedLocal":"9/12/2017, 1:11:10 PM","dateAddedUTC":"2017-09-12T17:11:10.000Z","index":0,"parentId":"719","title":"Exploring the DotEnv Gem: A handy guide – Ryan McNeely – Medium","url":"https://medium.com/@rmcneely/exploring-the-dotenv-gem-a-handy-guide-20a0d7541883"},{"id":1437,"dateAddedLocal":"3/11/2018, 4:26:50 PM","dateAddedUTC":"2018-03-11T20:26:50.979Z","index":1,"parentId":"719","title":"ENV credentials","url":"https://medium.com/@thejasonfile/hide-your-api-keys-hide-your-skype-api-keys-884427746f9c"},{"id":1438,"dateAddedLocal":"3/11/2018, 4:27:30 PM","dateAddedUTC":"2018-03-11T20:27:30.089Z","index":2,"parentId":"719","title":"Removing sensitive data from a repository - User Documentation","url":"https://help.github.com/articles/removing-sensitive-data-from-a-repository/"},{"id":1439,"dateAddedLocal":"3/11/2018, 4:27:38 PM","dateAddedUTC":"2018-03-11T20:27:38.364Z","index":3,"parentId":"719","title":"How can I completely remove a file from a git repository? - Stack Overflow","url":"https://stackoverflow.com/questions/3458685/how-can-i-completely-remove-a-file-from-a-git-repository"},{"id":1440,"dateAddedLocal":"3/11/2018, 4:28:01 PM","dateAddedUTC":"2018-03-11T20:28:01.671Z","index":4,"parentId":"719","title":"How to safely store API keys in Rails apps | Arkency Blog","url":"https://blog.arkency.com/2017/07/how-to-safely-store-api-keys-in-rails-apps/"},{"id":721,"dateAddedLocal":"2/9/2018, 5:47:29 PM","dateAddedUTC":"2018-02-09T22:47:29.742Z","index":38,"parentId":"311","title":"erd"},{"id":722,"dateAddedLocal":"9/12/2017, 1:11:10 PM","dateAddedUTC":"2017-09-12T17:11:10.000Z","index":0,"parentId":"721","title":"RailRoad diagrams generator","url":"http://railroad.rubyforge.org/#examples"},{"id":723,"dateAddedLocal":"9/12/2017, 1:11:10 PM","dateAddedUTC":"2017-09-12T17:11:10.000Z","index":1,"parentId":"721","title":"Rails ERD – Customisation options","url":"https://voormedia.github.io/rails-erd/customise.html"},{"id":724,"dateAddedLocal":"9/12/2017, 1:11:10 PM","dateAddedUTC":"2017-09-12T17:11:10.000Z","index":2,"parentId":"721","title":"voormedia/rails-erd: Generate Entity-Relationship Diagrams for Rails applications","url":"https://github.com/voormedia/rails-erd"},{"id":725,"dateAddedLocal":"2/9/2018, 5:47:29 PM","dateAddedUTC":"2018-02-09T22:47:29.742Z","index":39,"parentId":"311","title":"fetch"},{"id":726,"dateAddedLocal":"12/17/2017, 5:46:05 PM","dateAddedUTC":"2017-12-17T22:46:05.000Z","index":0,"parentId":"725","title":"Fetch vs. Axios.js for making http requests – Jason Arnold – Medium","url":"https://medium.com/@thejasonfile/fetch-vs-axios-js-for-making-http-requests-2b261cdd3af5"},{"id":1422,"dateAddedLocal":"3/7/2018, 11:03:22 AM","dateAddedUTC":"2018-03-07T16:03:22.716Z","index":40,"parentId":"311","title":"firebase"},{"id":1421,"dateAddedLocal":"3/7/2018, 11:03:05 AM","dateAddedUTC":"2018-03-07T16:03:05.750Z","index":0,"parentId":"1422","title":"Firebase console","url":"https://console.firebase.google.com/u/0/?pli=1"},{"id":727,"dateAddedLocal":"2/9/2018, 5:47:29 PM","dateAddedUTC":"2018-02-09T22:47:29.743Z","index":41,"parentId":"311","title":"funstuff"},{"id":728,"dateAddedLocal":"10/17/2017, 10:03:07 AM","dateAddedUTC":"2017-10-17T14:03:07.000Z","index":0,"parentId":"727","title":"Geocities-izer - Make Any Webpage Look Like It Was Made By A 13 Year-Old In 1996","url":"http://www.wonder-tonic.com/geocitiesizer/"},{"id":729,"dateAddedLocal":"2/9/2018, 5:47:29 PM","dateAddedUTC":"2018-02-09T22:47:29.743Z","index":42,"parentId":"311","title":"gem"},{"id":730,"dateAddedLocal":"9/12/2017, 1:11:10 PM","dateAddedUTC":"2017-09-12T17:11:10.000Z","index":0,"parentId":"729","title":"#245 New Gem with Bundler - RailsCasts","url":"http://railscasts.com/episodes/245-new-gem-with-bundler"},{"id":731,"dateAddedLocal":"9/12/2017, 1:11:10 PM","dateAddedUTC":"2017-09-12T17:11:10.000Z","index":1,"parentId":"729","title":"Awesome Ruby libraries, tools, frameworks and software","url":"https://github.com/markets/awesome-ruby"},{"id":732,"dateAddedLocal":"9/12/2017, 1:11:10 PM","dateAddedUTC":"2017-09-12T17:11:10.000Z","index":2,"parentId":"729","title":"Awesome-rails-gem: A collection of awesome Ruby Gems for Rails development.","url":"https://github.com/hothero/awesome-rails-gem"},{"id":733,"dateAddedLocal":"9/12/2017, 1:11:10 PM","dateAddedUTC":"2017-09-12T17:11:10.000Z","index":3,"parentId":"729","title":"Bundler: The best way to manage a Ruby application's gems","url":"http://bundler.io/gemfile.html"},{"id":734,"dateAddedLocal":"9/12/2017, 1:11:10 PM","dateAddedUTC":"2017-09-12T17:11:10.000Z","index":4,"parentId":"729","title":"Learn - CLI Data Gem Project","url":"https://learn.co/tracks/full-stack-web-development/object-oriented-ruby/final-projects/cli-data-gem-project"},{"id":735,"dateAddedLocal":"9/12/2017, 1:11:10 PM","dateAddedUTC":"2017-09-12T17:11:10.000Z","index":5,"parentId":"729","title":"Make your own gem - RubyGems Guides","url":"http://guides.rubygems.org/make-your-own-gem/"},{"id":736,"dateAddedLocal":"9/12/2017, 1:11:10 PM","dateAddedUTC":"2017-09-12T17:11:10.000Z","index":6,"parentId":"729","title":"Publishing your gem - RubyGems Guides","url":"http://guides.rubygems.org/publishing/"},{"id":737,"dateAddedLocal":"9/12/2017, 1:11:10 PM","dateAddedUTC":"2017-09-12T17:11:10.000Z","index":7,"parentId":"729","title":"RubyGems Documentation LOCALHOST: run gem server","url":"http://localhost:8808/#liquid"},{"id":738,"dateAddedLocal":"10/24/2017, 9:45:26 PM","dateAddedUTC":"2017-10-25T01:45:26.000Z","index":8,"parentId":"729","title":"The Ruby Toolbox - Know your options!","url":"https://www.ruby-toolbox.com/"},{"id":739,"dateAddedLocal":"9/12/2017, 1:11:10 PM","dateAddedUTC":"2017-09-12T17:11:10.000Z","index":9,"parentId":"729","title":"The Ruby Toolbox - Know Your Options!","url":"https://www.ruby-toolbox.com/resources"},{"id":740,"dateAddedLocal":"2/9/2018, 5:47:29 PM","dateAddedUTC":"2018-02-09T22:47:29.744Z","index":43,"parentId":"311","title":"geo"},{"id":741,"dateAddedLocal":"9/12/2017, 1:11:10 PM","dateAddedUTC":"2017-09-12T17:11:10.000Z","index":0,"parentId":"740","title":"alexreisner/geocoder: Complete Ruby geocoding solution.","url":"https://github.com/alexreisner/geocoder"},{"id":742,"dateAddedLocal":"9/12/2017, 1:11:10 PM","dateAddedUTC":"2017-09-12T17:11:10.000Z","index":1,"parentId":"740","title":"ArcMap | ArcGIS Desktop","url":"http://desktop.arcgis.com/en/arcmap/"},{"id":743,"dateAddedLocal":"9/12/2017, 1:11:10 PM","dateAddedUTC":"2017-09-12T17:11:10.000Z","index":2,"parentId":"740","title":"CARTO — Location Intelligence Software","url":"https://carto.com/"},{"id":744,"dateAddedLocal":"11/30/2017, 11:46:04 PM","dateAddedUTC":"2017-12-01T04:46:04.000Z","index":3,"parentId":"740","title":"Edit fiddle - JSFiddle","url":"https://jsfiddle.net/api/mdn/"},{"id":745,"dateAddedLocal":"9/12/2017, 1:11:10 PM","dateAddedUTC":"2017-09-12T17:11:10.000Z","index":4,"parentId":"740","title":"GeoJSON","url":"http://geojson.org/"},{"id":746,"dateAddedLocal":"9/12/2017, 1:11:10 PM","dateAddedUTC":"2017-09-12T17:11:10.000Z","index":5,"parentId":"740","title":"Getting Started  |  Google Maps Geocoding API  |  Google Developers","url":"https://developers.google.com/maps/documentation/geocoding/start?hl=en_US"},{"id":747,"dateAddedLocal":"9/12/2017, 1:11:10 PM","dateAddedUTC":"2017-09-12T17:11:10.000Z","index":6,"parentId":"740","title":"Google Maps JavaScript API  |  Google Developers","url":"https://developers.google.com/maps/documentation/javascript/?hl=en_US"},{"id":748,"dateAddedLocal":"9/12/2017, 1:11:10 PM","dateAddedUTC":"2017-09-12T17:11:10.000Z","index":7,"parentId":"740","title":"GoogleAPI Credentials - spc-v1","url":"https://console.developers.google.com/apis/credentials?project=spc-v1&organizationId=431234920510"},{"id":749,"dateAddedLocal":"9/12/2017, 1:11:10 PM","dateAddedUTC":"2017-09-12T17:11:10.000Z","index":8,"parentId":"740","title":"How to Integrate Google Maps into Ruby on Rails App - Anadea","url":"https://anadea.info/blog/how-to-integrate-google-maps-into-ruby-on-rails-app"},{"id":750,"dateAddedLocal":"9/12/2017, 1:11:10 PM","dateAddedUTC":"2017-09-12T17:11:10.000Z","index":9,"parentId":"740","title":"Leaflet - a JavaScript library for interactive maps","url":"http://leafletjs.com/"},{"id":751,"dateAddedLocal":"9/12/2017, 1:11:10 PM","dateAddedUTC":"2017-09-12T17:11:10.000Z","index":10,"parentId":"740","title":"Mapbox","url":"https://www.mapbox.com/"},{"id":752,"dateAddedLocal":"11/30/2017, 11:46:24 PM","dateAddedUTC":"2017-12-01T04:46:24.000Z","index":11,"parentId":"740","title":"Using geolocation - Web APIs | MDN","url":"https://developer.mozilla.org/en-US/docs/Web/API/Geolocation/Using_geolocation"},{"id":753,"dateAddedLocal":"9/12/2017, 1:11:10 PM","dateAddedUTC":"2017-09-12T17:11:10.000Z","index":12,"parentId":"740","title":"Welcome to the QGIS project!","url":"http://www.qgis.org/en/site/"},{"id":754,"dateAddedLocal":"2/9/2018, 5:47:29 PM","dateAddedUTC":"2018-02-09T22:47:29.746Z","index":44,"parentId":"311","title":"gimp"},{"id":755,"dateAddedLocal":"9/26/2017, 6:13:55 PM","dateAddedUTC":"2017-09-26T22:13:55.000Z","index":0,"parentId":"754","title":"GIMP - GNU Image Manipulation Program","url":"https://www.gimp.org/"},{"id":756,"dateAddedLocal":"2/9/2018, 5:47:29 PM","dateAddedUTC":"2018-02-09T22:47:29.746Z","index":45,"parentId":"311","title":"git"},{"id":757,"dateAddedLocal":"9/12/2017, 1:11:10 PM","dateAddedUTC":"2017-09-12T17:11:10.000Z","index":0,"parentId":"756","title":"find forks of a repo","url":"http://forked.yannick.io/"},{"id":758,"dateAddedLocal":"11/15/2017, 8:05:26 PM","dateAddedUTC":"2017-11-16T01:05:26.000Z","index":1,"parentId":"756","title":"flatiron_study_groups/git_basics.md at master · snsavage/flatiron_study_groups","url":"https://github.com/snsavage/flatiron_study_groups/blob/master/git_basics.md"},{"id":759,"dateAddedLocal":"9/12/2017, 1:11:10 PM","dateAddedUTC":"2017-09-12T17:11:10.000Z","index":2,"parentId":"756","title":"Git is, like many professional tools, something you simply got to learn. But li... | Hacker News","url":"https://news.ycombinator.com/item?id=12622746"},{"id":760,"dateAddedLocal":"9/12/2017, 1:11:10 PM","dateAddedUTC":"2017-09-12T17:11:10.000Z","index":3,"parentId":"756","title":"Git Video Tutorial - cheatsheet","url":"http://www.newthinktank.com/2014/04/git-video-tutorial/"},{"id":761,"dateAddedLocal":"12/28/2017, 5:11:00 PM","dateAddedUTC":"2017-12-28T22:11:00.000Z","index":4,"parentId":"756","title":"GITHUB","url":"https://www.gun.io/blog/how-to-github-fork-branch-and-pull-request"},{"id":762,"dateAddedLocal":"11/19/2017, 11:12:30 AM","dateAddedUTC":"2017-11-19T16:12:30.000Z","index":5,"parentId":"756","title":"GitHub Glossary - User Documentation","url":"https://help.github.com/articles/github-glossary/"},{"id":763,"dateAddedLocal":"11/15/2017, 8:06:36 PM","dateAddedUTC":"2017-11-16T01:06:36.000Z","index":6,"parentId":"756","title":"github-git-cheat-sheet","url":"https://services.github.com/on-demand/downloads/github-git-cheat-sheet.pdf"},{"id":764,"dateAddedLocal":"9/12/2017, 1:11:10 PM","dateAddedUTC":"2017-09-12T17:11:10.000Z","index":7,"parentId":"756","title":"Ignoring files - User Documentation","url":"https://help.github.com/articles/ignoring-files/"},{"id":765,"dateAddedLocal":"9/12/2017, 1:11:10 PM","dateAddedUTC":"2017-09-12T17:11:10.000Z","index":8,"parentId":"756","title":"job-crm · Settings | Heroku","url":"https://dashboard.heroku.com/apps/job-crm/settings"},{"id":766,"dateAddedLocal":"9/12/2017, 1:11:10 PM","dateAddedUTC":"2017-09-12T17:11:10.000Z","index":9,"parentId":"756","title":"Learn Git Branching","url":"http://learngitbranching.js.org/?NODEMO"},{"id":767,"dateAddedLocal":"9/12/2017, 1:11:10 PM","dateAddedUTC":"2017-09-12T17:11:10.000Z","index":10,"parentId":"756","title":"Learn Git with Bitbucket Cloud | Atlassian Git Tutorial","url":"https://www.atlassian.com/git/tutorials/learn-git-with-bitbucket-cloud"},{"id":768,"dateAddedLocal":"9/12/2017, 1:11:10 PM","dateAddedUTC":"2017-09-12T17:11:10.000Z","index":11,"parentId":"756","title":"Learn Version Control with Git for Free","url":"https://www.git-tower.com/learn/"},{"id":769,"dateAddedLocal":"11/15/2017, 8:06:11 PM","dateAddedUTC":"2017-11-16T01:06:11.000Z","index":12,"parentId":"756","title":"Oh, shit, git!","url":"http://ohshitgit.com/"},{"id":770,"dateAddedLocal":"9/12/2017, 1:11:10 PM","dateAddedUTC":"2017-09-12T17:11:10.000Z","index":13,"parentId":"756","title":"Ruby gitignore list","url":"https://github.com/github/gitignore/blob/master/Ruby.gitignore"},{"id":771,"dateAddedLocal":"1/30/2018, 3:18:01 PM","dateAddedUTC":"2018-01-30T20:18:01.000Z","index":14,"parentId":"756","title":"Git - Stashing","url":"https://git-scm.com/book/en/v1/Git-Tools-Stashing"},{"id":1365,"dateAddedLocal":"2/21/2018, 1:36:40 PM","dateAddedUTC":"2018-02-21T18:36:40.832Z","index":15,"parentId":"756","title":"Quick Tip: Leveraging the Power of Git Stash","url":"https://code.tutsplus.com/tutorials/quick-tip-leveraging-the-power-of-git-stash--cms-22988"},{"id":1379,"dateAddedLocal":"2/27/2018, 11:11:41 AM","dateAddedUTC":"2018-02-27T16:11:41.103Z","index":16,"parentId":"756","title":"Git Large File Storage | Git Large File Storage (LFS) replaces large files such as audio samples, videos, datasets, and graphics with text pointers inside Git, while storing the file contents on a remote server like GitHub.com or GitHub Enterprise.","url":"https://git-lfs.github.com/"},{"id":1391,"dateAddedLocal":"3/1/2018, 7:22:09 AM","dateAddedUTC":"2018-03-01T12:22:09.574Z","index":17,"parentId":"756","title":"How to Write a Git Commit Message","url":"https://chris.beams.io/posts/git-commit/"},{"id":772,"dateAddedLocal":"2/9/2018, 5:47:29 PM","dateAddedUTC":"2018-02-09T22:47:29.748Z","index":46,"parentId":"311","title":"gov"},{"id":773,"dateAddedLocal":"9/12/2017, 1:11:10 PM","dateAddedUTC":"2017-09-12T17:11:10.000Z","index":0,"parentId":"772","title":"18F: Digital service delivery | Blog","url":"https://18f.gsa.gov/blog/"},{"id":774,"dateAddedLocal":"9/12/2017, 1:11:10 PM","dateAddedUTC":"2017-09-12T17:11:10.000Z","index":1,"parentId":"772","title":"18F: Digital service delivery | The Agile Delivery BPA is here!","url":"https://18f.gsa.gov/2015/06/15/agile-bpa-is-here/"},{"id":775,"dateAddedLocal":"9/12/2017, 1:11:10 PM","dateAddedUTC":"2017-09-12T17:11:10.000Z","index":2,"parentId":"772","title":"cloud.gov","url":"https://cloud.gov/"},{"id":776,"dateAddedLocal":"9/12/2017, 1:11:10 PM","dateAddedUTC":"2017-09-12T17:11:10.000Z","index":3,"parentId":"772","title":"Corporate Overview | The MITRE Corporation","url":"https://www.mitre.org/about/corporate-overview"},{"id":777,"dateAddedLocal":"9/12/2017, 1:11:10 PM","dateAddedUTC":"2017-09-12T17:11:10.000Z","index":4,"parentId":"772","title":"Design Kit","url":"http://www.designkit.org/mindsets"},{"id":778,"dateAddedLocal":"9/12/2017, 1:11:10 PM","dateAddedUTC":"2017-09-12T17:11:10.000Z","index":5,"parentId":"772","title":"Design principles | U.S. Web Design Standards","url":"https://standards.usa.gov/design-principles/"},{"id":779,"dateAddedLocal":"9/12/2017, 1:11:10 PM","dateAddedUTC":"2017-09-12T17:11:10.000Z","index":6,"parentId":"772","title":"Government Financial Intelligence & Transparency | OpenGov","url":"https://opengov.com/"},{"id":780,"dateAddedLocal":"9/12/2017, 1:11:10 PM","dateAddedUTC":"2017-09-12T17:11:10.000Z","index":7,"parentId":"772","title":"Management and Oversight of Federal Information Technology","url":"https://management.cio.gov/"},{"id":781,"dateAddedLocal":"9/12/2017, 1:11:10 PM","dateAddedUTC":"2017-09-12T17:11:10.000Z","index":8,"parentId":"772","title":"United States Digital Service - The United States Digital Service is transforming how the federal government works for the American people. And we need you.","url":"https://www.usds.gov/"},{"id":782,"dateAddedLocal":"2/9/2018, 5:47:29 PM","dateAddedUTC":"2018-02-09T22:47:29.750Z","index":47,"parentId":"311","title":"hacking"},{"id":783,"dateAddedLocal":"9/12/2017, 1:11:10 PM","dateAddedUTC":"2017-09-12T17:11:10.000Z","index":0,"parentId":"782","title":"Hackathon IO - Organize & Discover Hackathons - Hackathon.IO","url":"http://www.hackathon.io/events"},{"id":784,"dateAddedLocal":"9/12/2017, 1:11:10 PM","dateAddedUTC":"2017-09-12T17:11:10.000Z","index":1,"parentId":"782","title":"Hackathons | Hacker League","url":"https://www.hackerleague.org/hackathons"},{"id":785,"dateAddedLocal":"9/12/2017, 1:11:10 PM","dateAddedUTC":"2017-09-12T17:11:10.000Z","index":2,"parentId":"782","title":"New & upcoming hackthons · Devpost","url":"http://devpost.com/hackathons"},{"id":786,"dateAddedLocal":"9/12/2017, 1:11:10 PM","dateAddedUTC":"2017-09-12T17:11:10.000Z","index":3,"parentId":"782","title":"Upcoming Hackathons | AngelHack","url":"http://angelhack.com/events/"},{"id":1372,"dateAddedLocal":"2/22/2018, 11:12:04 AM","dateAddedUTC":"2018-02-22T16:12:04.113Z","index":48,"parentId":"311","title":"hash table"},{"id":1371,"dateAddedLocal":"2/22/2018, 11:11:34 AM","dateAddedUTC":"2018-02-22T16:11:34.932Z","index":0,"parentId":"1372","title":"Hash Tables - YouTube","url":"https://www.youtube.com/watch?time_continue=19&v=2wyCY1sX9II"},{"id":403,"dateAddedLocal":"2/9/2018, 5:47:29 PM","dateAddedUTC":"2018-02-09T22:47:29.701Z","index":49,"parentId":"311","title":"heroku"},{"id":404,"dateAddedLocal":"9/12/2017, 1:11:10 PM","dateAddedUTC":"2017-09-12T17:11:10.000Z","index":0,"parentId":"403","title":"crash-data-v1","url":"http://crash-data-v1.herokuapp.com/"},{"id":405,"dateAddedLocal":"9/12/2017, 1:11:10 PM","dateAddedUTC":"2017-09-12T17:11:10.000Z","index":1,"parentId":"403","title":"Deploying with Git | Heroku Dev Center","url":"https://devcenter.heroku.com/articles/git#tracking-your-app-in-git"},{"id":406,"dateAddedLocal":"9/12/2017, 1:11:10 PM","dateAddedUTC":"2017-09-12T17:11:10.000Z","index":2,"parentId":"403","title":"diet-planner-v8","url":"https://diet-planner-v8.herokuapp.com/"},{"id":407,"dateAddedLocal":"9/12/2017, 1:11:10 PM","dateAddedUTC":"2017-09-12T17:11:10.000Z","index":3,"parentId":"403","title":"goal-mgr-v1","url":"https://goal-mgr-v1.herokuapp.com/"},{"id":408,"dateAddedLocal":"9/12/2017, 1:11:10 PM","dateAddedUTC":"2017-09-12T17:11:10.000Z","index":4,"parentId":"403","title":"How to add a git remote to a heroku app | The Agile Warrior","url":"https://agilewarrior.wordpress.com/2013/08/02/how-to-add-a-git-remote-to-a-heroku-app/"},{"id":409,"dateAddedLocal":"9/12/2017, 1:11:10 PM","dateAddedUTC":"2017-09-12T17:11:10.000Z","index":5,"parentId":"403","title":"job-crm-v1","url":"http://job-crm-v1.herokuapp.com/"},{"id":410,"dateAddedLocal":"9/12/2017, 1:11:10 PM","dateAddedUTC":"2017-09-12T17:11:10.000Z","index":6,"parentId":"403","title":"lab-rat-v1","url":"https://lab-rat-v1.herokuapp.com/"},{"id":411,"dateAddedLocal":"9/12/2017, 1:11:10 PM","dateAddedUTC":"2017-09-12T17:11:10.000Z","index":7,"parentId":"403","title":"loco-v1","url":"https://loco-v1.herokuapp.com/"},{"id":412,"dateAddedLocal":"9/12/2017, 1:11:10 PM","dateAddedUTC":"2017-09-12T17:11:10.000Z","index":8,"parentId":"403","title":"Personal apps | Heroku","url":"https://dashboard.heroku.com/apps"},{"id":413,"dateAddedLocal":"9/12/2017, 1:11:10 PM","dateAddedUTC":"2017-09-12T17:11:10.000Z","index":9,"parentId":"403","title":"postgresql - pgadmin: getting \"DETAIL: User does not have CONNECT privilege.\" error - Stack Overflow","url":"http://stackoverflow.com/questions/39169264/pgadmin-getting-detail-user-does-not-have-connect-privilege-error"},{"id":414,"dateAddedLocal":"9/12/2017, 1:11:10 PM","dateAddedUTC":"2017-09-12T17:11:10.000Z","index":10,"parentId":"403","title":"Sign In - Pluralsight","url":"https://app.pluralsight.com/id/signin/sso?RedirectTo=%2Fcourses%2Fadvanced-javascript&Alias=flatironschool.com"},{"id":415,"dateAddedLocal":"9/12/2017, 1:11:10 PM","dateAddedUTC":"2017-09-12T17:11:10.000Z","index":11,"parentId":"403","title":"sp-v2","url":"https://sp-v2.herokuapp.com/"},{"id":416,"dateAddedLocal":"9/12/2017, 1:11:10 PM","dateAddedUTC":"2017-09-12T17:11:10.000Z","index":12,"parentId":"403","title":"spc-v1","url":"https://spc-v1.herokuapp.com/"},{"id":417,"dateAddedLocal":"9/12/2017, 1:11:10 PM","dateAddedUTC":"2017-09-12T17:11:10.000Z","index":13,"parentId":"403","title":"swt-v3","url":"https://swt-v3.herokuapp.com/"},{"id":1166,"dateAddedLocal":"2/9/2018, 5:47:29 PM","dateAddedUTC":"2018-02-09T22:47:29.803Z","index":50,"parentId":"311","title":"heroku"},{"id":1167,"dateAddedLocal":"1/11/2018, 4:56:39 PM","dateAddedUTC":"2018-01-11T21:56:39.000Z","index":0,"parentId":"1166","title":"Deploying your app on Heroku with staging and production environments","url":"https://medium.com/@ivanpilot/deploying-your-app-on-heroku-with-staging-and-production-environments-17156870983e"},{"id":787,"dateAddedLocal":"2/9/2018, 5:47:29 PM","dateAddedUTC":"2018-02-09T22:47:29.751Z","index":51,"parentId":"311","title":"homebrew"},{"id":788,"dateAddedLocal":"9/12/2017, 1:11:10 PM","dateAddedUTC":"2017-09-12T17:11:10.000Z","index":0,"parentId":"787","title":"brew trash","url":"http://stackoverflow.com/questions/2642147/how-to-remove-files-and-directories-quickly"},{"id":560,"dateAddedLocal":"2/9/2018, 5:47:29 PM","dateAddedUTC":"2018-02-09T22:47:29.721Z","index":52,"parentId":"311","title":"hosting"},{"id":561,"dateAddedLocal":"9/12/2017, 1:11:11 PM","dateAddedUTC":"2017-09-12T17:11:11.000Z","index":0,"parentId":"560","title":"Deploy Your Rails App to AWS","url":"https://www.sitepoint.com/deploy-your-rails-app-to-aws/"},{"id":562,"dateAddedLocal":"9/12/2017, 1:11:11 PM","dateAddedUTC":"2017-09-12T17:11:11.000Z","index":1,"parentId":"560","title":"DreamHost","url":"https://www.dreamhost.com/hosting/vps/"},{"id":563,"dateAddedLocal":"9/12/2017, 1:11:11 PM","dateAddedUTC":"2017-09-12T17:11:11.000Z","index":2,"parentId":"560","title":"How to Choose A Web Host? 15-Point Hosting Checklist","url":"http://www.webhostingsecretrevealed.net/choose-the-right-web-hosting/"},{"id":564,"dateAddedLocal":"9/12/2017, 1:11:11 PM","dateAddedUTC":"2017-09-12T17:11:11.000Z","index":3,"parentId":"560","title":"How to Start a Web Hosting Business - GreenGeeks®","url":"https://www.greengeeks.com/how-to-start-a-web-hosting-business"},{"id":565,"dateAddedLocal":"9/12/2017, 1:11:11 PM","dateAddedUTC":"2017-09-12T17:11:11.000Z","index":4,"parentId":"560","title":"Ruby on Rails applications Hosting","url":"https://www.allerin.com/blog/ruby-on-rails-website-hosting"},{"id":1493,"dateAddedLocal":"3/22/2018, 2:26:13 PM","dateAddedUTC":"2018-03-22T18:26:13.180Z","index":5,"parentId":"560","title":"ngrok – documentation","url":"https://ngrok.com/docs"},{"id":308,"dateAddedLocal":"11/10/2017, 11:22:18 AM","dateAddedUTC":"2017-11-10T16:22:18.000Z","index":6,"parentId":"560","title":"AWS","url":"https://console.aws.amazon.com/console/home?region=us-east-1"},{"id":309,"dateAddedLocal":"1/5/2018, 5:14:49 AM","dateAddedUTC":"2018-01-05T10:14:49.000Z","index":7,"parentId":"560","title":"Firebase","url":"https://console.firebase.google.com/u/0/project/swt-burger/database/swt-burger/data"},{"id":310,"dateAddedLocal":"1/23/2018, 9:14:06 AM","dateAddedUTC":"2018-01-23T14:14:06.000Z","index":8,"parentId":"560","title":"Heroku","url":"https://dashboard.heroku.com/apps"},{"id":789,"dateAddedLocal":"2/9/2018, 5:47:29 PM","dateAddedUTC":"2018-02-09T22:47:29.751Z","index":53,"parentId":"311","title":"html"},{"id":790,"dateAddedLocal":"9/12/2017, 1:11:10 PM","dateAddedUTC":"2017-09-12T17:11:10.000Z","index":0,"parentId":"789","title":"HTML -best-practices","url":"https://github.com/hail2u/html-best-practices#add-title-element"},{"id":791,"dateAddedLocal":"9/12/2017, 1:11:10 PM","dateAddedUTC":"2017-09-12T17:11:10.000Z","index":1,"parentId":"789","title":"HTML cheatsheet","url":"http://www.cril.univ-artois.fr/~lecoutre/teaching/web/sheets/HTML.pdf"},{"id":792,"dateAddedLocal":"9/12/2017, 1:11:10 PM","dateAddedUTC":"2017-09-12T17:11:10.000Z","index":2,"parentId":"789","title":"HTML element reference - HTML | MDN","url":"https://developer.mozilla.org/en-US/docs/Web/HTML/Element"},{"id":793,"dateAddedLocal":"2/9/2018, 5:47:29 PM","dateAddedUTC":"2018-02-09T22:47:29.751Z","index":54,"parentId":"311","title":"http"},{"id":794,"dateAddedLocal":"9/14/2017, 7:31:33 AM","dateAddedUTC":"2017-09-14T11:31:33.000Z","index":0,"parentId":"793","title":"HTTP Status Codes","url":"http://www.tutorialspoint.com/http/http_status_codes.htm"},{"id":795,"dateAddedLocal":"2/9/2018, 5:47:29 PM","dateAddedUTC":"2018-02-09T22:47:29.751Z","index":55,"parentId":"311","title":"internet engineering"},{"id":796,"dateAddedLocal":"9/12/2017, 1:11:10 PM","dateAddedUTC":"2017-09-12T17:11:10.000Z","index":0,"parentId":"795","title":"A remote server automation and deployment tool written in Ruby.","url":"http://capistranorb.com/"},{"id":1499,"dateAddedLocal":"3/24/2018, 4:14:27 PM","dateAddedUTC":"2018-03-24T20:14:27.138Z","index":1,"parentId":"795","title":"Charles Web Debugging Proxy","url":"https://www.charlesproxy.com/download/"},{"id":1500,"dateAddedLocal":"3/24/2018, 4:14:59 PM","dateAddedUTC":"2018-03-24T20:14:59.594Z","index":2,"parentId":"795","title":"Fiddler - Free Web Debugging Proxy - Telerik","url":"https://www.telerik.com/fiddler"},{"id":797,"dateAddedLocal":"2/9/2018, 5:47:29 PM","dateAddedUTC":"2018-02-09T22:47:29.752Z","index":56,"parentId":"311","title":"javascript"},{"id":798,"dateAddedLocal":"2/9/2018, 5:47:29 PM","dateAddedUTC":"2018-02-09T22:47:29.752Z","index":0,"parentId":"797","title":"backbone"},{"id":799,"dateAddedLocal":"10/17/2017, 1:26:45 PM","dateAddedUTC":"2017-10-17T17:26:45.000Z","index":0,"parentId":"798","title":"Backbone.js","url":"http://backbonejs.org/"},{"id":800,"dateAddedLocal":"10/17/2017, 1:26:22 PM","dateAddedUTC":"2017-10-17T17:26:22.000Z","index":1,"parentId":"798","title":"Javascript MV* Frameworks Like Angular.js and Backbone.js | The Odin Project","url":"https://www.theodinproject.com/courses/javascript-and-jquery/lessons/javascript-mv-frameworks-like-angular-js-and-backbone-js"},{"id":801,"dateAddedLocal":"2/9/2018, 5:47:29 PM","dateAddedUTC":"2018-02-09T22:47:29.752Z","index":1,"parentId":"797","title":"console - js"},{"id":802,"dateAddedLocal":"9/21/2017, 10:10:39 AM","dateAddedUTC":"2017-09-21T14:10:39.000Z","index":0,"parentId":"801","title":"Console - Web APIs | MDN","url":"https://developer.mozilla.org/en-US/docs/Web/API/Console"},{"id":803,"dateAddedLocal":"9/21/2017, 10:09:52 AM","dateAddedUTC":"2017-09-21T14:09:52.000Z","index":1,"parentId":"801","title":"Mastering The Developer Tools Console - Treehouse Blog","url":"http://blog.teamtreehouse.com/mastering-developer-tools-console"},{"id":804,"dateAddedLocal":"2/9/2018, 5:47:29 PM","dateAddedUTC":"2018-02-09T22:47:29.752Z","index":2,"parentId":"797","title":"jquery"},{"id":805,"dateAddedLocal":"9/12/2017, 1:11:10 PM","dateAddedUTC":"2017-09-12T17:11:10.000Z","index":0,"parentId":"804","title":"A Tour of Rails’ jQuery UJS","url":"https://robots.thoughtbot.com/a-tour-of-rails-jquery-ujs"},{"id":806,"dateAddedLocal":"10/14/2017, 9:10:38 AM","dateAddedUTC":"2017-10-14T13:10:38.000Z","index":1,"parentId":"804","title":"jQuery Learning Center","url":"http://learn.jquery.com/"},{"id":807,"dateAddedLocal":"10/14/2017, 1:11:48 PM","dateAddedUTC":"2017-10-14T17:11:48.000Z","index":2,"parentId":"804","title":"JS Lab - jQuery demo","url":"file:///Users/BradSmith/dev/js-lab/js-lab3/index.html"},{"id":808,"dateAddedLocal":"2/9/2018, 5:47:29 PM","dateAddedUTC":"2018-02-09T22:47:29.753Z","index":3,"parentId":"797","title":"js-libraries"},{"id":809,"dateAddedLocal":"9/26/2017, 5:31:15 PM","dateAddedUTC":"2017-09-26T21:31:15.000Z","index":0,"parentId":"808","title":"jQuery","url":"http://jquery.com/"},{"id":810,"dateAddedLocal":"9/26/2017, 5:31:30 PM","dateAddedUTC":"2017-09-26T21:31:30.000Z","index":1,"parentId":"808","title":"MooTools","url":"https://mootools.net/"},{"id":811,"dateAddedLocal":"9/26/2017, 5:30:46 PM","dateAddedUTC":"2017-09-26T21:30:46.000Z","index":2,"parentId":"808","title":"Prototype JavaScript framework: a foundation for ambitious web applications","url":"http://prototypejs.org/"},{"id":812,"dateAddedLocal":"9/26/2017, 5:31:23 PM","dateAddedUTC":"2017-09-26T21:31:23.000Z","index":3,"parentId":"808","title":"The Dojo Foundation","url":"http://dojofoundation.org/index.php"},{"id":813,"dateAddedLocal":"2/9/2018, 5:47:29 PM","dateAddedUTC":"2018-02-09T22:47:29.754Z","index":4,"parentId":"797","title":"lodash"},{"id":814,"dateAddedLocal":"10/17/2017, 11:43:21 AM","dateAddedUTC":"2017-10-17T15:43:21.000Z","index":0,"parentId":"813","title":"Lodash","url":"https://lodash.com/"},{"id":815,"dateAddedLocal":"10/17/2017, 2:55:27 PM","dateAddedUTC":"2017-10-17T18:55:27.000Z","index":1,"parentId":"813","title":"Lodash Documentation","url":"https://lodash.com/docs/4.17.4#template"},{"id":816,"dateAddedLocal":"2/9/2018, 5:47:29 PM","dateAddedUTC":"2018-02-09T22:47:29.754Z","index":5,"parentId":"797","title":"node"},{"id":817,"dateAddedLocal":"9/21/2017, 8:57:40 AM","dateAddedUTC":"2017-09-21T12:57:40.000Z","index":0,"parentId":"816","title":"Introduction to Node.js with Ryan Dahl - YouTube","url":"https://www.youtube.com/watch?v=jo_B4LTHi3I"},{"id":818,"dateAddedLocal":"9/21/2017, 8:57:02 AM","dateAddedUTC":"2017-09-21T12:57:02.000Z","index":1,"parentId":"816","title":"Node.js","url":"https://nodejs.org/en/"},{"id":819,"dateAddedLocal":"2/7/2018, 7:53:47 AM","dateAddedUTC":"2018-02-07T12:53:47.000Z","index":2,"parentId":"816","title":"npm ERR! Cannot find module 'internal/util/types' (tested with n lts and n latest) · Issue #476 · tj/n","url":"https://github.com/tj/n/issues/476"},{"id":820,"dateAddedLocal":"2/7/2018, 4:58:32 PM","dateAddedUTC":"2018-02-07T21:58:32.000Z","index":3,"parentId":"816","title":"Modern CSS Explained For Dinosaurs – Actualize – Medium","url":"https://medium.com/actualize-network/modern-css-explained-for-dinosaurs-5226febe3525"},{"id":1291,"dateAddedLocal":"2/10/2018, 12:30:24 PM","dateAddedUTC":"2018-02-10T17:30:24.808Z","index":4,"parentId":"816","title":"Node.js v9.5.0 Documentation","url":"https://nodejs.org/api/"},{"id":1294,"dateAddedLocal":"2/11/2018, 5:42:08 PM","dateAddedUTC":"2018-02-11T22:42:08.867Z","index":5,"parentId":"816","title":"yargs/yargs: yargs the modern, pirate-themed successor to optimist.","url":"https://github.com/yargs/yargs"},{"id":821,"dateAddedLocal":"2/9/2018, 5:47:29 PM","dateAddedUTC":"2018-02-09T22:47:29.755Z","index":6,"parentId":"797","title":"promises"},{"id":822,"dateAddedLocal":"10/21/2017, 10:55:50 PM","dateAddedUTC":"2017-10-22T02:55:50.000Z","index":0,"parentId":"821","title":"JavaScript Promises: an Introduction  |  Web Fundamentals  |  Google Developers","url":"https://developers.google.com/web/fundamentals/primers/promises"},{"id":823,"dateAddedLocal":"10/21/2017, 10:56:09 PM","dateAddedUTC":"2017-10-22T02:56:09.000Z","index":1,"parentId":"821","title":"JavaScript Promises: an Introduction  |  Web Fundamentals  |  Google Developers","url":"https://developers.google.com/web/fundamentals/primers/promises#promise-terminology"},{"id":824,"dateAddedLocal":"10/21/2017, 10:54:43 PM","dateAddedUTC":"2017-10-22T02:54:43.000Z","index":2,"parentId":"821","title":"JavaScript Promises: an Introduction  |  Web Fundamentals  |  Google Developers","url":"https://developers.google.com/web/fundamentals/primers/promises#whats-all-the-fuss-about"},{"id":825,"dateAddedLocal":"10/21/2017, 10:56:15 PM","dateAddedUTC":"2017-10-22T02:56:15.000Z","index":3,"parentId":"821","title":"Promises API reference","url":"https://developers.google.com/web/fundamentals/primers/promises#promise-api-reference"},{"id":826,"dateAddedLocal":"2/5/2018, 10:10:28 PM","dateAddedUTC":"2018-02-06T03:10:28.000Z","index":4,"parentId":"821","title":"Promises","url":"http://exploringjs.com/es6/ch_promises.html"},{"id":827,"dateAddedLocal":"2/6/2018, 10:23:49 AM","dateAddedUTC":"2018-02-06T15:23:49.000Z","index":5,"parentId":"821","title":"How to Use Javascript Promises - YouTube","url":"https://www.youtube.com/watch?v=104J7_HyaG4"},{"id":828,"dateAddedLocal":"2/9/2018, 5:47:29 PM","dateAddedUTC":"2018-02-09T22:47:29.756Z","index":7,"parentId":"797","title":"vue"},{"id":829,"dateAddedLocal":"9/12/2017, 1:11:11 PM","dateAddedUTC":"2017-09-12T17:11:11.000Z","index":0,"parentId":"828","title":"Introduction — Vue.js","url":"https://vuejs.org/v2/guide/"},{"id":830,"dateAddedLocal":"9/12/2017, 1:11:10 PM","dateAddedUTC":"2017-09-12T17:11:10.000Z","index":8,"parentId":"797","title":"21 Essential JavaScript Interview Questions | Codementor","url":"https://www.codementor.io/nihantanu/21-essential-javascript-tech-interview-practice-questions-answers-du107p62z"},{"id":831,"dateAddedLocal":"9/12/2017, 1:11:10 PM","dateAddedUTC":"2017-09-12T17:11:10.000Z","index":9,"parentId":"797","title":"Ajax: A New Approach to Web Applications | Adaptive Path","url":"http://adaptivepath.org/ideas/ajax-new-approach-web-applications/"},{"id":832,"dateAddedLocal":"9/12/2017, 1:11:10 PM","dateAddedUTC":"2017-09-12T17:11:10.000Z","index":10,"parentId":"797","title":"Babel · The compiler for writing next generation JavaScript","url":"https://babeljs.io/"},{"id":833,"dateAddedLocal":"9/12/2017, 1:11:10 PM","dateAddedUTC":"2017-09-12T17:11:10.000Z","index":11,"parentId":"797","title":"Babel · The compiler for writing next generation JavaScript","url":"https://babeljs.io/repl/#?babili=false&evaluate=true&lineWrap=false&presets=es2015%2Creact%2Cstage-2&targets=&browsers=&builtIns=false&code="},{"id":834,"dateAddedLocal":"9/12/2017, 1:11:10 PM","dateAddedUTC":"2017-09-12T17:11:10.000Z","index":12,"parentId":"797","title":"best-practices/best-practices.md at master · stevekwan/best-practices","url":"https://github.com/stevekwan/best-practices/blob/master/javascript/best-practices.md"},{"id":835,"dateAddedLocal":"9/12/2017, 1:11:10 PM","dateAddedUTC":"2017-09-12T17:11:10.000Z","index":13,"parentId":"797","title":"bower","url":"https://www.npmjs.com/package/bower"},{"id":836,"dateAddedLocal":"9/12/2017, 1:11:10 PM","dateAddedUTC":"2017-09-12T17:11:10.000Z","index":14,"parentId":"797","title":"Dark Sky for iOS and Android","url":"https://darksky.net/app/"},{"id":837,"dateAddedLocal":"9/12/2017, 1:11:10 PM","dateAddedUTC":"2017-09-12T17:11:10.000Z","index":15,"parentId":"797","title":"Dark Sky Maps","url":"https://maps.darksky.net/"},{"id":838,"dateAddedLocal":"9/12/2017, 1:11:10 PM","dateAddedUTC":"2017-09-12T17:11:10.000Z","index":16,"parentId":"797","title":"ECMAScript 6: New Features: Overview and Comparison","url":"http://es6-features.org/#ExpressionBodies"},{"id":839,"dateAddedLocal":"11/1/2017, 10:13:39 PM","dateAddedUTC":"2017-11-02T02:13:39.000Z","index":17,"parentId":"797","title":"ecmascript spec","url":"http://www.ecma-international.org/ecma-262/8.0/index.html"},{"id":840,"dateAddedLocal":"9/12/2017, 1:11:10 PM","dateAddedUTC":"2017-09-12T17:11:10.000Z","index":18,"parentId":"797","title":"Eloquent JavaScript","url":"http://eloquentjavascript.net/index.html"},{"id":841,"dateAddedLocal":"9/12/2017, 1:11:10 PM","dateAddedUTC":"2017-09-12T17:11:10.000Z","index":19,"parentId":"797","title":"Event KeyCodes","url":"http://keycode.info/"},{"id":842,"dateAddedLocal":"9/12/2017, 1:11:10 PM","dateAddedUTC":"2017-09-12T17:11:10.000Z","index":20,"parentId":"797","title":"event listeners","url":"https://developer.mozilla.org/en-US/docs/Web/Events"},{"id":843,"dateAddedLocal":"9/12/2017, 1:11:10 PM","dateAddedUTC":"2017-09-12T17:11:10.000Z","index":21,"parentId":"797","title":"fetch-jsonp","url":"https://www.npmjs.com/package/fetch-jsonp"},{"id":844,"dateAddedLocal":"9/12/2017, 1:11:10 PM","dateAddedUTC":"2017-09-12T17:11:10.000Z","index":22,"parentId":"797","title":"Flatiron School Presents (New York, NY) | Meetup","url":"https://www.meetup.com/Flatiron-School-Presents/?scroll=true"},{"id":845,"dateAddedLocal":"9/12/2017, 1:11:10 PM","dateAddedUTC":"2017-09-12T17:11:10.000Z","index":23,"parentId":"797","title":"Flow | A static type checker for JavaScript","url":"https://flowtype.org/"},{"id":846,"dateAddedLocal":"10/3/2017, 1:10:56 PM","dateAddedUTC":"2017-10-03T17:10:56.000Z","index":24,"parentId":"797","title":"Functions are first class objects in javascript – Helephant.com","url":"https://web.archive.org/web/20170606141950/http://helephant.com/2008/08/19/functions-are-first-class-objects-in-javascript/"},{"id":847,"dateAddedLocal":"9/12/2017, 1:11:10 PM","dateAddedUTC":"2017-09-12T17:11:10.000Z","index":25,"parentId":"797","title":"Grunt: The JavaScript Task Runner","url":"http://gruntjs.com/"},{"id":848,"dateAddedLocal":"9/12/2017, 1:11:10 PM","dateAddedUTC":"2017-09-12T17:11:10.000Z","index":26,"parentId":"797","title":"Handlebars.js: Minimal Templating on Steroids","url":"http://handlebarsjs.com/"},{"id":849,"dateAddedLocal":"9/12/2017, 1:11:10 PM","dateAddedUTC":"2017-09-12T17:11:10.000Z","index":27,"parentId":"797","title":"How to Install Node.js and NPM on a Mac","url":"http://blog.teamtreehouse.com/install-node-js-npm-mac"},{"id":850,"dateAddedLocal":"9/12/2017, 1:11:10 PM","dateAddedUTC":"2017-09-12T17:11:10.000Z","index":28,"parentId":"797","title":"JavaScript 30 — Build 30 things with vanilla JS in 30 days with 30 tutorials","url":"https://javascript30.com/"},{"id":851,"dateAddedLocal":"9/12/2017, 1:11:10 PM","dateAddedUTC":"2017-09-12T17:11:10.000Z","index":29,"parentId":"797","title":"JavaScript Cheat Sheet | Codementor","url":"https://www.codementor.io/johnnyb/javascript-cheatsheet-fb54lz08k"},{"id":852,"dateAddedLocal":"9/12/2017, 1:11:10 PM","dateAddedUTC":"2017-09-12T17:11:10.000Z","index":30,"parentId":"797","title":"JavaScript Glossary | Codecademy","url":"https://www.codecademy.com/articles/glossary-javascript#strings"},{"id":853,"dateAddedLocal":"9/12/2017, 1:11:10 PM","dateAddedUTC":"2017-09-12T17:11:10.000Z","index":31,"parentId":"797","title":"JavaScript Guide - JavaScript | MDN","url":"https://developer.mozilla.org/en-US/docs/Web/JavaScript/Guide"},{"id":854,"dateAddedLocal":"9/12/2017, 1:11:10 PM","dateAddedUTC":"2017-09-12T17:11:10.000Z","index":32,"parentId":"797","title":"JavaScript Prototypes - Sebastian's Blog","url":"http://sporto.github.io/blog/2013/02/22/a-plain-english-guide-to-javascript-prototypes/"},{"id":855,"dateAddedLocal":"10/15/2017, 4:44:11 PM","dateAddedUTC":"2017-10-15T20:44:11.000Z","index":33,"parentId":"797","title":"JavaScript Standard Style","url":"https://standardjs.com/#are-there-text-editor-plugins"},{"id":856,"dateAddedLocal":"9/12/2017, 1:11:10 PM","dateAddedUTC":"2017-09-12T17:11:10.000Z","index":34,"parentId":"797","title":"JavaScript | MDN","url":"https://developer.mozilla.org/en-US/docs/Web/JavaScript"},{"id":857,"dateAddedLocal":"9/29/2017, 6:00:43 PM","dateAddedUTC":"2017-09-29T22:00:43.000Z","index":35,"parentId":"797","title":"JavaScript: Understanding the Weird Parts - The First 3.5 Hours - YouTube","url":"https://www.youtube.com/watch?v=Bv_5Zv5c-Ts"},{"id":858,"dateAddedLocal":"9/12/2017, 1:11:10 PM","dateAddedUTC":"2017-09-12T17:11:10.000Z","index":36,"parentId":"797","title":"JS Bin - Collaborative JavaScript Debugging","url":"https://jsbin.com/gareno/edit?html,js,output"},{"id":859,"dateAddedLocal":"9/12/2017, 1:11:10 PM","dateAddedUTC":"2017-09-12T17:11:10.000Z","index":37,"parentId":"797","title":"JSFiddle","url":"https://jsfiddle.net/"},{"id":860,"dateAddedLocal":"9/12/2017, 1:11:10 PM","dateAddedUTC":"2017-09-12T17:11:10.000Z","index":38,"parentId":"797","title":"jslint - Google Search","url":"https://www.google.com/webhp?sourceid=chrome-instant&rlz=1C5CHFA_enUS700US700&ion=1&espv=2&ie=UTF-8#q=jslint"},{"id":861,"dateAddedLocal":"9/12/2017, 1:11:10 PM","dateAddedUTC":"2017-09-12T17:11:10.000Z","index":39,"parentId":"797","title":"JSLint: The JavaScript Code Quality Tool","url":"http://www.jslint.com/"},{"id":862,"dateAddedLocal":"9/29/2017, 6:01:26 PM","dateAddedUTC":"2017-09-29T22:01:26.000Z","index":40,"parentId":"797","title":"LearnWebDev.net","url":"http://learnwebdev.net/"},{"id":863,"dateAddedLocal":"9/12/2017, 1:11:10 PM","dateAddedUTC":"2017-09-12T17:11:10.000Z","index":41,"parentId":"797","title":"Moment.js | Home","url":"https://momentjs.com/"},{"id":864,"dateAddedLocal":"9/12/2017, 1:11:10 PM","dateAddedUTC":"2017-09-12T17:11:10.000Z","index":42,"parentId":"797","title":"npm","url":"https://www.npmjs.com/"},{"id":865,"dateAddedLocal":"9/12/2017, 1:11:10 PM","dateAddedUTC":"2017-09-12T17:11:10.000Z","index":43,"parentId":"797","title":"npm Documentation","url":"https://docs.npmjs.com/"},{"id":866,"dateAddedLocal":"9/12/2017, 1:11:10 PM","dateAddedUTC":"2017-09-12T17:11:10.000Z","index":44,"parentId":"797","title":"Plugins - Grunt: The JavaScript Task Runner","url":"http://gruntjs.com/plugins"},{"id":867,"dateAddedLocal":"10/9/2017, 4:30:58 PM","dateAddedUTC":"2017-10-09T20:30:58.000Z","index":45,"parentId":"797","title":"Reduce Advanced - Part 4 of Functional Programming in JavaScript - YouTube","url":"https://www.youtube.com/watch?v=1DMolJ2FrNY"},{"id":868,"dateAddedLocal":"9/12/2017, 1:11:10 PM","dateAddedUTC":"2017-09-12T17:11:10.000Z","index":46,"parentId":"797","title":"Sass: Syntactically Awesome Style Sheets","url":"http://sass-lang.com/"},{"id":869,"dateAddedLocal":"9/12/2017, 1:11:10 PM","dateAddedUTC":"2017-09-12T17:11:10.000Z","index":47,"parentId":"797","title":"TypeScript - JavaScript that scales.","url":"https://www.typescriptlang.org/"},{"id":870,"dateAddedLocal":"10/17/2017, 3:03:14 PM","dateAddedUTC":"2017-10-17T19:03:14.000Z","index":48,"parentId":"797","title":"Underscore.js","url":"http://underscorejs.org/"},{"id":871,"dateAddedLocal":"9/12/2017, 1:11:10 PM","dateAddedUTC":"2017-09-12T17:11:10.000Z","index":49,"parentId":"797","title":"Your Guide to Semicolons in JavaScript | Codecademy","url":"https://www.codecademy.com/blog/78"},{"id":872,"dateAddedLocal":"1/23/2018, 2:11:45 PM","dateAddedUTC":"2018-01-23T19:11:45.000Z","index":50,"parentId":"797","title":"Execution context, Scope chain and JavaScript internals","url":"https://hackernoon.com/execution-context-in-javascript-319dd72e8e2c"},{"id":482,"dateAddedLocal":"9/12/2017, 1:11:10 PM","dateAddedUTC":"2017-09-12T17:11:10.000Z","index":51,"parentId":"797","title":"JavaScript Promises","url":"https://davidwalsh.name/promises"},{"id":1434,"dateAddedLocal":"3/8/2018, 4:35:00 PM","dateAddedUTC":"2018-03-08T21:35:00.655Z","index":52,"parentId":"797","title":"Operator precedence - JavaScript | MDN","url":"https://developer.mozilla.org/en-US/docs/Web/JavaScript/Reference/Operators/Operator_Precedence#Table"},{"id":1495,"dateAddedLocal":"3/23/2018, 6:34:29 PM","dateAddedUTC":"2018-03-23T22:34:29.907Z","index":53,"parentId":"797","title":"Learn JavaScript & jQuery - a book about interactive front-end web development","url":"http://javascriptbook.com/"},{"id":1349,"dateAddedLocal":"2/21/2018, 3:35:43 AM","dateAddedUTC":"2018-02-21T08:35:43.370Z","index":54,"parentId":"797","title":"JSJ Episodes Archive - Devchat.tv","url":"https://devchat.tv/js-jabber"},{"id":1298,"dateAddedLocal":"2/12/2018, 11:21:27 AM","dateAddedUTC":"2018-02-12T16:21:27.237Z","index":55,"parentId":"797","title":"airbnb/javascript: JavaScript Style Guide","url":"https://github.com/airbnb/javascript"},{"id":1299,"dateAddedLocal":"2/12/2018, 11:21:31 AM","dateAddedUTC":"2018-02-12T16:21:31.636Z","index":56,"parentId":"797","title":"javascript/react at master · airbnb/javascript","url":"https://github.com/airbnb/javascript/tree/master/react"},{"id":1471,"dateAddedLocal":"3/15/2018, 9:26:08 PM","dateAddedUTC":"2018-03-16T01:26:08.418Z","index":57,"parentId":"311","title":"jwt"},{"id":1470,"dateAddedLocal":"3/15/2018, 9:25:41 PM","dateAddedUTC":"2018-03-16T01:25:41.140Z","index":0,"parentId":"1471","title":"JSON Web Token Introduction - jwt.io","url":"https://jwt.io/introduction/"},{"id":873,"dateAddedLocal":"2/9/2018, 5:47:29 PM","dateAddedUTC":"2018-02-09T22:47:29.763Z","index":58,"parentId":"311","title":"linux"},{"id":874,"dateAddedLocal":"9/12/2017, 1:11:10 PM","dateAddedUTC":"2017-09-12T17:11:10.000Z","index":0,"parentId":"873","title":"Running a Linux Web Server on an Android device | Codementor","url":"https://www.codementor.io/maxpleaner/run-a-linux-web-server-on-android-device-du1083k05"},{"id":875,"dateAddedLocal":"2/9/2018, 5:47:29 PM","dateAddedUTC":"2018-02-09T22:47:29.763Z","index":59,"parentId":"311","title":"mac"},{"id":876,"dateAddedLocal":"9/12/2017, 1:11:10 PM","dateAddedUTC":"2017-09-12T17:11:10.000Z","index":0,"parentId":"875","title":"OS X Command line reference","url":"http://ss64.com/osx/"},{"id":877,"dateAddedLocal":"2/9/2018, 5:47:29 PM","dateAddedUTC":"2018-02-09T22:47:29.763Z","index":60,"parentId":"311","title":"mailgun"},{"id":878,"dateAddedLocal":"9/12/2017, 1:11:10 PM","dateAddedUTC":"2017-09-12T17:11:10.000Z","index":0,"parentId":"877","title":"mailgun","url":"https://mailgun.com/"},{"id":879,"dateAddedLocal":"2/9/2018, 5:47:29 PM","dateAddedUTC":"2018-02-09T22:47:29.764Z","index":61,"parentId":"311","title":"markdown"},{"id":880,"dateAddedLocal":"9/12/2017, 1:11:10 PM","dateAddedUTC":"2017-09-12T17:11:10.000Z","index":0,"parentId":"879","title":"Markdown Cheatsheet · adam-p/markdown-here Wiki","url":"https://github.com/adam-p/markdown-here/wiki/Markdown-Cheatsheet"},{"id":881,"dateAddedLocal":"9/12/2017, 1:11:10 PM","dateAddedUTC":"2017-09-12T17:11:10.000Z","index":1,"parentId":"879","title":"Markdown Cheatsheet · adam-p/markdown-here Wiki","url":"https://github.com/adam-p/markdown-here/wiki/Markdown-Cheatsheet#links"},{"id":882,"dateAddedLocal":"1/9/2018, 9:16:11 AM","dateAddedUTC":"2018-01-09T14:16:11.000Z","index":2,"parentId":"879","title":"Markdown editing with Visual Studio Code","url":"https://code.visualstudio.com/docs/languages/markdown#_compiling-markdown-into-html"},{"id":883,"dateAddedLocal":"9/14/2017, 8:41:40 AM","dateAddedUTC":"2017-09-14T12:41:40.000Z","index":3,"parentId":"879","title":"redcarpet | RubyGems.org | your community gem host","url":"https://rubygems.org/gems/redcarpet/versions/3.3.4"},{"id":884,"dateAddedLocal":"9/12/2017, 1:11:10 PM","dateAddedUTC":"2017-09-12T17:11:10.000Z","index":4,"parentId":"879","title":"vmg/redcarpet: The safe Markdown parser, reloaded.","url":"https://github.com/vmg/redcarpet"},{"id":1168,"dateAddedLocal":"2/9/2018, 5:47:29 PM","dateAddedUTC":"2018-02-09T22:47:29.803Z","index":62,"parentId":"311","title":"mean-stack"},{"id":1169,"dateAddedLocal":"1/29/2018, 9:31:44 PM","dateAddedUTC":"2018-01-30T02:31:44.000Z","index":0,"parentId":"1168","title":"WORK IN LINNOVATE | Linnovate - Enterprise Web Solutions","url":"http://www.linnovate.net/content/work-linnovate"},{"id":1170,"dateAddedLocal":"1/29/2018, 9:32:12 PM","dateAddedUTC":"2018-01-30T02:32:12.000Z","index":1,"parentId":"1168","title":"Professional Services - Mongo Express Angular Node","url":"http://mean.io/services/"},{"id":885,"dateAddedLocal":"2/9/2018, 5:47:29 PM","dateAddedUTC":"2018-02-09T22:47:29.764Z","index":63,"parentId":"311","title":"midi"},{"id":886,"dateAddedLocal":"9/12/2017, 1:11:10 PM","dateAddedUTC":"2017-09-12T17:11:10.000Z","index":0,"parentId":"885","title":"Web MIDI API","url":"https://www.w3.org/TR/webmidi/"},{"id":887,"dateAddedLocal":"2/9/2018, 5:47:29 PM","dateAddedUTC":"2018-02-09T22:47:29.765Z","index":64,"parentId":"311","title":"minify"},{"id":888,"dateAddedLocal":"9/12/2017, 1:11:10 PM","dateAddedUTC":"2017-09-12T17:11:10.000Z","index":0,"parentId":"887","title":"Minify Resources (HTML, CSS, and JavaScript)  |  PageSpeed Insights  |  Google Developers","url":"https://developers.google.com/speed/docs/insights/MinifyResources"},{"id":889,"dateAddedLocal":"2/9/2018, 5:47:29 PM","dateAddedUTC":"2018-02-09T22:47:29.765Z","index":65,"parentId":"311","title":"mock_data"},{"id":890,"dateAddedLocal":"9/12/2017, 1:11:10 PM","dateAddedUTC":"2017-09-12T17:11:10.000Z","index":0,"parentId":"889","title":"Mockaroo - Random Data Generator | CSV / JSON / SQL / Excel","url":"https://www.mockaroo.com/"},{"id":891,"dateAddedLocal":"9/12/2017, 1:11:10 PM","dateAddedUTC":"2017-09-12T17:11:10.000Z","index":1,"parentId":"889","title":"stympy/faker: A library for generating fake data such as names, addresses, and phone numbers.","url":"https://github.com/stympy/faker"},{"id":1175,"dateAddedLocal":"2/9/2018, 5:47:29 PM","dateAddedUTC":"2018-02-09T22:47:29.804Z","index":66,"parentId":"311","title":"node"},{"id":1176,"dateAddedLocal":"2/6/2018, 10:48:22 PM","dateAddedUTC":"2018-02-07T03:48:22.000Z","index":0,"parentId":"1175","title":"Browserify","url":"http://browserify.org/"},{"id":1177,"dateAddedLocal":"2/6/2018, 10:59:57 PM","dateAddedUTC":"2018-02-07T03:59:57.000Z","index":1,"parentId":"1175","title":"Node.js Foundation","url":"https://foundation.nodejs.org/"},{"id":1178,"dateAddedLocal":"2/7/2018, 12:07:18 AM","dateAddedUTC":"2018-02-07T05:07:18.000Z","index":2,"parentId":"1175","title":"REPL | Node.js v9.5.0 Documentation","url":"https://nodejs.org/api/repl.html"},{"id":1179,"dateAddedLocal":"2/7/2018, 12:07:31 AM","dateAddedUTC":"2018-02-07T05:07:31.000Z","index":3,"parentId":"1175","title":"Using the Console  |  Tools for Web Developers  |  Google Developers","url":"https://developers.google.com/web/tools/chrome-devtools/console/?utm_source=dcc&utm_medium=redirect&utm_campaign=2016q3"},{"id":892,"dateAddedLocal":"2/9/2018, 5:47:29 PM","dateAddedUTC":"2018-02-09T22:47:29.765Z","index":67,"parentId":"311","title":"node_modules"},{"id":893,"dateAddedLocal":"11/6/2017, 8:16:47 AM","dateAddedUTC":"2017-11-06T13:16:47.000Z","index":0,"parentId":"892","title":"File System | Node.js v9.0.0 Documentation","url":"https://nodejs.org/api/fs.html"},{"id":894,"dateAddedLocal":"11/6/2017, 8:16:12 AM","dateAddedUTC":"2017-11-06T13:16:12.000Z","index":1,"parentId":"892","title":"node.js - Global webpack install vs. project specific webpack install - Stack Overflow","url":"https://stackoverflow.com/questions/42220176/global-webpack-install-vs-project-specific-webpack-install"},{"id":895,"dateAddedLocal":"2/9/2018, 5:47:29 PM","dateAddedUTC":"2018-02-09T22:47:29.766Z","index":68,"parentId":"311","title":"npm"},{"id":896,"dateAddedLocal":"11/21/2017, 10:00:22 AM","dateAddedUTC":"2017-11-21T15:00:22.000Z","index":0,"parentId":"895","title":"npm-check","url":"https://www.npmjs.com/package/npm-check"},{"id":897,"dateAddedLocal":"2/9/2018, 5:47:29 PM","dateAddedUTC":"2018-02-09T22:47:29.766Z","index":69,"parentId":"311","title":"olap"},{"id":898,"dateAddedLocal":"9/12/2017, 1:11:10 PM","dateAddedUTC":"2017-09-12T17:11:10.000Z","index":0,"parentId":"897","title":"Mondrian OLAP server - Wikipedia","url":"https://en.wikipedia.org/wiki/Mondrian_OLAP_server"},{"id":899,"dateAddedLocal":"9/12/2017, 1:11:10 PM","dateAddedUTC":"2017-09-12T17:11:10.000Z","index":1,"parentId":"897","title":"Mondrian | Pentaho Community","url":"http://community.pentaho.com/projects/mondrian/"},{"id":900,"dateAddedLocal":"9/12/2017, 1:11:10 PM","dateAddedUTC":"2017-09-12T17:11:10.000Z","index":2,"parentId":"897","title":"Pentaho Mondrian Documentation","url":"http://mondrian.pentaho.com/documentation/faq.php"},{"id":901,"dateAddedLocal":"9/12/2017, 1:11:10 PM","dateAddedUTC":"2017-09-12T17:11:10.000Z","index":3,"parentId":"897","title":"Pentaho Mondrian Documentation","url":"http://mondrian.pentaho.com/documentation/schema.php#What_is_a_schema"},{"id":902,"dateAddedLocal":"9/12/2017, 1:11:10 PM","dateAddedUTC":"2017-09-12T17:11:10.000Z","index":4,"parentId":"897","title":"rsim/mondrian-olap: JRuby gem for performing multidimensional queries of relational database data using Mondrian OLAP Java library","url":"https://github.com/rsim/mondrian-olap"},{"id":903,"dateAddedLocal":"9/12/2017, 1:11:10 PM","dateAddedUTC":"2017-09-12T17:11:10.000Z","index":5,"parentId":"897","title":"rsim/mondrian_demo: mondrian-olap demo Rails application","url":"https://github.com/rsim/mondrian_demo"},{"id":904,"dateAddedLocal":"2/9/2018, 5:47:29 PM","dateAddedUTC":"2018-02-09T22:47:29.767Z","index":70,"parentId":"311","title":"onenote"},{"id":905,"dateAddedLocal":"12/24/2017, 3:21:41 PM","dateAddedUTC":"2017-12-24T20:21:41.000Z","index":0,"parentId":"904","title":"OneHighlighter on the Mac App Store","url":"https://itunes.apple.com/be/app/onehighlighter/id1131580917?mt=12&ls=1"},{"id":906,"dateAddedLocal":"2/9/2018, 5:47:29 PM","dateAddedUTC":"2018-02-09T22:47:29.767Z","index":71,"parentId":"311","title":"online coding"},{"id":907,"dateAddedLocal":"9/12/2017, 1:11:10 PM","dateAddedUTC":"2017-09-12T17:11:10.000Z","index":0,"parentId":"906","title":"ReactiveX - Links to More Information","url":"http://reactivex.io/tutorials.html"},{"id":908,"dateAddedLocal":"9/12/2017, 1:11:10 PM","dateAddedUTC":"2017-09-12T17:11:10.000Z","index":1,"parentId":"906","title":"repl.it - Ruby Compiler","url":"https://repl.it/languages/ruby"},{"id":909,"dateAddedLocal":"2/9/2018, 5:47:29 PM","dateAddedUTC":"2018-02-09T22:47:29.767Z","index":72,"parentId":"311","title":"paginate"},{"id":910,"dateAddedLocal":"10/24/2017, 11:33:55 PM","dateAddedUTC":"2017-10-25T03:33:55.000Z","index":0,"parentId":"909","title":"kaminari/kaminari: ⚡ A Scope & Engine based, clean, powerful, customizable and sophisticated paginator for Ruby webapps","url":"https://github.com/kaminari/kaminari"},{"id":911,"dateAddedLocal":"2/9/2018, 5:47:29 PM","dateAddedUTC":"2018-02-09T22:47:29.768Z","index":73,"parentId":"311","title":"path"},{"id":912,"dateAddedLocal":"9/13/2017, 8:36:53 AM","dateAddedUTC":"2017-09-13T12:36:53.000Z","index":0,"parentId":"911","title":"macos - How do I reset the $PATH variable on Mac OS X? - Super User","url":"https://superuser.com/questions/121870/how-do-i-reset-the-path-variable-on-mac-os-x"},{"id":913,"dateAddedLocal":"2/9/2018, 5:47:29 PM","dateAddedUTC":"2018-02-09T22:47:29.768Z","index":74,"parentId":"311","title":"performance"},{"id":914,"dateAddedLocal":"9/12/2017, 1:11:10 PM","dateAddedUTC":"2017-09-12T17:11:10.000Z","index":0,"parentId":"913","title":"9 Ways to Make Your Website Super Fast","url":"http://learntocodewith.me/posts/make-your-website-fast/"},{"id":915,"dateAddedLocal":"2/9/2018, 5:47:29 PM","dateAddedUTC":"2018-02-09T22:47:29.768Z","index":75,"parentId":"311","title":"perl"},{"id":916,"dateAddedLocal":"9/26/2017, 5:57:42 PM","dateAddedUTC":"2017-09-26T21:57:42.000Z","index":0,"parentId":"915","title":"CPAN - Wikipedia","url":"https://en.wikipedia.org/wiki/CPAN"},{"id":917,"dateAddedLocal":"9/26/2017, 5:57:58 PM","dateAddedUTC":"2017-09-26T21:57:58.000Z","index":1,"parentId":"915","title":"Perl - Wikipedia","url":"https://en.wikipedia.org/wiki/Perl"},{"id":918,"dateAddedLocal":"2/9/2018, 5:47:29 PM","dateAddedUTC":"2018-02-09T22:47:29.768Z","index":76,"parentId":"311","title":"php"},{"id":919,"dateAddedLocal":"9/26/2017, 6:00:50 PM","dateAddedUTC":"2017-09-26T22:00:50.000Z","index":0,"parentId":"918","title":"PEAR - Wikipedia","url":"https://en.wikipedia.org/wiki/PEAR"},{"id":920,"dateAddedLocal":"9/26/2017, 6:00:30 PM","dateAddedUTC":"2017-09-26T22:00:30.000Z","index":1,"parentId":"918","title":"PHP - Wikipedia","url":"https://en.wikipedia.org/wiki/PHP"},{"id":494,"dateAddedLocal":"2/9/2018, 5:47:29 PM","dateAddedUTC":"2018-02-09T22:47:29.712Z","index":77,"parentId":"311","title":"point-of-sale"},{"id":495,"dateAddedLocal":"9/12/2017, 1:11:10 PM","dateAddedUTC":"2017-09-12T17:11:10.000Z","index":0,"parentId":"494","title":"AGbrochure_DIGITAL_OL.PDF","url":"http://pages.cayan.com/rs/829-DLL-537/images/AGbrochure_DIGITAL_OL.PDF"},{"id":496,"dateAddedLocal":"9/12/2017, 1:11:10 PM","dateAddedUTC":"2017-09-12T17:11:10.000Z","index":1,"parentId":"494","title":"Credit Card Processor Salesman Salary & Job Description > Career Options – Interviews","url":"http://www.jobshadow.com/interview-with-a-credit-card-processing-salesman/"},{"id":497,"dateAddedLocal":"9/12/2017, 1:11:10 PM","dateAddedUTC":"2017-09-12T17:11:10.000Z","index":2,"parentId":"494","title":"Datacap Systems Software Download - NETePay","url":"http://files.datacapepay.com/netepay5.htm"},{"id":498,"dateAddedLocal":"9/12/2017, 1:11:10 PM","dateAddedUTC":"2017-09-12T17:11:10.000Z","index":3,"parentId":"494","title":"Datacap Systems, Inc.","url":"https://www.datacapsystems.com/"},{"id":499,"dateAddedLocal":"9/12/2017, 1:11:10 PM","dateAddedUTC":"2017-09-12T17:11:10.000Z","index":4,"parentId":"494","title":"DiamondScan Point of Sale Software – DS Retail and Fuel Solutions","url":"http://www.diamondscan.com/diamondscan-point-of-sale-software/"},{"id":500,"dateAddedLocal":"9/12/2017, 1:11:10 PM","dateAddedUTC":"2017-09-12T17:11:10.000Z","index":5,"parentId":"494","title":"Equipment Types - CreditCardProcessing.com","url":"https://www.creditcardprocessing.com/equipment-types/"},{"id":501,"dateAddedLocal":"9/12/2017, 1:11:10 PM","dateAddedUTC":"2017-09-12T17:11:10.000Z","index":6,"parentId":"494","title":"Flipboard: The one place for all your interests","url":"https://flipboard.com/"},{"id":502,"dateAddedLocal":"9/12/2017, 1:11:10 PM","dateAddedUTC":"2017-09-12T17:11:10.000Z","index":7,"parentId":"494","title":"Floreant POS :: Open Source POS for Restaurants","url":"http://floreant.org/#download"},{"id":503,"dateAddedLocal":"9/12/2017, 1:11:10 PM","dateAddedUTC":"2017-09-12T17:11:10.000Z","index":8,"parentId":"494","title":"Heartland School Solutions Payment Solutions - Heartland School Solutions","url":"https://www.heartlandpaymentsystems.com/school-solutions/payment-solutions"},{"id":504,"dateAddedLocal":"9/12/2017, 1:11:10 PM","dateAddedUTC":"2017-09-12T17:11:10.000Z","index":9,"parentId":"494","title":"JPOS Support Drivers","url":"http://www.jpossoftware.com/JPOS/Support/Downloads.aspx"},{"id":505,"dateAddedLocal":"9/12/2017, 1:11:10 PM","dateAddedUTC":"2017-09-12T17:11:10.000Z","index":10,"parentId":"494","title":"Lightspeed Integrations for OnSite, Retail, Resto, eCom","url":"https://www.lightspeedhq.com/integrations/"},{"id":506,"dateAddedLocal":"9/12/2017, 1:11:10 PM","dateAddedUTC":"2017-09-12T17:11:10.000Z","index":11,"parentId":"494","title":"Lightspeed Integrations for OnSite, Retail, Resto, eCom","url":"https://www.lightspeedhq.com/integrations/?product=onsite"},{"id":507,"dateAddedLocal":"9/12/2017, 1:11:10 PM","dateAddedUTC":"2017-09-12T17:11:10.000Z","index":12,"parentId":"494","title":"Microsoft RMS End of Life (Discontinued) - Details & Tips.","url":"https://www.nchannel.com/blog/microsoft-rms-end-of-life-discontinued/"},{"id":508,"dateAddedLocal":"9/12/2017, 1:11:10 PM","dateAddedUTC":"2017-09-12T17:11:10.000Z","index":13,"parentId":"494","title":"Payment Possibilities | Cayan","url":"https://cayan.com/"},{"id":509,"dateAddedLocal":"9/12/2017, 1:11:10 PM","dateAddedUTC":"2017-09-12T17:11:10.000Z","index":14,"parentId":"494","title":"Payment Processing - Credit Card Processing Solutions | Cayan - EMV, NFC | Cayan","url":"https://cayan.com/payment-processing"},{"id":510,"dateAddedLocal":"9/12/2017, 1:11:10 PM","dateAddedUTC":"2017-09-12T17:11:10.000Z","index":15,"parentId":"494","title":"PHPRunner. Web database software, PHP MySQL code generator and PHP form builder","url":"https://xlinesoft.com/index.htm"},{"id":511,"dateAddedLocal":"9/12/2017, 1:11:10 PM","dateAddedUTC":"2017-09-12T17:11:10.000Z","index":16,"parentId":"494","title":"POS analytics reporting - Mobile Dashboard | SoftTouch POS","url":"http://softtouchpos.com/mobile-dashboard/"},{"id":512,"dateAddedLocal":"9/12/2017, 1:11:10 PM","dateAddedUTC":"2017-09-12T17:11:10.000Z","index":17,"parentId":"494","title":"Pos Software, Retail Software, Restaurant Software, Retail Pos Systems, Restaurant Pos System, Pos","url":"http://www.pcamerica.com/"},{"id":513,"dateAddedLocal":"9/12/2017, 1:11:10 PM","dateAddedUTC":"2017-09-12T17:11:10.000Z","index":18,"parentId":"494","title":"Rails Learning: Creating POS Application with Ruby on Rails 4 Part 1","url":"http://railslearning.blogspot.com/2015/06/creating-pos-application-with-ruby-on.html"},{"id":514,"dateAddedLocal":"9/12/2017, 1:11:10 PM","dateAddedUTC":"2017-09-12T17:11:10.000Z","index":19,"parentId":"494","title":"TechTools API & Resource Index | Vantiv O.N.E.","url":"https://developer.vantiv.com/groups/techtools-api-resource-index/overview"},{"id":515,"dateAddedLocal":"9/12/2017, 1:11:10 PM","dateAddedUTC":"2017-09-12T17:11:10.000Z","index":20,"parentId":"494","title":"Trello","url":"https://trello.com/"},{"id":516,"dateAddedLocal":"9/12/2017, 1:11:10 PM","dateAddedUTC":"2017-09-12T17:11:10.000Z","index":21,"parentId":"494","title":"TSYS | People-Centered Payments","url":"http://tsys.com/"},{"id":517,"dateAddedLocal":"9/12/2017, 1:11:10 PM","dateAddedUTC":"2017-09-12T17:11:10.000Z","index":22,"parentId":"494","title":"Worldpay | Secure Payment Processing","url":"http://www.worldpay.com/"},{"id":921,"dateAddedLocal":"2/9/2018, 5:47:29 PM","dateAddedUTC":"2018-02-09T22:47:29.769Z","index":78,"parentId":"311","title":"postman"},{"id":922,"dateAddedLocal":"9/12/2017, 1:11:10 PM","dateAddedUTC":"2017-09-12T17:11:10.000Z","index":0,"parentId":"921","title":"Testing API with Postman","url":"http://www.sm-cloud.com/testing-api-with-postman/"},{"id":923,"dateAddedLocal":"2/9/2018, 5:47:29 PM","dateAddedUTC":"2018-02-09T22:47:29.769Z","index":79,"parentId":"311","title":"presentation"},{"id":924,"dateAddedLocal":"10/21/2017, 11:16:26 AM","dateAddedUTC":"2017-10-21T15:16:26.000Z","index":0,"parentId":"923","title":"Turn.js Documentation","url":"http://turnjs.com/docs/How_Turn.js_Works"},{"id":925,"dateAddedLocal":"2/9/2018, 5:47:29 PM","dateAddedUTC":"2018-02-09T22:47:29.769Z","index":80,"parentId":"311","title":"pry"},{"id":926,"dateAddedLocal":"9/12/2017, 1:11:10 PM","dateAddedUTC":"2017-09-12T17:11:10.000Z","index":0,"parentId":"925","title":"nixme/pry-debugger - Ruby","url":"https://github.com/nixme/pry-debugger"},{"id":927,"dateAddedLocal":"9/12/2017, 1:11:10 PM","dateAddedUTC":"2017-09-12T17:11:10.000Z","index":1,"parentId":"925","title":"Pry - an IRB alternative and runtime developer console","url":"http://pryrepl.org/"},{"id":928,"dateAddedLocal":"9/12/2017, 1:11:10 PM","dateAddedUTC":"2017-09-12T17:11:10.000Z","index":2,"parentId":"925","title":"pry/pry: An IRB alternative and runtime developer console","url":"https://github.com/pry/pry"},{"id":929,"dateAddedLocal":"2/9/2018, 5:47:29 PM","dateAddedUTC":"2018-02-09T22:47:29.770Z","index":81,"parentId":"311","title":"python"},{"id":930,"dateAddedLocal":"12/20/2017, 6:27:23 AM","dateAddedUTC":"2017-12-20T11:27:23.000Z","index":0,"parentId":"929","title":"Installing Packages — Python Packaging User Guide","url":"https://packaging.python.org/tutorials/installing-packages/"},{"id":931,"dateAddedLocal":"12/20/2017, 6:48:13 AM","dateAddedUTC":"2017-12-20T11:48:13.000Z","index":1,"parentId":"929","title":"Pipenv & Virtual Environments — The Hitchhiker's Guide to Python","url":"http://docs.python-guide.org/en/latest/dev/virtualenvs/#virtualenvironments-ref"},{"id":932,"dateAddedLocal":"9/26/2017, 6:10:12 PM","dateAddedUTC":"2017-09-26T22:10:12.000Z","index":2,"parentId":"929","title":"Python (programming language) - Wikipedia","url":"https://en.wikipedia.org/wiki/Python_(programming_language)"},{"id":933,"dateAddedLocal":"12/20/2017, 6:27:36 AM","dateAddedUTC":"2017-12-20T11:27:36.000Z","index":3,"parentId":"929","title":"Python Releases for Mac OS X | Python.org","url":"https://www.python.org/downloads/mac-osx/"},{"id":934,"dateAddedLocal":"9/12/2017, 1:11:10 PM","dateAddedUTC":"2017-09-12T17:11:10.000Z","index":4,"parentId":"929","title":"Simple HTTP Server with Python","url":"http://www.linuxjournal.com/content/tech-tip-really-simple-http-server-python"},{"id":935,"dateAddedLocal":"2/9/2018, 5:47:29 PM","dateAddedUTC":"2018-02-09T22:47:29.771Z","index":82,"parentId":"311","title":"r"},{"id":936,"dateAddedLocal":"9/12/2017, 1:11:10 PM","dateAddedUTC":"2017-09-12T17:11:10.000Z","index":0,"parentId":"935","title":"Data Import | R Tutorial","url":"http://www.r-tutor.com/r-introduction/data-frame/data-import"},{"id":937,"dateAddedLocal":"9/12/2017, 1:11:10 PM","dateAddedUTC":"2017-09-12T17:11:10.000Z","index":1,"parentId":"935","title":"R Tutorial with Bayesian Statistics Using OpenBUGS | R Tutorial","url":"http://www.r-tutor.com/content/r-tutorial-ebook"},{"id":938,"dateAddedLocal":"2/9/2018, 5:47:29 PM","dateAddedUTC":"2018-02-09T22:47:29.771Z","index":83,"parentId":"311","title":"rails"},{"id":939,"dateAddedLocal":"9/12/2017, 1:11:10 PM","dateAddedUTC":"2017-09-12T17:11:10.000Z","index":0,"parentId":"938","title":"17 Best Resources for Rails Developer - PhraseApp Blog","url":"https://phraseapp.com/blog/posts/17-best-resources-for-rails-developer/"},{"id":940,"dateAddedLocal":"9/15/2017, 5:09:25 PM","dateAddedUTC":"2017-09-15T21:09:25.000Z","index":1,"parentId":"938","title":"ActionView::Helpers::FormTagHelper","url":"http://api.rubyonrails.org/classes/ActionView/Helpers/FormTagHelper.html"},{"id":941,"dateAddedLocal":"9/12/2017, 1:11:10 PM","dateAddedUTC":"2017-09-12T17:11:10.000Z","index":2,"parentId":"938","title":"Intro To Rails - Intro To Rails","url":"http://docs.railsbridge.org/intro-to-rails/"},{"id":942,"dateAddedLocal":"9/12/2017, 1:11:10 PM","dateAddedUTC":"2017-09-12T17:11:10.000Z","index":3,"parentId":"938","title":"Rails Style Guid","url":"https://github.com/bbatsov/rails-style-guide#os-specific-gemfile-locks"},{"id":943,"dateAddedLocal":"9/12/2017, 1:11:10 PM","dateAddedUTC":"2017-09-12T17:11:10.000Z","index":4,"parentId":"938","title":"RailsCasts","url":"http://railscasts.com/"},{"id":944,"dateAddedLocal":"9/12/2017, 1:11:10 PM","dateAddedUTC":"2017-09-12T17:11:10.000Z","index":5,"parentId":"938","title":"RailsGuides","url":"http://guides.rubyonrails.org/"},{"id":945,"dateAddedLocal":"9/12/2017, 1:11:10 PM","dateAddedUTC":"2017-09-12T17:11:10.000Z","index":6,"parentId":"938","title":"RoRails Tutorial ","url":"https://www.railstutorial.org/book/frontmatter"},{"id":946,"dateAddedLocal":"9/12/2017, 1:11:10 PM","dateAddedUTC":"2017-09-12T17:11:10.000Z","index":7,"parentId":"938","title":"Ruby and Rails Reserved Words","url":"http://www.rubymagic.org/posts/ruby-and-rails-reserved-words"},{"id":947,"dateAddedLocal":"9/12/2017, 1:11:10 PM","dateAddedUTC":"2017-09-12T17:11:10.000Z","index":8,"parentId":"938","title":"Tutorial on setting up GitHub login in a Rails application - YouTube","url":"https://www.youtube.com/watch?v=WWcbcNlsK7U"},{"id":1380,"dateAddedLocal":"2/27/2018, 4:32:58 PM","dateAddedUTC":"2018-02-27T21:32:58.696Z","index":9,"parentId":"938","title":"Sortable Table Columns - RichOnRails.com","url":"https://richonrails.com/articles/sortable-table-columns"},{"id":948,"dateAddedLocal":"2/9/2018, 5:47:29 PM","dateAddedUTC":"2018-02-09T22:47:29.773Z","index":84,"parentId":"311","title":"rails-validation"},{"id":949,"dateAddedLocal":"9/15/2017, 9:37:16 PM","dateAddedUTC":"2017-09-16T01:37:16.000Z","index":0,"parentId":"948","title":"Active Record Callbacks — Ruby on Rails Guides","url":"http://guides.rubyonrails.org/active_record_callbacks.html#running-callbacks"},{"id":950,"dateAddedLocal":"9/15/2017, 9:37:51 PM","dateAddedUTC":"2017-09-16T01:37:51.000Z","index":1,"parentId":"948","title":"Active Record Validations — Ruby on Rails Guides","url":"http://guides.rubyonrails.org/active_record_validations.html#displaying-validation-errors-in-views"},{"id":951,"dateAddedLocal":"9/15/2017, 9:37:59 PM","dateAddedUTC":"2017-09-16T01:37:59.000Z","index":2,"parentId":"948","title":"Active Record Validations — Ruby on Rails Guides","url":"http://guides.rubyonrails.org/active_record_validations.html#validation-helpers"},{"id":952,"dateAddedLocal":"9/15/2017, 9:42:53 PM","dateAddedUTC":"2017-09-16T01:42:53.000Z","index":3,"parentId":"948","title":"Custom Active Record Validations ","url":"http://guides.rubyonrails.org/active_record_validations.html#performing-custom-validations"},{"id":953,"dateAddedLocal":"2/9/2018, 5:47:29 PM","dateAddedUTC":"2018-02-09T22:47:29.773Z","index":85,"parentId":"311","title":"rake"},{"id":954,"dateAddedLocal":"9/13/2017, 1:27:36 PM","dateAddedUTC":"2017-09-13T17:27:36.000Z","index":0,"parentId":"953","title":"Rake - learn","url":"https://learn.co/tracks/full-stack-web-dev-with-react/orms-and-activerecord/activerecord/intro-to-rake"},{"id":955,"dateAddedLocal":"2/9/2018, 5:47:29 PM","dateAddedUTC":"2018-02-09T22:47:29.773Z","index":86,"parentId":"311","title":"rasberry pi"},{"id":956,"dateAddedLocal":"9/12/2017, 1:11:10 PM","dateAddedUTC":"2017-09-12T17:11:10.000Z","index":0,"parentId":"955","title":"How to Install Ruby on Rails on Raspberry Pi","url":"https://computers.tutsplus.com/tutorials/how-to-install-ruby-on-rails-on-raspberry-pi--cms-21421"},{"id":957,"dateAddedLocal":"9/12/2017, 1:11:10 PM","dateAddedUTC":"2017-09-12T17:11:10.000Z","index":1,"parentId":"955","title":"postgresql on rasberry pi -- Ben Walters - Blog","url":"http://blog.bpwalters.com/setting-up-postgresql-on-raspberry-pi/"},{"id":958,"dateAddedLocal":"9/12/2017, 1:11:10 PM","dateAddedUTC":"2017-09-12T17:11:10.000Z","index":2,"parentId":"955","title":"PostgreSQL on Raspberry Pi","url":"http://raspberrypg.org/2015/06/step-5-update-installing-postgresql-on-my-raspberry-pi-1-and-2/#more-248"},{"id":959,"dateAddedLocal":"9/12/2017, 1:11:10 PM","dateAddedUTC":"2017-09-12T17:11:10.000Z","index":3,"parentId":"955","title":"Raspberry Pi Blog - News, Announcements, and Ideas","url":"https://www.raspberrypi.org/blog/#amazon-echo-homebrew-version"},{"id":960,"dateAddedLocal":"9/12/2017, 1:11:10 PM","dateAddedUTC":"2017-09-12T17:11:10.000Z","index":4,"parentId":"955","title":"raspbian - Connect to Raspberry Pi over ssh: connection refused (from putty) - Raspberry Pi Stack Exchange","url":"https://raspberrypi.stackexchange.com/questions/33431/connect-to-raspberry-pi-over-ssh-connection-refused-from-putty"},{"id":961,"dateAddedLocal":"9/12/2017, 1:11:10 PM","dateAddedUTC":"2017-09-12T17:11:10.000Z","index":5,"parentId":"955","title":"Running a Linux Web Server on an Android device | Codementor","url":"https://www.codementor.io/maxpleaner/run-a-linux-web-server-on-android-device-du1083k05"},{"id":962,"dateAddedLocal":"9/12/2017, 1:11:10 PM","dateAddedUTC":"2017-09-12T17:11:10.000Z","index":6,"parentId":"955","title":"SONIC PI: LIVE & CODING","url":"http://www.sonicpiliveandcoding.com/"},{"id":963,"dateAddedLocal":"2/9/2018, 5:47:29 PM","dateAddedUTC":"2018-02-09T22:47:29.775Z","index":87,"parentId":"311","title":"react"},{"id":964,"dateAddedLocal":"1/1/2018, 5:44:41 PM","dateAddedUTC":"2018-01-01T22:44:41.000Z","index":0,"parentId":"963","title":"33 Validation Examples with ReactJS","url":"https://react.rocks/tag/Validation"},{"id":965,"dateAddedLocal":"12/21/2017, 7:58:07 PM","dateAddedUTC":"2017-12-22T00:58:07.000Z","index":1,"parentId":"963","title":"axios/axios: Promise based HTTP client for the browser and node.js","url":"https://github.com/axios/axios#interceptors"},{"id":966,"dateAddedLocal":"1/1/2018, 5:45:00 PM","dateAddedUTC":"2018-01-01T22:45:00.000Z","index":2,"parentId":"963","title":"christianalfoni/formsy-react: A form input builder and validator for React JS","url":"https://github.com/christianalfoni/formsy-react"},{"id":967,"dateAddedLocal":"9/12/2017, 1:11:11 PM","dateAddedUTC":"2017-09-12T17:11:11.000Z","index":3,"parentId":"963","title":"Components and Props - React","url":"https://facebook.github.io/react/docs/components-and-props.html"},{"id":968,"dateAddedLocal":"12/10/2017, 6:51:19 AM","dateAddedUTC":"2017-12-10T11:51:19.000Z","index":4,"parentId":"963","title":"css-modules/css-modules: Documentation about css-modules","url":"https://github.com/css-modules/css-modules"},{"id":969,"dateAddedLocal":"11/29/2017, 12:15:20 PM","dateAddedUTC":"2017-11-29T17:15:20.000Z","index":5,"parentId":"963","title":"Diagram: Fetching API Data with React","url":"https://blog.hellojs.org/fetching-api-data-with-react-js-460fe8bbf8f2"},{"id":970,"dateAddedLocal":"12/10/2017, 6:40:21 AM","dateAddedUTC":"2017-12-10T11:40:21.000Z","index":6,"parentId":"963","title":"How to Use CSS Modules with Create React App – Nulogy – Medium","url":"https://medium.com/nulogy/how-to-use-css-modules-with-create-react-app-9e44bec2b5c2"},{"id":971,"dateAddedLocal":"9/12/2017, 1:11:11 PM","dateAddedUTC":"2017-09-12T17:11:11.000Z","index":7,"parentId":"963","title":"Learn - Components Lab","url":"https://learn.co/tracks/full-stack-web-dev-with-react/react/rendering/components-lab"},{"id":972,"dateAddedLocal":"9/12/2017, 1:11:10 PM","dateAddedUTC":"2017-09-12T17:11:10.000Z","index":8,"parentId":"963","title":"Learn React By Itself -- no JSX, no Flux, no ES6, no Webpack.","url":"http://jamesknelson.com/learn-raw-react-no-jsx-flux-es6-webpack/"},{"id":973,"dateAddedLocal":"11/11/2017, 7:26:34 PM","dateAddedUTC":"2017-11-12T00:26:34.000Z","index":9,"parentId":"963","title":"Presentational and Container Components – Dan Abramov – Medium","url":"https://medium.com/@dan_abramov/smart-and-dumb-components-7ca2f9a7c7d0"},{"id":974,"dateAddedLocal":"11/3/2017, 10:59:45 AM","dateAddedUTC":"2017-11-03T14:59:45.000Z","index":10,"parentId":"963","title":"Raw React tutorial","url":"https://reactarmory.com/guides/learn-react-by-itself/react-basics"},{"id":975,"dateAddedLocal":"9/12/2017, 1:11:10 PM","dateAddedUTC":"2017-09-12T17:11:10.000Z","index":11,"parentId":"963","title":"React Chrome Developer Tools - React Blog","url":"https://facebook.github.io/react/blog/2014/01/02/react-chrome-developer-tools.html"},{"id":976,"dateAddedLocal":"9/12/2017, 1:11:11 PM","dateAddedUTC":"2017-09-12T17:11:11.000Z","index":12,"parentId":"963","title":"React Components","url":"https://khan.github.io/react-components/#modal"},{"id":977,"dateAddedLocal":"9/12/2017, 1:11:10 PM","dateAddedUTC":"2017-09-12T17:11:10.000Z","index":13,"parentId":"963","title":"React JS Tutorials for Beginners - 1 - Getting Started - YouTube","url":"https://www.youtube.com/watch?v=-AbaV3nrw6E"},{"id":978,"dateAddedLocal":"12/24/2017, 11:57:06 AM","dateAddedUTC":"2017-12-24T16:57:06.000Z","index":14,"parentId":"963","title":"React Router: Declarative Routing for React.js","url":"https://reacttraining.com/react-router/"},{"id":979,"dateAddedLocal":"12/24/2017, 12:34:02 PM","dateAddedUTC":"2017-12-24T17:34:02.000Z","index":15,"parentId":"963","title":"React Router: Declarative Routing for React.js","url":"https://reacttraining.com/react-router/web/guides/philosophy"},{"id":980,"dateAddedLocal":"9/12/2017, 1:11:11 PM","dateAddedUTC":"2017-09-12T17:11:11.000Z","index":16,"parentId":"963","title":"React The ES6 Way - Lesson 1, Step 2: Tools of the Trade - SitePoint Premium","url":"https://www.sitepoint.com/premium/courses/react-the-es6-way-2914/lesson/1/step/2"},{"id":981,"dateAddedLocal":"9/12/2017, 1:11:10 PM","dateAddedUTC":"2017-09-12T17:11:10.000Z","index":17,"parentId":"963","title":"React Top-Level API - React","url":"https://facebook.github.io/react/docs/react-api.html"},{"id":982,"dateAddedLocal":"1/1/2018, 5:44:51 PM","dateAddedUTC":"2018-01-01T22:44:51.000Z","index":18,"parentId":"963","title":"react-validation","url":"https://www.npmjs.com/package/react-validation"},{"id":983,"dateAddedLocal":"9/12/2017, 1:11:10 PM","dateAddedUTC":"2017-09-12T17:11:10.000Z","index":19,"parentId":"963","title":"reactjs - Any good debug tutorial for React.js - Stack Overflow","url":"http://stackoverflow.com/questions/32772379/any-good-debug-tutorial-for-react-js"},{"id":984,"dateAddedLocal":"9/12/2017, 1:11:11 PM","dateAddedUTC":"2017-09-12T17:11:11.000Z","index":20,"parentId":"963","title":"Read Me · Redux","url":"http://redux.js.org/"},{"id":985,"dateAddedLocal":"11/7/2017, 9:25:46 PM","dateAddedUTC":"2017-11-08T02:25:46.000Z","index":21,"parentId":"963","title":"Understanding the React Component Lifecycle","url":"http://busypeoples.github.io/post/react-component-lifecycle/"},{"id":986,"dateAddedLocal":"1/1/2018, 5:44:20 PM","dateAddedUTC":"2018-01-01T22:44:20.000Z","index":22,"parentId":"963","title":"validate.js","url":"https://validatejs.org/"},{"id":987,"dateAddedLocal":"11/1/2017, 7:58:44 PM","dateAddedUTC":"2017-11-01T23:58:44.000Z","index":23,"parentId":"963","title":"webpack-a module bundler for JS apps","url":"https://webpack.js.org/concepts/"},{"id":988,"dateAddedLocal":"1/12/2018, 8:57:18 AM","dateAddedUTC":"2018-01-12T13:57:18.000Z","index":24,"parentId":"963","title":"reactjs - Get a list of all possible paths with react-router - Stack Overflow","url":"https://stackoverflow.com/questions/27656792/get-a-list-of-all-possible-paths-with-react-router"},{"id":989,"dateAddedLocal":"1/23/2018, 9:57:07 PM","dateAddedUTC":"2018-01-24T02:57:07.000Z","index":25,"parentId":"963","title":"How to Structure Your React Project","url":"https://daveceddia.com/react-project-structure/"},{"id":990,"dateAddedLocal":"1/31/2018, 1:54:20 PM","dateAddedUTC":"2018-01-31T18:54:20.000Z","index":26,"parentId":"963","title":"React Binding Patterns: 5 Approaches for Handling `this`","url":"https://medium.freecodecamp.org/react-binding-patterns-5-approaches-for-handling-this-92c651b5af56"},{"id":991,"dateAddedLocal":"2/9/2018, 5:47:29 PM","dateAddedUTC":"2018-02-09T22:47:29.779Z","index":88,"parentId":"311","title":"react-jsx"},{"id":992,"dateAddedLocal":"9/12/2017, 1:11:10 PM","dateAddedUTC":"2017-09-12T17:11:10.000Z","index":0,"parentId":"991","title":"JSX - React","url":"https://facebook.github.io/react/docs/introducing-jsx.html"},{"id":993,"dateAddedLocal":"11/1/2017, 10:01:19 PM","dateAddedUTC":"2017-11-02T02:01:19.000Z","index":1,"parentId":"991","title":"JSX - React","url":"https://reactjs.org/docs/introducing-jsx.html"},{"id":994,"dateAddedLocal":"11/1/2017, 10:01:33 PM","dateAddedUTC":"2017-11-02T02:01:33.000Z","index":2,"parentId":"991","title":"JSX In Depth - React","url":"https://reactjs.org/docs/jsx-in-depth.html"},{"id":995,"dateAddedLocal":"2/9/2018, 5:47:29 PM","dateAddedUTC":"2018-02-09T22:47:29.779Z","index":89,"parentId":"311","title":"react-redux"},{"id":996,"dateAddedLocal":"1/2/2018, 4:54:25 PM","dateAddedUTC":"2018-01-02T21:54:25.000Z","index":0,"parentId":"995","title":"Actions · Redux","url":"https://redux.js.org/docs/basics/Actions.html"},{"id":997,"dateAddedLocal":"1/4/2018, 12:59:32 PM","dateAddedUTC":"2018-01-04T17:59:32.000Z","index":1,"parentId":"995","title":"Async Actions · Redux","url":"https://redux.js.org/docs/advanced/AsyncActions.html"},{"id":998,"dateAddedLocal":"11/14/2017, 11:12:08 AM","dateAddedUTC":"2017-11-14T16:12:08.000Z","index":2,"parentId":"995","title":"Building React Applications with Idiomatic Redux from @dan_abramov on @eggheadio","url":"https://egghead.io/courses/building-react-applications-with-idiomatic-redux"},{"id":999,"dateAddedLocal":"1/2/2018, 4:54:21 PM","dateAddedUTC":"2018-01-02T21:54:21.000Z","index":3,"parentId":"995","title":"Core Concepts · Redux","url":"https://redux.js.org/docs/introduction/CoreConcepts.html"},{"id":1000,"dateAddedLocal":"1/2/2018, 4:54:33 PM","dateAddedUTC":"2018-01-02T21:54:33.000Z","index":4,"parentId":"995","title":"FAQ · Redux","url":"https://redux.js.org/docs/FAQ.html"},{"id":1001,"dateAddedLocal":"11/11/2017, 7:28:13 PM","dateAddedUTC":"2017-11-12T00:28:13.000Z","index":5,"parentId":"995","title":"Getting Started with Redux from @dan_abramov on @eggheadio","url":"https://egghead.io/courses/getting-started-with-redux"},{"id":1002,"dateAddedLocal":"11/14/2017, 11:54:30 AM","dateAddedUTC":"2017-11-14T16:54:30.000Z","index":6,"parentId":"995","title":"Learn Redux — 20 video tutorials to help you learn how to build JavaScript apps with React.js and Redux.","url":"https://learnredux.com/"},{"id":1003,"dateAddedLocal":"11/14/2017, 11:52:48 AM","dateAddedUTC":"2017-11-14T16:52:48.000Z","index":7,"parentId":"995","title":"react-redux-links: Curated tutorial and resource links I've collected on React, Redux, ES6, and more","url":"https://github.com/markerikson/react-redux-links"},{"id":1004,"dateAddedLocal":"11/14/2017, 11:52:52 AM","dateAddedUTC":"2017-11-14T16:52:52.000Z","index":8,"parentId":"995","title":"markerikson/redux-ecosystem-links: A categorized list of Redux-related addons, libraries, and utilities","url":"https://github.com/markerikson/redux-ecosystem-links"},{"id":1005,"dateAddedLocal":"1/4/2018, 12:59:15 PM","dateAddedUTC":"2018-01-04T17:59:15.000Z","index":9,"parentId":"995","title":"Middleware · Redux","url":"https://redux.js.org/docs/advanced/Middleware.html"},{"id":1006,"dateAddedLocal":"1/2/2018, 4:54:17 PM","dateAddedUTC":"2018-01-02T21:54:17.000Z","index":10,"parentId":"995","title":"Read Me · Redux","url":"https://redux.js.org/"},{"id":1007,"dateAddedLocal":"1/2/2018, 4:54:28 PM","dateAddedUTC":"2018-01-02T21:54:28.000Z","index":11,"parentId":"995","title":"Reducers · Redux","url":"https://redux.js.org/docs/basics/Reducers.html"},{"id":1008,"dateAddedLocal":"1/2/2018, 4:54:00 PM","dateAddedUTC":"2018-01-02T21:54:00.000Z","index":12,"parentId":"995","title":"slides","url":"file:///Users/BradSmith/Downloads/state-types.pdf"},{"id":1009,"dateAddedLocal":"12/4/2017, 4:21:16 PM","dateAddedUTC":"2017-12-04T21:21:16.000Z","index":13,"parentId":"995","title":"SophieDeBenedetto/catbook-redux: simple sample redux app","url":"https://github.com/SophieDeBenedetto/catbook-redux/tree/master"},{"id":1010,"dateAddedLocal":"1/4/2018, 12:59:22 PM","dateAddedUTC":"2018-01-04T17:59:22.000Z","index":14,"parentId":"995","title":"Thunk middleware for Redux","url":"https://github.com/gaearon/redux-thunk"},{"id":1011,"dateAddedLocal":"11/14/2017, 11:52:41 AM","dateAddedUTC":"2017-11-14T16:52:41.000Z","index":15,"parentId":"995","title":"xgrommx/awesome-redux: Awesome list of Redux examples and middlewares","url":"https://github.com/xgrommx/awesome-redux"},{"id":1171,"dateAddedLocal":"1/31/2018, 3:25:37 PM","dateAddedUTC":"2018-01-31T20:25:37.000Z","index":16,"parentId":"995","title":"Using Object Spread Operator · Redux","url":"https://redux.js.org/docs/recipes/UsingObjectSpreadOperator.html"},{"id":566,"dateAddedLocal":"2/9/2018, 5:47:29 PM","dateAddedUTC":"2018-02-09T22:47:29.722Z","index":90,"parentId":"311","title":"refs"},{"id":567,"dateAddedLocal":"9/12/2017, 1:11:10 PM","dateAddedUTC":"2017-09-12T17:11:10.000Z","index":0,"parentId":"566","title":"25Useful Keybd Shortcuts","url":"https://blog.hubspot.com/sales/chrome-keyboard-shortcuts#sm.0001ltmxn310hseduuyr7pg3zq12t"},{"id":568,"dateAddedLocal":"9/12/2017, 1:11:10 PM","dateAddedUTC":"2017-09-12T17:11:10.000Z","index":1,"parentId":"566","title":"6 Simple Tools to Increase Your Coding Productivity « Flatiron School","url":"http://blog.flatironschool.com/6-simple-tools-to-increase-your-coding-productivity/?utm_campaign=Alumni%20Engagement%20&utm_content=31428254&utm_medium=social&utm_source=twitter"},{"id":569,"dateAddedLocal":"9/12/2017, 1:11:10 PM","dateAddedUTC":"2017-09-12T17:11:10.000Z","index":2,"parentId":"566","title":"Class: Time (Ruby 2.3.0)","url":"https://ruby-doc.org/stdlib-2.3.0/libdoc/time/rdoc/Time.html#method-c-strptime"},{"id":570,"dateAddedLocal":"10/14/2017, 1:54:22 PM","dateAddedUTC":"2017-10-14T17:54:22.000Z","index":3,"parentId":"566","title":"Cooperpress","url":"https://cooperpress.com/publications/"},{"id":571,"dateAddedLocal":"9/12/2017, 1:11:10 PM","dateAddedUTC":"2017-09-12T17:11:10.000Z","index":4,"parentId":"566","title":"Date & Time in Ruby","url":"https://www.tutorialspoint.com/ruby/ruby_date_time.htm"},{"id":572,"dateAddedLocal":"9/12/2017, 1:11:10 PM","dateAddedUTC":"2017-09-12T17:11:10.000Z","index":5,"parentId":"566","title":"Design Patterns | Object Oriented Design","url":"http://www.oodesign.com/"},{"id":573,"dateAddedLocal":"9/12/2017, 1:11:10 PM","dateAddedUTC":"2017-09-12T17:11:10.000Z","index":6,"parentId":"566","title":"HappenApps","url":"http://happenapps.com/#quiver"},{"id":574,"dateAddedLocal":"9/12/2017, 1:11:10 PM","dateAddedUTC":"2017-09-12T17:11:10.000Z","index":7,"parentId":"566","title":"Internet: Lots More Information - HowStuffWorks","url":"http://computer.howstuffworks.com/internet/basics/internet3.htm"},{"id":575,"dateAddedLocal":"12/17/2017, 5:18:03 PM","dateAddedUTC":"2017-12-17T22:18:03.000Z","index":8,"parentId":"566","title":"JSONPlaceholder - Fake online REST API for developers","url":"http://jsonplaceholder.typicode.com/"},{"id":576,"dateAddedLocal":"9/12/2017, 1:11:10 PM","dateAddedUTC":"2017-09-12T17:11:10.000Z","index":9,"parentId":"566","title":"Learn - Set Up","url":"https://learn.co/manual_setup"},{"id":577,"dateAddedLocal":"9/12/2017, 1:11:10 PM","dateAddedUTC":"2017-09-12T17:11:10.000Z","index":10,"parentId":"566","title":"NaturalReader","url":"javascript:(function()%7BreadStyle%3D%27style-newspaper%27%3BreadSize%3D%27size-large%27%3BreadMargin%3D%27margin-wide%27%3Bvar%20locationURL%3Ddocument.location.href%3Bwindow.open(%27http://www.naturalreaders.com/nr_gettext.php%3F%26url%3D%27%2BencodeURIComponent(locationURL))%3B%7D)()%3B"},{"id":578,"dateAddedLocal":"9/12/2017, 1:11:10 PM","dateAddedUTC":"2017-09-12T17:11:10.000Z","index":11,"parentId":"566","title":"OneTab extension for Google Chrome and Firefox - save up to 95% memory and reduce tab clutter","url":"https://www.one-tab.com/"},{"id":579,"dateAddedLocal":"9/12/2017, 1:11:10 PM","dateAddedUTC":"2017-09-12T17:11:10.000Z","index":12,"parentId":"566","title":"PDF to WORD","url":"http://www.pdfonline.com/"},{"id":580,"dateAddedLocal":"9/12/2017, 1:11:10 PM","dateAddedUTC":"2017-09-12T17:11:10.000Z","index":13,"parentId":"566","title":"ScreenCap","url":"http://www.imore.com/screenshot-mac"},{"id":581,"dateAddedLocal":"9/12/2017, 1:11:10 PM","dateAddedUTC":"2017-09-12T17:11:10.000Z","index":14,"parentId":"566","title":"URL Encoded Characters","url":"http://www.degraeve.com/reference/urlencoding.php"},{"id":469,"dateAddedLocal":"9/12/2017, 1:11:10 PM","dateAddedUTC":"2017-09-12T17:11:10.000Z","index":15,"parentId":"566","title":"Curated list of awesome lists","url":"https://github.com/sindresorhus/awesome"},{"id":1475,"dateAddedLocal":"3/16/2018, 11:28:57 AM","dateAddedUTC":"2018-03-16T15:28:57.899Z","index":16,"parentId":"566","title":"Software development: Glossary - Reference from WhatIs.com","url":"http://whatis.techtarget.com/reference/Software-development-Glossary"},{"id":1012,"dateAddedLocal":"2/9/2018, 5:47:29 PM","dateAddedUTC":"2018-02-09T22:47:29.782Z","index":91,"parentId":"311","title":"regex"},{"id":1013,"dateAddedLocal":"9/12/2017, 1:11:11 PM","dateAddedUTC":"2017-09-12T17:11:11.000Z","index":0,"parentId":"1012","title":"Become a regular with regular expressions","url":"https://www.tableau.com/about/blog/2015/6/become-regular-regular-expressions-39802"},{"id":1014,"dateAddedLocal":"9/12/2017, 1:11:11 PM","dateAddedUTC":"2017-09-12T17:11:11.000Z","index":1,"parentId":"1012","title":"EditPad - Text Editor for Windows","url":"https://www.editpadpro.com/"},{"id":1015,"dateAddedLocal":"9/12/2017, 1:11:11 PM","dateAddedUTC":"2017-09-12T17:11:11.000Z","index":2,"parentId":"1012","title":"Online regex tester and debugger: JavaScript, Python, PHP, and PCRE","url":"https://regex101.com/r/nW9iC5/3"},{"id":1016,"dateAddedLocal":"9/12/2017, 1:11:11 PM","dateAddedUTC":"2017-09-12T17:11:11.000Z","index":3,"parentId":"1012","title":"PowerGREP: Windows grep Software to Search (and Replace) through Files and Folders on Your PC and Network","url":"https://www.powergrep.com/"},{"id":1017,"dateAddedLocal":"9/12/2017, 1:11:11 PM","dateAddedUTC":"2017-09-12T17:11:11.000Z","index":4,"parentId":"1012","title":"REGEX: How to Become a Regular Expression Power User","url":"https://www.memberpress.com/how-to-become-a-regular-expression-power-user/"},{"id":1018,"dateAddedLocal":"9/12/2017, 1:11:11 PM","dateAddedUTC":"2017-09-12T17:11:11.000Z","index":5,"parentId":"1012","title":"REGEX: RegexOne - Learn Regular Expressions - Lesson 1: An Introduction, and the ABCs","url":"http://regexone.com/"},{"id":1019,"dateAddedLocal":"9/12/2017, 1:11:11 PM","dateAddedUTC":"2017-09-12T17:11:11.000Z","index":6,"parentId":"1012","title":"REGEX: Rubular: Ruby regular expression editor and tester","url":"http://rubular.com/"},{"id":1020,"dateAddedLocal":"9/12/2017, 1:11:11 PM","dateAddedUTC":"2017-09-12T17:11:11.000Z","index":7,"parentId":"1012","title":"RegexOne - Learn Regular Expressions - Lesson 1: An Introduction, and the ABCs","url":"https://www.regexone.com/"},{"id":1021,"dateAddedLocal":"9/12/2017, 3:13:54 PM","dateAddedUTC":"2017-09-12T19:13:54.000Z","index":8,"parentId":"1012","title":"RegexOne - Learn Regular Expressions - Problem 1: Matching a decimal numbers","url":"https://regexone.com/problem/matching_decimal_numbers"},{"id":1022,"dateAddedLocal":"9/12/2017, 1:11:11 PM","dateAddedUTC":"2017-09-12T17:11:11.000Z","index":9,"parentId":"1012","title":"RegExr: Learn, Build, & Test RegEx","url":"http://regexr.com/"},{"id":1023,"dateAddedLocal":"9/12/2017, 1:11:11 PM","dateAddedUTC":"2017-09-12T17:11:11.000Z","index":10,"parentId":"1012","title":"Regular-Expressions.pdf","url":"https://www.princeton.edu/~mlovett/reference/Regular-Expressions.pdf"},{"id":1312,"dateAddedLocal":"2/13/2018, 7:47:03 AM","dateAddedUTC":"2018-02-13T12:47:03.218Z","index":11,"parentId":"1012","title":"Online regex tester and debugger: PHP, PCRE, Python, Golang and JavaScript","url":"https://regex101.com/account/all"},{"id":1501,"dateAddedLocal":"3/24/2018, 6:44:54 PM","dateAddedUTC":"2018-03-24T22:44:54.203Z","index":12,"parentId":"1012","title":"RegExLib.com Regular Expression Cheat Sheet (.NET Framework)","url":"http://regexlib.com/CheatSheet.aspx"},{"id":346,"dateAddedLocal":"9/12/2017, 1:11:09 PM","dateAddedUTC":"2017-09-12T17:11:09.000Z","index":13,"parentId":"1012","title":"REGEX","url":"http://rubular.com/"},{"id":347,"dateAddedLocal":"9/12/2017, 1:11:09 PM","dateAddedUTC":"2017-09-12T17:11:09.000Z","index":14,"parentId":"1012","title":"REGEX intro Regular Expressions - YouTube","url":"https://www.youtube.com/watch?v=-Yy2agBN8EA"},{"id":1024,"dateAddedLocal":"2/9/2018, 5:47:29 PM","dateAddedUTC":"2018-02-09T22:47:29.784Z","index":92,"parentId":"311","title":"responsive web design"},{"id":1025,"dateAddedLocal":"10/24/2017, 7:06:38 PM","dateAddedUTC":"2017-10-24T23:06:38.000Z","index":0,"parentId":"1024","title":"Responsive web design - Wikipedia","url":"https://en.wikipedia.org/wiki/Responsive_web_design"},{"id":1102,"dateAddedLocal":"2/9/2018, 5:47:29 PM","dateAddedUTC":"2018-02-09T22:47:29.794Z","index":93,"parentId":"311","title":"rspec"},{"id":1103,"dateAddedLocal":"9/12/2017, 1:11:11 PM","dateAddedUTC":"2017-09-12T17:11:11.000Z","index":0,"parentId":"1102","title":"Better Specs { rspec guidelines with ruby }","url":"http://betterspecs.org/"},{"id":1104,"dateAddedLocal":"9/16/2017, 12:30:04 PM","dateAddedUTC":"2017-09-16T16:30:04.000Z","index":1,"parentId":"1102","title":"Rails testing on Learn","url":"https://learn.co/tracks/full-stack-web-dev-with-react/rails/validations-and-forms/rails-testing"},{"id":1105,"dateAddedLocal":"9/16/2017, 8:22:46 AM","dateAddedUTC":"2017-09-16T12:22:46.000Z","index":2,"parentId":"1102","title":"RSpec documentation","url":"http://rspec.info/documentation/"},{"id":1106,"dateAddedLocal":"9/12/2017, 1:11:11 PM","dateAddedUTC":"2017-09-12T17:11:11.000Z","index":3,"parentId":"1102","title":"rspec INTRO","url":"http://blog.teamtreehouse.com/an-introduction-to-rspec"},{"id":1107,"dateAddedLocal":"9/12/2017, 1:11:11 PM","dateAddedUTC":"2017-09-12T17:11:11.000Z","index":4,"parentId":"1102","title":"RSpec Testing for Beginners, Part 1","url":"https://code.tutsplus.com/articles/rspec-testing-for-beginners-part-1--cms-26716"},{"id":1108,"dateAddedLocal":"9/16/2017, 8:23:34 AM","dateAddedUTC":"2017-09-16T12:23:34.000Z","index":5,"parentId":"1102","title":"RSPEC-RAILS","url":"http://rspec.info/documentation/3.6/rspec-rails/"},{"id":1026,"dateAddedLocal":"2/9/2018, 5:47:29 PM","dateAddedUTC":"2018-02-09T22:47:29.784Z","index":94,"parentId":"311","title":"ruby"},{"id":1027,"dateAddedLocal":"9/12/2017, 1:11:11 PM","dateAddedUTC":"2017-09-12T17:11:11.000Z","index":0,"parentId":"1026","title":"A Quick (and Hopefully Painless) Ride Through Ruby (with Cartoon Foxes) :: Why's (Poignant) Guide to Ruby","url":"http://poignant.guide/book/chapter-3.html"},{"id":1028,"dateAddedLocal":"9/12/2017, 1:11:11 PM","dateAddedUTC":"2017-09-12T17:11:11.000Z","index":1,"parentId":"1026","title":"A Ruby HOWTO: Writing A Method That Uses Code Blocks | Archives | codablog | Coda Hale","url":"http://blog.codahale.com/2005/11/24/a-ruby-howto-writing-a-method-that-uses-code-blocks/"},{"id":1029,"dateAddedLocal":"9/12/2017, 1:11:11 PM","dateAddedUTC":"2017-09-12T17:11:11.000Z","index":2,"parentId":"1026","title":"A Wealth Of Ruby Loops And Iterators","url":"http://www.skorks.com/2009/09/a-wealth-of-ruby-loops-and-iterators/"},{"id":1030,"dateAddedLocal":"9/12/2017, 1:11:11 PM","dateAddedUTC":"2017-09-12T17:11:11.000Z","index":3,"parentId":"1026","title":"All About Ruby | Ruby newbie view on the web development using Ruby on Rails","url":"https://allaboutruby.wordpress.com/"},{"id":1031,"dateAddedLocal":"9/12/2017, 1:11:11 PM","dateAddedUTC":"2017-09-12T17:11:11.000Z","index":4,"parentId":"1026","title":"Block Parameters and Yielding","url":"http://ruby.about.com/od/beginningruby/a/Block-Parameters-And-Yielding.htm"},{"id":1032,"dateAddedLocal":"9/12/2017, 1:11:11 PM","dateAddedUTC":"2017-09-12T17:11:11.000Z","index":5,"parentId":"1026","title":"Class and Instance Methods in Ruby // RailsTips by John Nunemaker","url":"http://www.railstips.org/blog/archives/2009/05/11/class-and-instance-methods-in-ruby/"},{"id":1033,"dateAddedLocal":"9/12/2017, 1:11:11 PM","dateAddedUTC":"2017-09-12T17:11:11.000Z","index":6,"parentId":"1026","title":"Class: String (Ruby 2.2.0)","url":"http://ruby-doc.org/core-2.2.0/String.html"},{"id":1034,"dateAddedLocal":"9/12/2017, 1:11:11 PM","dateAddedUTC":"2017-09-12T17:11:11.000Z","index":7,"parentId":"1026","title":"How to Create and Use Hashes in Ruby","url":"http://ruby.about.com/od/rubyfeatures/a/hashes.htm"},{"id":1035,"dateAddedLocal":"9/12/2017, 1:11:11 PM","dateAddedUTC":"2017-09-12T17:11:11.000Z","index":8,"parentId":"1026","title":"Learn the Ruby Programming Language","url":"http://ruby.about.com/"},{"id":1036,"dateAddedLocal":"9/12/2017, 1:11:11 PM","dateAddedUTC":"2017-09-12T17:11:11.000Z","index":9,"parentId":"1026","title":"Loops & Iterators | Codecademy","url":"https://www.codecademy.com/en/courses/ruby-beginner-en-XYcN1/2/4?curriculum_id=5059f8619189a5000201fbcb"},{"id":1037,"dateAddedLocal":"9/12/2017, 1:11:11 PM","dateAddedUTC":"2017-09-12T17:11:11.000Z","index":10,"parentId":"1026","title":"Recent Tips - Reactive.TIPS - The Official Blog of Reactive.IO","url":"http://www.reactive.io/tips/"},{"id":1038,"dateAddedLocal":"9/12/2017, 1:11:11 PM","dateAddedUTC":"2017-09-12T17:11:11.000Z","index":11,"parentId":"1026","title":"Ruby arrays - Zet Code","url":"http://zetcode.com/lang/rubytutorial/arrays/"},{"id":1039,"dateAddedLocal":"9/12/2017, 1:11:11 PM","dateAddedUTC":"2017-09-12T17:11:11.000Z","index":12,"parentId":"1026","title":"Ruby Blocks 101 | All About Ruby","url":"https://allaboutruby.wordpress.com/2006/01/20/ruby-blocks-101/"},{"id":1040,"dateAddedLocal":"9/12/2017, 1:11:11 PM","dateAddedUTC":"2017-09-12T17:11:11.000Z","index":13,"parentId":"1026","title":"Ruby Errors","url":"http://ruby-doc.org/core-2.2.0/Exception.html"},{"id":1041,"dateAddedLocal":"9/12/2017, 1:11:11 PM","dateAddedUTC":"2017-09-12T17:11:11.000Z","index":14,"parentId":"1026","title":"Ruby Global variables","url":"http://www.rubyist.net/~slagell/ruby/globalvars.html"},{"id":1042,"dateAddedLocal":"9/12/2017, 1:11:11 PM","dateAddedUTC":"2017-09-12T17:11:11.000Z","index":15,"parentId":"1026","title":"Ruby Programming/Syntax/Variables and Constants - Wikibooks, open books for an open world","url":"https://en.wikibooks.org/wiki/Ruby_Programming/Syntax/Variables_and_Constants"},{"id":1043,"dateAddedLocal":"9/12/2017, 1:11:11 PM","dateAddedUTC":"2017-09-12T17:11:11.000Z","index":16,"parentId":"1026","title":"Ruby Syntax","url":"http://ruby-doc.org/docs/ruby-doc-bundle/Manual/man-1.4/syntax.html"},{"id":1044,"dateAddedLocal":"9/12/2017, 1:11:11 PM","dateAddedUTC":"2017-09-12T17:11:11.000Z","index":17,"parentId":"1026","title":"Ruby variables","url":"http://zetcode.com/lang/rubytutorial/variables/"},{"id":1045,"dateAddedLocal":"9/12/2017, 1:11:11 PM","dateAddedUTC":"2017-09-12T17:11:11.000Z","index":18,"parentId":"1026","title":"Ruby-doc.org","url":"http://ruby-doc.org/"},{"id":1046,"dateAddedLocal":"9/12/2017, 1:11:11 PM","dateAddedUTC":"2017-09-12T17:11:11.000Z","index":19,"parentId":"1026","title":"RubyDoc","url":"http://docs.ruby-lang.org/en/2.0.0/index.html"},{"id":1047,"dateAddedLocal":"9/12/2017, 1:11:11 PM","dateAddedUTC":"2017-09-12T17:11:11.000Z","index":20,"parentId":"1026","title":"RubyMonk - Ruby Primer - String Basics","url":"https://rubymonk.com/learning/books/1-ruby-primer/chapters/5-strings/lessons/31-string-basics"},{"id":1048,"dateAddedLocal":"9/12/2017, 1:11:11 PM","dateAddedUTC":"2017-09-12T17:11:11.000Z","index":21,"parentId":"1026","title":"Understanding Ruby Blocks, Procs and Lambdas - Reactive.TIPS - The Official Blog of Reactive.IO","url":"http://www.reactive.io/tips/2008/12/21/understanding-ruby-blocks-procs-and-lambdas/"},{"id":1049,"dateAddedLocal":"9/12/2017, 1:11:11 PM","dateAddedUTC":"2017-09-12T17:11:11.000Z","index":22,"parentId":"1026","title":"Variables and Assignment - Learn to Program","url":"https://pine.fm/LearnToProgram/chap_03.html"},{"id":1355,"dateAddedLocal":"2/21/2018, 3:40:21 AM","dateAddedUTC":"2018-02-21T08:40:21.085Z","index":23,"parentId":"1026","title":"Tender Lovemaking | tenderlovemaking.com","url":"http://tenderlovemaking.com/"},{"id":1358,"dateAddedLocal":"2/21/2018, 3:43:20 AM","dateAddedUTC":"2018-02-21T08:43:20.566Z","index":24,"parentId":"1026","title":"Ruby Weekly","url":"https://rubyweekly.com/"},{"id":348,"dateAddedLocal":"9/12/2017, 1:11:09 PM","dateAddedUTC":"2017-09-12T17:11:09.000Z","index":25,"parentId":"1026","title":"RVM: Ruby Version Manager - RVM Ruby Version Manager - Documentation","url":"https://rvm.io/"},{"id":1457,"dateAddedLocal":"3/14/2018, 8:17:59 AM","dateAddedUTC":"2018-03-14T12:17:59.680Z","index":95,"parentId":"311","title":"sandbox"},{"id":1431,"dateAddedLocal":"3/8/2018, 10:52:40 AM","dateAddedUTC":"2018-03-08T15:52:40.147Z","index":0,"parentId":"1457","title":"Plunker","url":"http://plnkr.co/"},{"id":1433,"dateAddedLocal":"3/8/2018, 10:52:56 AM","dateAddedUTC":"2018-03-08T15:52:56.378Z","index":1,"parentId":"1457","title":"JS Bin","url":"https://jsbin.com/?html,js,output"},{"id":1050,"dateAddedLocal":"2/9/2018, 5:47:29 PM","dateAddedUTC":"2018-02-09T22:47:29.787Z","index":96,"parentId":"311","title":"scraping"},{"id":1051,"dateAddedLocal":"9/12/2017, 1:11:11 PM","dateAddedUTC":"2017-09-12T17:11:11.000Z","index":0,"parentId":"1050","title":"Examples | Watir.com","url":"https://watir.com/examples/"},{"id":1052,"dateAddedLocal":"9/13/2017, 9:06:11 AM","dateAddedUTC":"2017-09-13T13:06:11.000Z","index":1,"parentId":"1050","title":"Installing Nokogiri - Nokogiri 鋸","url":"http://www.nokogiri.org/tutorials/installing_nokogiri.html"},{"id":1053,"dateAddedLocal":"9/12/2017, 1:11:11 PM","dateAddedUTC":"2017-09-12T17:11:11.000Z","index":2,"parentId":"1050","title":"Nokogiri","url":"http://ruby.bastardsbook.com/chapters/html-parsing/"},{"id":1054,"dateAddedLocal":"11/29/2017, 9:49:50 PM","dateAddedUTC":"2017-11-30T02:49:50.000Z","index":3,"parentId":"1050","title":"Sparkle Motion","url":"https://github.com/sparklemotion"},{"id":1055,"dateAddedLocal":"9/12/2017, 1:11:11 PM","dateAddedUTC":"2017-09-12T17:11:11.000Z","index":4,"parentId":"1050","title":"The Ultimate Introduction to Web Scraping and Browser Automation - YouTube","url":"https://www.youtube.com/watch?v=1UYBAn69Qrk&t=314s"},{"id":1056,"dateAddedLocal":"2/9/2018, 5:47:29 PM","dateAddedUTC":"2018-02-09T22:47:29.788Z","index":97,"parentId":"311","title":"scribd"},{"id":1057,"dateAddedLocal":"9/22/2017, 8:52:17 AM","dateAddedUTC":"2017-09-22T12:52:17.000Z","index":0,"parentId":"1056","title":"d1.scribdassets.com/ScribdViewer.swf?document_id=*********&access_key=key-*********","url":"http://d1.scribdassets.com/ScribdViewer.swf?document_id=*********&access_key=key-*********"},{"id":1058,"dateAddedLocal":"7/20/2017, 11:41:41 AM","dateAddedUTC":"2017-07-20T15:41:41.000Z","index":1,"parentId":"1056","title":"Scribd","url":"https://www.scribd.com/"},{"id":1059,"dateAddedLocal":"2/9/2018, 5:47:29 PM","dateAddedUTC":"2018-02-09T22:47:29.789Z","index":98,"parentId":"311","title":"search"},{"id":1060,"dateAddedLocal":"9/12/2017, 1:11:11 PM","dateAddedUTC":"2017-09-12T17:11:11.000Z","index":0,"parentId":"1059","title":"Ryan McMahon’s Blog Posts about rails","url":"http://www.rymcmahon.com/categories/1"},{"id":1061,"dateAddedLocal":"9/12/2017, 1:11:11 PM","dateAddedUTC":"2017-09-12T17:11:11.000Z","index":1,"parentId":"1059","title":"Tutorial - Creating a Custom Google In-site Search for Rails - Ruby Forum","url":"https://www.ruby-forum.com/topic/201324"},{"id":1062,"dateAddedLocal":"2/9/2018, 5:47:29 PM","dateAddedUTC":"2018-02-09T22:47:29.789Z","index":99,"parentId":"311","title":"sidekiq"},{"id":1063,"dateAddedLocal":"10/25/2017, 12:57:22 PM","dateAddedUTC":"2017-10-25T16:57:22.000Z","index":0,"parentId":"1062","title":"Learn - Paperclip","url":"https://learn.co/tracks/full-stack-web-development-v3/rails-and-javascript/workers/sidekiq"},{"id":1064,"dateAddedLocal":"2/9/2018, 5:47:29 PM","dateAddedUTC":"2018-02-09T22:47:29.789Z","index":100,"parentId":"311","title":"sinatra"},{"id":1065,"dateAddedLocal":"9/12/2017, 1:11:11 PM","dateAddedUTC":"2017-09-12T17:11:11.000Z","index":0,"parentId":"1064","title":"Active Record Associations — Ruby on Rails Guides","url":"http://guides.rubyonrails.org/association_basics.html"},{"id":1066,"dateAddedLocal":"9/12/2017, 1:11:11 PM","dateAddedUTC":"2017-09-12T17:11:11.000Z","index":1,"parentId":"1064","title":"ActiveModel::SecurePassword::ClassMethods","url":"http://api.rubyonrails.org/classes/ActiveModel/SecurePassword/ClassMethods.html#method-i-has_secure_password"},{"id":1067,"dateAddedLocal":"9/12/2017, 1:11:11 PM","dateAddedUTC":"2017-09-12T17:11:11.000Z","index":2,"parentId":"1064","title":"BCRYPT","url":"https://github.com/codahale/bcrypt-ruby"},{"id":1068,"dateAddedLocal":"9/12/2017, 1:11:11 PM","dateAddedUTC":"2017-09-12T17:11:11.000Z","index":3,"parentId":"1064","title":"Blake Mizerany: How do I learn and master Sinatra? // RubyLearning Blog","url":"http://rubylearning.com/blog/2009/08/11/blake-mizerany-how-do-i-learn-and-master-sinatra/"},{"id":1069,"dateAddedLocal":"9/12/2017, 1:11:11 PM","dateAddedUTC":"2017-09-12T17:11:11.000Z","index":4,"parentId":"1064","title":"ERB: An Introduction to ERB Templating | StuartEllis.eu","url":"http://www.stuartellis.eu/articles/erb/"},{"id":1070,"dateAddedLocal":"9/12/2017, 1:11:11 PM","dateAddedUTC":"2017-09-12T17:11:11.000Z","index":5,"parentId":"1064","title":"has_secure_password","url":"http://api.rubyonrails.org/classes/ActiveModel/SecurePassword/ClassMethods.html"},{"id":1071,"dateAddedLocal":"9/12/2017, 1:11:11 PM","dateAddedUTC":"2017-09-12T17:11:11.000Z","index":6,"parentId":"1064","title":"rtomayko/sinatra-sequel: Sinatra extension that adds Sequel ORM features, database config, and database migrations","url":"https://github.com/rtomayko/sinatra-sequel/tree/master"},{"id":1072,"dateAddedLocal":"9/14/2017, 8:45:13 AM","dateAddedUTC":"2017-09-14T12:45:13.000Z","index":7,"parentId":"1064","title":"Sinatra Book","url":"http://sinatra-org-book.herokuapp.com/"},{"id":1073,"dateAddedLocal":"9/12/2017, 1:11:11 PM","dateAddedUTC":"2017-09-12T17:11:11.000Z","index":8,"parentId":"1064","title":"Sinatra Flash","url":"http://www.sitepoint.com/sinatra-flash/"},{"id":1074,"dateAddedLocal":"9/12/2017, 1:11:11 PM","dateAddedUTC":"2017-09-12T17:11:11.000Z","index":9,"parentId":"1064","title":"Sinatra: README","url":"http://www.sinatrarb.com/intro.html"},{"id":1109,"dateAddedLocal":"2/9/2018, 5:47:29 PM","dateAddedUTC":"2018-02-09T22:47:29.795Z","index":101,"parentId":"311","title":"sinon"},{"id":1110,"dateAddedLocal":"9/12/2017, 1:11:11 PM","dateAddedUTC":"2017-09-12T17:11:11.000Z","index":0,"parentId":"1109","title":"Best Practices for Spies, Stubs and Mocks in Sinon.js - Semaphore","url":"https://semaphoreci.com/community/tutorials/best-practices-for-spies-stubs-and-mocks-in-sinon-js"},{"id":1111,"dateAddedLocal":"10/23/2017, 8:58:17 PM","dateAddedUTC":"2017-10-24T00:58:17.000Z","index":1,"parentId":"1109","title":"Sinon Tutorial: JavaScript Testing with Mocks, Spies & Stubs — SitePoint","url":"https://www.sitepoint.com/sinon-tutorial-javascript-testing-mocks-spies-stubs/"},{"id":1112,"dateAddedLocal":"10/23/2017, 1:56:06 PM","dateAddedUTC":"2017-10-23T17:56:06.000Z","index":2,"parentId":"1109","title":"Sinon.JS","url":"http://sinonjs.org/releases/index.html"},{"id":1075,"dateAddedLocal":"2/9/2018, 5:47:29 PM","dateAddedUTC":"2018-02-09T22:47:29.791Z","index":102,"parentId":"311","title":"sql-ms_sqlserver"},{"id":1076,"dateAddedLocal":"9/12/2017, 1:11:11 PM","dateAddedUTC":"2017-09-12T17:11:11.000Z","index":0,"parentId":"1075","title":"Configure the Windows Firewall to Allow SQL Server Access | Microsoft Docs","url":"https://docs.microsoft.com/en-us/sql/sql-server/install/configure-the-windows-firewall-to-allow-sql-server-access"},{"id":1077,"dateAddedLocal":"2/9/2018, 5:47:29 PM","dateAddedUTC":"2018-02-09T22:47:29.791Z","index":103,"parentId":"311","title":"sql-postgres"},{"id":1078,"dateAddedLocal":"9/12/2017, 1:11:11 PM","dateAddedUTC":"2017-09-12T17:11:11.000Z","index":0,"parentId":"1077","title":"Notes on Setting Up PostgreSQL · codeforboston/cambridge_energy_app Wiki","url":"https://github.com/codeforboston/cambridge_energy_app/wiki/Notes-on-Setting-Up-PostgreSQL"},{"id":1079,"dateAddedLocal":"2/9/2018, 5:47:29 PM","dateAddedUTC":"2018-02-09T22:47:29.791Z","index":104,"parentId":"311","title":"sql-sqllite3"},{"id":1080,"dateAddedLocal":"9/12/2017, 1:11:11 PM","dateAddedUTC":"2017-09-12T17:11:11.000Z","index":0,"parentId":"1079","title":"Datatypes In SQLite Version 3","url":"http://www.sqlite.org/datatype3.html"},{"id":1081,"dateAddedLocal":"9/12/2017, 1:11:11 PM","dateAddedUTC":"2017-09-12T17:11:11.000Z","index":1,"parentId":"1079","title":"Homebrew — The missing package manager for OS X","url":"http://brew.sh/"},{"id":1082,"dateAddedLocal":"9/12/2017, 1:11:11 PM","dateAddedUTC":"2017-09-12T17:11:11.000Z","index":2,"parentId":"1079","title":"In-Memory Databases","url":"https://www.sqlite.org/inmemorydb.html"},{"id":1083,"dateAddedLocal":"9/12/2017, 1:11:11 PM","dateAddedUTC":"2017-09-12T17:11:11.000Z","index":3,"parentId":"1079","title":"Justified Nav Template for Bootstrap","url":"file:///Users/BradSmith/Development/dev/smithpiano/index.html#"},{"id":1084,"dateAddedLocal":"9/12/2017, 1:11:11 PM","dateAddedUTC":"2017-09-12T17:11:11.000Z","index":4,"parentId":"1079","title":"Settings","url":"chrome://settings/"},{"id":1085,"dateAddedLocal":"9/12/2017, 1:11:11 PM","dateAddedUTC":"2017-09-12T17:11:11.000Z","index":5,"parentId":"1079","title":"SQL Aggregate Functions","url":"http://www.sqlclauses.com/sql+aggregate+functions"},{"id":1086,"dateAddedLocal":"9/12/2017, 1:11:11 PM","dateAddedUTC":"2017-09-12T17:11:11.000Z","index":6,"parentId":"1079","title":"SQL Joins - visual","url":"http://blog.codinghorror.com/a-visual-explanation-of-sql-joins/"},{"id":1087,"dateAddedLocal":"9/12/2017, 1:11:11 PM","dateAddedUTC":"2017-09-12T17:11:11.000Z","index":7,"parentId":"1079","title":"SQLite Documentation","url":"http://www.sqlite.org/docs.html"},{"id":1088,"dateAddedLocal":"9/12/2017, 1:11:11 PM","dateAddedUTC":"2017-09-12T17:11:11.000Z","index":8,"parentId":"1079","title":"SQLite Query Language: ALTER TABLE","url":"https://www.sqlite.org/lang_altertable.html"},{"id":1089,"dateAddedLocal":"9/12/2017, 1:11:11 PM","dateAddedUTC":"2017-09-12T17:11:11.000Z","index":9,"parentId":"1079","title":"SQLite Query Language: SELECT","url":"https://www.sqlite.org/lang_select.html#resultset"},{"id":1090,"dateAddedLocal":"9/12/2017, 1:11:11 PM","dateAddedUTC":"2017-09-12T17:11:11.000Z","index":10,"parentId":"1079","title":"SQLite tutorial","url":"http://zetcode.com/db/sqlite/"},{"id":1091,"dateAddedLocal":"9/12/2017, 1:11:11 PM","dateAddedUTC":"2017-09-12T17:11:11.000Z","index":11,"parentId":"1079","title":"sqlite3 doc on github","url":"https://github.com/sparklemotion/sqlite3-ruby"},{"id":1092,"dateAddedLocal":"9/12/2017, 1:11:11 PM","dateAddedUTC":"2017-09-12T17:11:11.000Z","index":12,"parentId":"1079","title":"The SELECT statement in SQLite","url":"http://zetcode.com/db/sqlite/select/"},{"id":1420,"dateAddedLocal":"3/7/2018, 10:43:48 AM","dateAddedUTC":"2018-03-07T15:43:48.371Z","index":13,"parentId":"1079","title":"Docstring multi-line","url":"https://www.commandercoriander.net/blog/2014/11/09/a-multiline-string-cheatsheet-for-ruby/"},{"id":1164,"dateAddedLocal":"2/9/2018, 5:47:29 PM","dateAddedUTC":"2018-02-09T22:47:29.803Z","index":105,"parentId":"311","title":"style"},{"id":1165,"dateAddedLocal":"1/11/2018, 3:35:57 PM","dateAddedUTC":"2018-01-11T20:35:57.000Z","index":0,"parentId":"1164","title":"Popper.js","url":"https://popper.js.org/"},{"id":331,"dateAddedLocal":"2/9/2018, 5:47:29 PM","dateAddedUTC":"2018-02-09T22:47:29.691Z","index":106,"parentId":"311","title":"swagger"},{"id":332,"dateAddedLocal":"2/4/2018, 1:03:37 PM","dateAddedUTC":"2018-02-04T18:03:37.000Z","index":0,"parentId":"331","title":"Build, Collaborate & Integrate APIs | SwaggerHub","url":"https://app.swaggerhub.com/home"},{"id":1180,"dateAddedLocal":"2/9/2018, 5:47:29 PM","dateAddedUTC":"2018-02-09T22:47:29.805Z","index":107,"parentId":"311","title":"task managers"},{"id":1181,"dateAddedLocal":"1/10/2018, 7:47:53 AM","dateAddedUTC":"2018-01-10T12:47:53.000Z","index":0,"parentId":"1180","title":"Trello","url":"https://trello.com/?aceid=&adposition=1t1&adgroup=45883604321&campaign=817711909&creative=230348617886&device=c&keyword=trello&matchtype=e&network=g&placement=&ds_kids=p20478354863&gclid=EAIaIQobChMIhouOnbbN2AIVCbnACh3imwSYEAAYASAAEgJwVPD_BwE&gclsrc=aw.ds"},{"id":1182,"dateAddedLocal":"1/10/2018, 7:49:00 AM","dateAddedUTC":"2018-01-10T12:49:00.000Z","index":1,"parentId":"1180","title":"Wunderlist | To-do list, Reminders, Errands - App of the Year!","url":"https://www.wunderlist.com/"},{"id":1183,"dateAddedLocal":"1/10/2018, 7:49:07 AM","dateAddedUTC":"2018-01-10T12:49:07.000Z","index":2,"parentId":"1180","title":"Bear - Notes for iPhone, iPad and Mac","url":"http://www.bear-writer.com/"},{"id":1184,"dateAddedLocal":"1/10/2018, 7:49:12 AM","dateAddedUTC":"2018-01-10T12:49:12.000Z","index":3,"parentId":"1180","title":"· Asana","url":"https://asana.com/uses/task-management?pkw=%2Btask%20%2Bmanager&pmt=b&pdv=c&utm_campaign=usa-task&utm_source=google&utm_medium=pd_cpc_nb&utm_term=%2Btask%20%2Bmanager&gclid=EAIaIQobChMIl8CIpLbN2AIVEJ7ACh0Q7QO2EAAYASAAEgJrE_D_BwE"},{"id":1093,"dateAddedLocal":"2/9/2018, 5:47:29 PM","dateAddedUTC":"2018-02-09T22:47:29.793Z","index":108,"parentId":"311","title":"testing"},{"id":1113,"dateAddedLocal":"1/24/2018, 1:46:36 AM","dateAddedUTC":"2018-01-24T06:46:36.000Z","index":0,"parentId":"1093","title":"Unit Testing and Coding Best Practices for Unit Tests: A Test-Driven Perspective | Toptal","url":"https://www.toptal.com/qa/how-to-write-testable-code-and-why-it-matters"},{"id":1101,"dateAddedLocal":"9/12/2017, 1:11:11 PM","dateAddedUTC":"2017-09-12T17:11:11.000Z","index":1,"parentId":"1093","title":"Rails 4 Test Prescriptions: Build a Healthy Codebase by Noel Rappin | The Pragmatic Bookshelf","url":"https://pragprog.com/book/nrtest2/rails-4-test-prescriptions"},{"id":1100,"dateAddedLocal":"9/16/2017, 1:26:25 PM","dateAddedUTC":"2017-09-16T17:26:25.000Z","index":2,"parentId":"1093","title":"Form Helpers — Ruby on Rails Guides","url":"http://edgeguides.rubyonrails.org/form_helpers.html"},{"id":1099,"dateAddedLocal":"9/12/2017, 1:11:11 PM","dateAddedUTC":"2017-09-12T17:11:11.000Z","index":3,"parentId":"1093","title":"Everyday Rails Testing with… by Aaron Sumner [PDF/iPad/Kindle]","url":"https://leanpub.com/everydayrailsrspec"},{"id":1095,"dateAddedLocal":"9/14/2017, 12:21:10 PM","dateAddedUTC":"2017-09-14T16:21:10.000Z","index":4,"parentId":"1093","title":"Capybara Intro","url":"https://learn.co/tracks/full-stack-web-dev-with-react/sinatra/forms/intro-to-capybara-tests"},{"id":1097,"dateAddedLocal":"9/12/2017, 1:11:11 PM","dateAddedUTC":"2017-09-12T17:11:11.000Z","index":5,"parentId":"1093","title":"factory_girl/GETTING_STARTED.md at master · thoughtbot/factory_girl","url":"https://github.com/thoughtbot/factory_girl/blob/master/GETTING_STARTED.md"},{"id":1342,"dateAddedLocal":"2/20/2018, 6:48:43 PM","dateAddedUTC":"2018-02-20T23:48:43.371Z","index":109,"parentId":"311","title":"ux"},{"id":1343,"dateAddedLocal":"2/20/2018, 6:48:46 PM","dateAddedUTC":"2018-02-20T23:48:46.663Z","index":0,"parentId":"1342","title":"InVision | Digital Product Design, Workflow & Collaboration","url":"https://www.invisionapp.com/"},{"id":1347,"dateAddedLocal":"2/20/2018, 7:04:35 PM","dateAddedUTC":"2018-02-21T00:04:35.819Z","index":1,"parentId":"1342","title":"Jetstrap - The Bootstrap Interface Builder","url":"https://jetstrap.com/"},{"id":1344,"dateAddedLocal":"2/20/2018, 6:48:51 PM","dateAddedUTC":"2018-02-20T23:48:51.044Z","index":2,"parentId":"1342","title":"Proto.io - Prototypes that feel real","url":"https://proto.io/"},{"id":1346,"dateAddedLocal":"2/20/2018, 6:49:40 PM","dateAddedUTC":"2018-02-20T23:49:40.005Z","index":3,"parentId":"1342","title":"Scalable Enterprise Ecommerce Platform | Shopify Plus","url":"https://www.shopify.com/plus/enterprise-ecommerce"},{"id":1345,"dateAddedLocal":"2/20/2018, 6:48:56 PM","dateAddedUTC":"2018-02-20T23:48:56.163Z","index":4,"parentId":"1342","title":"Sketch - The digital design toolkit","url":"https://www.sketchapp.com/"},{"id":1341,"dateAddedLocal":"2/20/2018, 6:48:28 PM","dateAddedUTC":"2018-02-20T23:48:28.957Z","index":5,"parentId":"1342","title":"WordPress Themes Loved By Over 430k Customers","url":"https://www.elegantthemes.com/"},{"id":1114,"dateAddedLocal":"2/9/2018, 5:47:29 PM","dateAddedUTC":"2018-02-09T22:47:29.796Z","index":110,"parentId":"311","title":"virtual box"},{"id":1115,"dateAddedLocal":"11/14/2017, 7:19:24 AM","dateAddedUTC":"2017-11-14T12:19:24.000Z","index":0,"parentId":"1114","title":"20 Things I Love About Code - YouTube","url":"https://www.youtube.com/watch?v=_gl6uRWnu6s&feature=youtu.be"},{"id":1116,"dateAddedLocal":"11/12/2017, 1:16:00 AM","dateAddedUTC":"2017-11-12T06:16:00.000Z","index":1,"parentId":"1114","title":"How to Resize a Windows VirtualBox VM hosted on Mac OS X - YouTube","url":"https://www.youtube.com/watch?v=2iAbwdaXXeA"},{"id":1117,"dateAddedLocal":"2/9/2018, 5:47:29 PM","dateAddedUTC":"2018-02-09T22:47:29.796Z","index":111,"parentId":"311","title":"visualization"},{"id":1123,"dateAddedLocal":"2/9/2018, 5:47:29 PM","dateAddedUTC":"2018-02-09T22:47:29.797Z","index":0,"parentId":"1117","title":"ui"},{"id":1124,"dateAddedLocal":"9/12/2017, 1:11:11 PM","dateAddedUTC":"2017-09-12T17:11:11.000Z","index":0,"parentId":"1123","title":"Bootstrap · The world's most popular mobile-first and responsive front-end framework.","url":"http://getbootstrap.com/"},{"id":1125,"dateAddedLocal":"9/12/2017, 1:11:11 PM","dateAddedUTC":"2017-09-12T17:11:11.000Z","index":1,"parentId":"1123","title":"Foundation | The most advanced responsive front-end framework in the world.","url":"http://foundation.zurb.com/"},{"id":1126,"dateAddedLocal":"9/12/2017, 1:11:11 PM","dateAddedUTC":"2017-09-12T17:11:11.000Z","index":2,"parentId":"1123","title":"Getting Started | Semantic UI","url":"https://semantic-ui.com/introduction/getting-started.html"},{"id":1127,"dateAddedLocal":"9/12/2017, 1:11:11 PM","dateAddedUTC":"2017-09-12T17:11:11.000Z","index":3,"parentId":"1123","title":"Kendo UI - Telerik","url":"http://www.telerik.com/kendo-ui"},{"id":1128,"dateAddedLocal":"9/12/2017, 1:11:11 PM","dateAddedUTC":"2017-09-12T17:11:11.000Z","index":4,"parentId":"1123","title":"Paperclip: add photos/docs to site","url":"https://github.com/thoughtbot/paperclip"},{"id":1129,"dateAddedLocal":"9/12/2017, 1:11:11 PM","dateAddedUTC":"2017-09-12T17:11:11.000Z","index":5,"parentId":"1123","title":"Semantic UI","url":"https://semantic-ui.com/"},{"id":1130,"dateAddedLocal":"9/12/2017, 1:11:11 PM","dateAddedUTC":"2017-09-12T17:11:11.000Z","index":6,"parentId":"1123","title":"Topcoat","url":"http://topcoat.io/"},{"id":1131,"dateAddedLocal":"9/12/2017, 1:11:11 PM","dateAddedUTC":"2017-09-12T17:11:11.000Z","index":1,"parentId":"1117","title":"three.js - Javascript 3D library","url":"https://threejs.org/"},{"id":1132,"dateAddedLocal":"2/9/2018, 5:47:29 PM","dateAddedUTC":"2018-02-09T22:47:29.798Z","index":112,"parentId":"311","title":"vscode-snippets"},{"id":1133,"dateAddedLocal":"1/9/2018, 7:34:04 AM","dateAddedUTC":"2018-01-09T12:34:04.000Z","index":0,"parentId":"1132","title":"xabikos/vscode-react: Contains the code snippets for Reactjs development in VS Code editor","url":"https://github.com/xabikos/vscode-react"},{"id":1134,"dateAddedLocal":"2/9/2018, 5:47:29 PM","dateAddedUTC":"2018-02-09T22:47:29.799Z","index":113,"parentId":"311","title":"windows programming"},{"id":1135,"dateAddedLocal":"9/12/2017, 1:11:11 PM","dateAddedUTC":"2017-09-12T17:11:11.000Z","index":0,"parentId":"1134","title":"configurationmanager - Where is SQL Server Configuration Manager in SQL Server 2016 - Stack Overflow","url":"https://stackoverflow.com/questions/38824654/where-is-sql-server-configuration-manager-in-sql-server-2016"},{"id":1136,"dateAddedLocal":"9/12/2017, 1:11:11 PM","dateAddedUTC":"2017-09-12T17:11:11.000Z","index":1,"parentId":"1134","title":"Connection libraries for SQL Database | Microsoft Docs","url":"https://docs.microsoft.com/en-us/azure/sql-database/sql-database-libraries"},{"id":1137,"dateAddedLocal":"9/12/2017, 1:11:11 PM","dateAddedUTC":"2017-09-12T17:11:11.000Z","index":2,"parentId":"1134","title":"Download LINQPad","url":"https://www.linqpad.net/Download.aspx"},{"id":1138,"dateAddedLocal":"9/12/2017, 1:11:11 PM","dateAddedUTC":"2017-09-12T17:11:11.000Z","index":3,"parentId":"1134","title":"Rails and MSSQL Server","url":"https://gist.github.com/basiszwo/6434984"},{"id":1139,"dateAddedLocal":"9/12/2017, 1:11:11 PM","dateAddedUTC":"2017-09-12T17:11:11.000Z","index":4,"parentId":"1134","title":"rails-sqlserver/tiny_tds: TinyTDS - Simple and fast FreeTDS bindings for Ruby using DB-Library.","url":"https://github.com/rails-sqlserver/tiny_tds"},{"id":1140,"dateAddedLocal":"9/12/2017, 1:11:11 PM","dateAddedUTC":"2017-09-12T17:11:11.000Z","index":5,"parentId":"1134","title":"Ruby macOS","url":"https://www.microsoft.com/en-us/sql-server/developer-get-started/ruby/mac/"},{"id":1141,"dateAddedLocal":"9/12/2017, 1:11:11 PM","dateAddedUTC":"2017-09-12T17:11:11.000Z","index":6,"parentId":"1134","title":"SQL Database Application Development Overview | Microsoft Docs","url":"https://docs.microsoft.com/en-us/azure/sql-database/sql-database-develop-overview"},{"id":1142,"dateAddedLocal":"9/12/2017, 1:11:11 PM","dateAddedUTC":"2017-09-12T17:11:11.000Z","index":7,"parentId":"1134","title":"SQL Server quickstart - Microsoft Azure","url":"https://portal.azure.com/#resource/subscriptions/408ed3a1-9797-4110-a51a-298c9612ac80/resourceGroups/swtResourceGroup1/providers/Microsoft.Sql/servers/swt1/quickStart"},{"id":1143,"dateAddedLocal":"2/9/2018, 5:47:29 PM","dateAddedUTC":"2018-02-09T22:47:29.800Z","index":114,"parentId":"311","title":"wireframe"},{"id":1144,"dateAddedLocal":"9/12/2017, 1:11:11 PM","dateAddedUTC":"2017-09-12T17:11:11.000Z","index":0,"parentId":"1143","title":"Balsamiq. Rapid, effective and fun wireframing software. | Balsamiq","url":"https://balsamiq.com/index.html"},{"id":1145,"dateAddedLocal":"9/12/2017, 1:11:11 PM","dateAddedUTC":"2017-09-12T17:11:11.000Z","index":1,"parentId":"1143","title":"Bootstrap Studio","url":"https://bootstrapstudio.io/"},{"id":1146,"dateAddedLocal":"9/12/2017, 1:11:11 PM","dateAddedUTC":"2017-09-12T17:11:11.000Z","index":2,"parentId":"1143","title":"cjdsie/pattern-portfolio: Inspired by the recent movement of creating systems, not pages. This is a living library of deliverables that can be stylized to fit your next project. Each pattern is included within the pattern directory and can be optionally included into the final guide.","url":"https://github.com/cjdsie/pattern-portfolio"},{"id":1147,"dateAddedLocal":"9/12/2017, 1:11:11 PM","dateAddedUTC":"2017-09-12T17:11:11.000Z","index":3,"parentId":"1143","title":"Contact us","url":"https://bootstrapstudio.io/contact-us"},{"id":1148,"dateAddedLocal":"12/19/2017, 1:36:52 PM","dateAddedUTC":"2017-12-19T18:36:52.000Z","index":4,"parentId":"1143","title":"Designing responsive web layouts in React Studio – Hacker Noon","url":"https://hackernoon.com/designing-responsive-web-layouts-in-react-studio-2e1d796704d5"},{"id":1149,"dateAddedLocal":"9/12/2017, 1:11:11 PM","dateAddedUTC":"2017-09-12T17:11:11.000Z","index":5,"parentId":"1143","title":"Jetstrap - The Easiest Twitter Bootstrap Builder!","url":"https://jetstrap.com/demo"},{"id":1150,"dateAddedLocal":"9/12/2017, 1:11:11 PM","dateAddedUTC":"2017-09-12T17:11:11.000Z","index":6,"parentId":"1143","title":"LayoutIt! - Interface Builder for Bootstrap","url":"http://www.layoutit.com/"},{"id":1151,"dateAddedLocal":"9/12/2017, 1:11:11 PM","dateAddedUTC":"2017-09-12T17:11:11.000Z","index":7,"parentId":"1143","title":"Online Mockup, Wireframe & UI Prototyping Tool · Moqups","url":"https://moqups.com/#tour"},{"id":1152,"dateAddedLocal":"12/19/2017, 1:37:11 PM","dateAddedUTC":"2017-12-19T18:37:11.000Z","index":8,"parentId":"1143","title":"React Studio","url":"https://reactstudio.com/"},{"id":1153,"dateAddedLocal":"9/12/2017, 1:11:11 PM","dateAddedUTC":"2017-09-12T17:11:11.000Z","index":9,"parentId":"1143","title":"Website wireframes: Mockingbird","url":"https://gomockingbird.com/home"},{"id":1154,"dateAddedLocal":"9/12/2017, 1:11:11 PM","dateAddedUTC":"2017-09-12T17:11:11.000Z","index":10,"parentId":"1143","title":"Wirefy","url":"http://getwirefy.com/"},{"id":1155,"dateAddedLocal":"9/12/2017, 1:11:11 PM","dateAddedUTC":"2017-09-12T17:11:11.000Z","index":11,"parentId":"1143","title":"Wirefy | Grid","url":"http://getwirefy.com/grid.html"},{"id":1156,"dateAddedLocal":"2/9/2018, 5:47:29 PM","dateAddedUTC":"2018-02-09T22:47:29.802Z","index":115,"parentId":"311","title":"xml"},{"id":1157,"dateAddedLocal":"10/30/2017, 2:46:43 PM","dateAddedUTC":"2017-10-30T18:46:43.000Z","index":0,"parentId":"1156","title":"XPath - Wikipedia","url":"https://en.wikipedia.org/wiki/XPath"},{"id":1158,"dateAddedLocal":"2/9/2018, 5:47:29 PM","dateAddedUTC":"2018-02-09T22:47:29.802Z","index":116,"parentId":"311","title":"zipcodes"},{"id":1159,"dateAddedLocal":"10/15/2017, 3:23:58 AM","dateAddedUTC":"2017-10-15T07:23:58.000Z","index":0,"parentId":"1158","title":"APIs & services - zip-appt1","url":"https://console.developers.google.com/apis/api/distance-matrix-backend.googleapis.com/overview?project=zip-appt1&authuser=1&organizationId=431234920510&duration=PT1H"},{"id":1160,"dateAddedLocal":"10/15/2017, 3:29:58 AM","dateAddedUTC":"2017-10-15T07:29:58.000Z","index":1,"parentId":"1158","title":"Google Maps JavaScript API V3 Reference  |  Google Maps JavaScript API  |  Google Developers","url":"https://developers.google.com/maps/documentation/javascript/reference"},{"id":1161,"dateAddedLocal":"10/15/2017, 3:09:46 AM","dateAddedUTC":"2017-10-15T07:09:46.000Z","index":2,"parentId":"1158","title":"Zip Code API - A RedLine13 Service","url":"https://www.zipcodeapi.com/"},{"id":1162,"dateAddedLocal":"10/15/2017, 12:44:22 AM","dateAddedUTC":"2017-10-15T04:44:22.000Z","index":3,"parentId":"1158","title":"Zip Code API Documentation","url":"https://www.zipcodeapi.com/API"},{"id":1163,"dateAddedLocal":"9/12/2017, 1:11:09 PM","dateAddedUTC":"2017-09-12T17:11:09.000Z","index":117,"parentId":"311","title":"","url":"https://learn-co.slack.com/messages/learn-verified/search/study%20groups/"},{"id":1385,"dateAddedLocal":"2/28/2018, 3:42:03 PM","dateAddedUTC":"2018-02-28T20:42:03.410Z","index":5,"parentId":"1","title":"//"},{"id":1399,"dateAddedLocal":"3/2/2018, 4:42:39 PM","dateAddedUTC":"2018-03-02T21:42:39.879Z","index":0,"parentId":"1385","title":"Learn - Expert Chat","url":"https://learn.co/expert-chat"},{"id":1188,"dateAddedLocal":"3/31/2017, 11:36:23 AM","dateAddedUTC":"2017-03-31T15:36:23.000Z","index":1,"parentId":"1385","title":"Learn","url":"https://learn.co/tracks/full-stack-web-dev-with-react"},{"id":1490,"dateAddedLocal":"3/20/2018, 10:24:33 AM","dateAddedUTC":"2018-03-20T14:24:33.182Z","index":2,"parentId":"1385","title":"LABS","url":"https://github.com/learn-co-students"},{"id":1466,"dateAddedLocal":"3/14/2018, 8:40:12 AM","dateAddedUTC":"2018-03-14T12:40:12.750Z","index":3,"parentId":"1385","title":"technical-coach"},{"id":1408,"dateAddedLocal":"3/2/2018, 8:04:45 PM","dateAddedUTC":"2018-03-03T01:04:45.246Z","index":0,"parentId":"1466","title":"JIRA issue","url":"https://github.com/flatiron-labs/learn-support/blob/master/escalation.md#how-to-report-an-issue-through-jira"},{"id":1407,"dateAddedLocal":"3/2/2018, 8:01:18 PM","dateAddedUTC":"2018-03-03T01:01:18.972Z","index":1,"parentId":"1466","title":"Learn IDE LIGHT not working","url":"https://github.com/flatiron-labs/learn-support/blob/master/learn-ide.md#authentication-light-did-not-turn-on"},{"id":1406,"dateAddedLocal":"3/2/2018, 7:55:07 PM","dateAddedUTC":"2018-03-03T00:55:07.005Z","index":2,"parentId":"1466","title":"1:1 Project Support","url":"https://theflatironschool.typeform.com/to/B9BrgH"},{"id":1405,"dateAddedLocal":"3/2/2018, 6:05:24 PM","dateAddedUTC":"2018-03-02T23:05:24.959Z","index":3,"parentId":"1466","title":"Section Leads","url":"https://github.com/flatiron-labs/learn-support/blob/master/learn-instructors.md"},{"id":1402,"dateAddedLocal":"3/2/2018, 5:35:54 PM","dateAddedUTC":"2018-03-02T22:35:54.928Z","index":4,"parentId":"1466","title":"Github username change","url":"https://github.com/flatiron-labs/learn-support/blob/3442b82d6daab1b991ac3c7e483248ce9d5d890b/learn-issues.md#github-username-change"},{"id":1401,"dateAddedLocal":"3/2/2018, 5:35:01 PM","dateAddedUTC":"2018-03-02T22:35:01.718Z","index":5,"parentId":"1466","title":"WorkFlow IDE","url":"https://github.com/flatiron-labs/learn-support/blob/master/common-learn-questions.md#1-learnideworkflow-issues"},{"id":1397,"dateAddedLocal":"3/2/2018, 4:26:05 PM","dateAddedUTC":"2018-03-02T21:26:05.161Z","index":6,"parentId":"1466","title":"technical-coach-resources","url":"https://github.com/flatiron-labs/technical-coach-resources"},{"id":1396,"dateAddedLocal":"3/2/2018, 4:24:30 PM","dateAddedUTC":"2018-03-02T21:24:30.594Z","index":7,"parentId":"1466","title":"learn-support-reference-guide","url":"https://github.com/flatiron-labs/learn-support"},{"id":1388,"dateAddedLocal":"2/28/2018, 4:56:53 PM","dateAddedUTC":"2018-02-28T21:56:53.283Z","index":8,"parentId":"1466","title":"JIRA","url":"https://flatiron.atlassian.net/secure/Dashboard.jspa"},{"id":1404,"dateAddedLocal":"3/2/2018, 5:58:25 PM","dateAddedUTC":"2018-03-02T22:58:25.174Z","index":9,"parentId":"1466","title":"Unsupported questions","url":"https://learn.co/tracks/learn-expert-training/welcome/logistics/learn-expert-which-questions-to-answer"},{"id":1410,"dateAddedLocal":"3/3/2018, 5:29:39 AM","dateAddedUTC":"2018-03-03T10:29:39.729Z","index":10,"parentId":"1466","title":"Learn Instruct","url":"http://instruction.learn.co/staff/home"},{"id":1398,"dateAddedLocal":"3/2/2018, 4:26:17 PM","dateAddedUTC":"2018-03-02T21:26:17.560Z","index":11,"parentId":"1466","title":"Learn.co Help Center","url":"http://help.learn.co/"},{"id":1400,"dateAddedLocal":"3/2/2018, 5:31:11 PM","dateAddedUTC":"2018-03-02T22:31:11.259Z","index":12,"parentId":"1466","title":"screen-sharing doc","url":"https://github.com/flatiron-labs/learn-support/blob/master/screen-sharing.md"},{"id":1467,"dateAddedLocal":"3/14/2018, 8:41:19 AM","dateAddedUTC":"2018-03-14T12:41:19.118Z","index":4,"parentId":"1385","title":"wework"},{"id":1387,"dateAddedLocal":"2/28/2018, 3:42:45 PM","dateAddedUTC":"2018-02-28T20:42:45.803Z","index":0,"parentId":"1467","title":"WeWork-OneLogin","url":"https://wework.onelogin.com/login"},{"id":1418,"dateAddedLocal":"3/5/2018, 9:27:56 AM","dateAddedUTC":"2018-03-05T14:27:56.612Z","index":1,"parentId":"1467","title":"Ending a shift","url":"https://docs.google.com/forms/d/e/1FAIpQLSdJQSaYOd4wsccmm--GWrgkblzykCLxqTj1vL_lr_7qo7ZAaQ/viewform"},{"id":1414,"dateAddedLocal":"3/5/2018, 8:33:18 AM","dateAddedUTC":"2018-03-05T13:33:18.853Z","index":2,"parentId":"1467","title":"Doing a Shift","url":"https://github.com/learn-co-students/learn-expert-doing-a-shift-learn-experts-testing-batch"},{"id":1413,"dateAddedLocal":"3/5/2018, 7:30:28 AM","dateAddedUTC":"2018-03-05T12:30:28.008Z","index":3,"parentId":"1467","title":"When I Work","url":"https://app.wheniwork.com/"},{"id":1403,"dateAddedLocal":"3/2/2018, 5:50:50 PM","dateAddedUTC":"2018-03-02T22:50:50.022Z","index":4,"parentId":"1467","title":"Submitting Workday Hours - YouTube","url":"https://www.youtube.com/watch?v=3fvYOSw_HPA"},{"id":1424,"dateAddedLocal":"3/7/2018, 6:15:25 PM","dateAddedUTC":"2018-03-07T23:15:25.618Z","index":5,"parentId":"1385","title":"study-group"},{"id":1468,"dateAddedLocal":"3/14/2018, 10:30:52 AM","dateAddedUTC":"2018-03-14T14:30:52.048Z","index":0,"parentId":"1424","title":"Study Group Feedback Form","url":"https://theflatironschool.typeform.com/to/jMLdwE"},{"id":1423,"dateAddedLocal":"3/7/2018, 6:11:18 PM","dateAddedUTC":"2018-03-07T23:11:18.820Z","index":1,"parentId":"1424","title":"Study Groups - fill in by EOD Fri - Google Sheets","url":"https://docs.google.com/spreadsheets/d/1-it2XQb9oguXujdG2j9obIrTx0MLR5i_MN0d5FFDbCk/edit#gid=1330300855"},{"id":1412,"dateAddedLocal":"3/4/2018, 1:42:26 PM","dateAddedUTC":"2018-03-04T18:42:26.519Z","index":2,"parentId":"1424","title":"Study Groups Training - Google Slides","url":"https://docs.google.com/presentation/d/1AXLcijdy3t40VFW83t7uiFylAxBbHD-1Y-nI6eNLcUg/edit#slide=id.g3235640572_0_0"},{"id":1425,"dateAddedLocal":"3/7/2018, 6:15:50 PM","dateAddedUTC":"2018-03-07T23:15:50.389Z","index":3,"parentId":"1424","title":"Study Groups - Google Docs","url":"https://docs.google.com/document/d/1qVGS1jFh-0LfQAVh7o_DterqXtAgBkDB1HsjDBmNM2Q/edit"},{"id":1426,"dateAddedLocal":"3/7/2018, 6:16:21 PM","dateAddedUTC":"2018-03-07T23:16:21.125Z","index":4,"parentId":"1424","title":"TC Monthly Meeting Feb 2018 - YouTube","url":"https://www.youtube.com/watch?v=dlyx0UsD1VY&feature=youtu.be"},{"id":1427,"dateAddedLocal":"3/7/2018, 6:16:28 PM","dateAddedUTC":"2018-03-07T23:16:28.042Z","index":5,"parentId":"1424","title":"Study Groups Training - Google Slides","url":"https://docs.google.com/presentation/d/1AXLcijdy3t40VFW83t7uiFylAxBbHD-1Y-nI6eNLcUg/edit#slide=id.p"},{"id":1428,"dateAddedLocal":"3/7/2018, 6:16:38 PM","dateAddedUTC":"2018-03-07T23:16:38.150Z","index":6,"parentId":"1424","title":"Videos - YouTube","url":"https://www.youtube.com/my_videos?o=U"},{"id":1429,"dateAddedLocal":"3/7/2018, 6:17:11 PM","dateAddedUTC":"2018-03-07T23:17:11.889Z","index":7,"parentId":"1424","title":"Learn Instruct","url":"http://instruction.learn.co/student/video_lectures#/268"},{"id":1446,"dateAddedLocal":"3/12/2018, 7:58:29 PM","dateAddedUTC":"2018-03-12T23:58:29.743Z","index":6,"parentId":"1385","title":"cernan-react"},{"id":1444,"dateAddedLocal":"3/12/2018, 7:57:56 PM","dateAddedUTC":"2018-03-12T23:57:56.720Z","index":0,"parentId":"1446","title":"smithWEBtek/create-react-app: Create React apps with no build configuration.","url":"https://github.com/smithWEBtek/create-react-app"},{"id":1447,"dateAddedLocal":"3/12/2018, 7:58:34 PM","dateAddedUTC":"2018-03-12T23:58:34.167Z","index":1,"parentId":"1446","title":"smithWEBtek/todo-demo-rails","url":"https://github.com/smithWEBtek/todo-demo-rails"},{"id":1419,"dateAddedLocal":"3/6/2018, 9:57:11 AM","dateAddedUTC":"2018-03-06T14:57:11.031Z","index":7,"parentId":"1385","title":"Google Docs","url":"https://docs.google.com/document/u/0/?tgif=d"},{"id":1511,"dateAddedLocal":"3/28/2018, 11:21:50 AM","dateAddedUTC":"2018-03-28T15:21:50.293Z","index":8,"parentId":"1385","title":"videos"},{"id":1512,"dateAddedLocal":"3/28/2018, 11:21:50 AM","dateAddedUTC":"2018-03-28T15:21:50.299Z","index":0,"parentId":"1511","title":"* learn-verified | Learn.co Slack","url":"https://learn-co.slack.com/messages/learn-verified/team/smithwebtek/"},{"id":1513,"dateAddedLocal":"3/28/2018, 11:21:50 AM","dateAddedUTC":"2018-03-28T15:21:50.300Z","index":1,"parentId":"1511","title":"A guide explaining Learn-Verified Lectures","url":"https://gist.github.com/aviflombaum/423cd7ccec1531673704"},{"id":1514,"dateAddedLocal":"3/28/2018, 11:21:50 AM","dateAddedUTC":"2018-03-28T15:21:50.300Z","index":2,"parentId":"1511","title":"Learn Google Drive","url":"https://drive.google.com/folderview?id=0B-tirJPDhz8BYVE1R0gycTlNdjQ&usp=drive_web"},{"id":1515,"dateAddedLocal":"3/28/2018, 11:21:50 AM","dateAddedUTC":"2018-03-28T15:21:50.301Z","index":3,"parentId":"1511","title":"Learn Lectures (Recovered) - Google Docs","url":"https://docs.google.com/document/d/1PIxkXQK9sUrwc_zqeqIHuP-XXWm_U2TwvCjcAOu2Wog/edit?copiedFromTrash#heading=h.t1uh9nri9zbl"},{"id":1516,"dateAddedLocal":"3/28/2018, 11:21:50 AM","dateAddedUTC":"2018-03-28T15:21:50.302Z","index":4,"parentId":"1511","title":"Learn Lectures - Google Docs","url":"https://docs.google.com/document/d/1HgYcmBY4Yem9gbkx4dJr67wqTFfzBHLhV1_3BtX5-9U/edit"},{"id":1517,"dateAddedLocal":"3/28/2018, 11:21:50 AM","dateAddedUTC":"2018-03-28T15:21:50.302Z","index":5,"parentId":"1511","title":"Learn Lectures - Google Docs","url":"https://docs.google.com/document/d/1HgYcmBY4Yem9gbkx4dJr67wqTFfzBHLhV1_3BtX5-9U/edit#"},{"id":1518,"dateAddedLocal":"3/28/2018, 11:21:50 AM","dateAddedUTC":"2018-03-28T15:21:50.303Z","index":6,"parentId":"1511","title":"Learn Student Information","url":"https://drive.google.com/folderview?id=0B-tirJPDhz8BYVE1R0gycTlNdjQ&usp=drive_web"},{"id":1519,"dateAddedLocal":"3/28/2018, 11:21:50 AM","dateAddedUTC":"2018-03-28T15:21:50.303Z","index":7,"parentId":"1511","title":"Mountain West Ruby 2016 - Sharpening The Axe: Self-Teaching For Developers Aja Hammerly - YouTube","url":"https://www.youtube.com/watch?v=3Ee1WYl51TM&feature=youtu.be"},{"id":1520,"dateAddedLocal":"3/28/2018, 11:21:50 AM","dateAddedUTC":"2018-03-28T15:21:50.304Z","index":8,"parentId":"1511","title":"Ruby-006-videos.md","url":"https://gist.github.com/aviflombaum/2656242e0cb0243537dd"},{"id":1521,"dateAddedLocal":"3/28/2018, 11:21:50 AM","dateAddedUTC":"2018-03-28T15:21:50.305Z","index":9,"parentId":"1511","title":"snsavage/flatiron_study_groups: Notes from Flatiron School study groups.","url":"https://github.com/snsavage/flatiron_study_groups"},{"id":1522,"dateAddedLocal":"3/28/2018, 11:21:50 AM","dateAddedUTC":"2018-03-28T15:21:50.305Z","index":10,"parentId":"1511","title":"videos.md","url":"https://gist.github.com/aviflombaum/df6c9c68439de6873b55"},{"id":324,"dateAddedLocal":"11/21/2017, 6:30:15 PM","dateAddedUTC":"2017-11-21T23:30:15.000Z","index":11,"parentId":"1511","title":"FlatironVideos","url":"http://instruction.learn.co/student/video_lectures#/"},{"id":1448,"dateAddedLocal":"3/12/2018, 9:07:55 PM","dateAddedUTC":"2018-03-13T01:07:55.089Z","index":6,"parentId":"1","title":"try"},{"id":1454,"dateAddedLocal":"3/12/2018, 10:47:10 PM","dateAddedUTC":"2018-03-13T02:47:10.873Z","index":0,"parentId":"1448","title":"FullStack-Lesson-Plans: smithWEBtek","url":"https://github.com/coding-boot-camp/FullStack-Lesson-Plans"},{"id":1450,"dateAddedLocal":"3/12/2018, 9:08:14 PM","dateAddedUTC":"2018-03-13T01:08:14.167Z","index":1,"parentId":"1448","title":"The Coding Bootcamp · TrilogyEd: Instructor/TA Training GitBook","url":"https://the-coding-bootcamp.gitbooks.io/instructor-onboarding/content/module-3---curriculum-overview/the-coding-bootcamp.html"},{"id":1451,"dateAddedLocal":"3/12/2018, 9:08:45 PM","dateAddedUTC":"2018-03-13T01:08:45.606Z","index":2,"parentId":"1448","title":"BootcampSpot","url":"https://bootcampspot-v2.com/"},{"id":1452,"dateAddedLocal":"3/12/2018, 10:43:55 PM","dateAddedUTC":"2018-03-13T02:43:55.772Z","index":3,"parentId":"1448","title":"FSF: Repo Tour · TrilogyEd: Instructor/TA Training GitBook","url":"https://the-coding-bootcamp.gitbooks.io/instructor-onboarding/content/module-3---curriculum-overview/the-coding-bootcamp/fsf-curriculum-repo-tour.html"},{"id":1453,"dateAddedLocal":"3/12/2018, 10:44:17 PM","dateAddedUTC":"2018-03-13T02:44:17.102Z","index":4,"parentId":"1448","title":"Introduction · Web-Dev-Pre-Work-GitBook","url":"https://the-coding-bootcamp.gitbooks.io/pre-work-book/content/"},{"id":1456,"dateAddedLocal":"3/13/2018, 9:05:51 PM","dateAddedUTC":"2018-03-14T01:05:51.922Z","index":5,"parentId":"1448","title":"Bamboo HR","url":"https://trilogyed.bamboohr.com/self_onboarding/packet/finished.php"},{"id":1473,"dateAddedLocal":"3/16/2018, 11:11:11 AM","dateAddedUTC":"2018-03-16T15:11:11.854Z","index":6,"parentId":"1448","title":"Engagement Tactics - Google Docs","url":"https://docs.google.com/document/d/1PG5M6fCGBi0-DXvKgoyHH_ZQ43tSjDKYVkTMpmazBL4/edit#"},{"id":1474,"dateAddedLocal":"3/16/2018, 11:11:43 AM","dateAddedUTC":"2018-03-16T15:11:43.502Z","index":7,"parentId":"1448","title":"MAD MAN Engagement Tactics - YouTube - YouTube","url":"https://www.youtube.com/playlist?list=PLQHSrcR-RsBSvHNrPI8zIibewvURhpzRf"},{"id":1476,"dateAddedLocal":"3/16/2018, 11:37:14 AM","dateAddedUTC":"2018-03-16T15:37:14.102Z","index":8,"parentId":"1448","title":"introduction to training - YouTube","url":"https://www.youtube.com/watch?v=vpYuCRIn0ok&list=PLQHSrcR-RsBSUCRJ2fF5Djt1DvlFQovNR"},{"id":1477,"dateAddedLocal":"3/16/2018, 11:38:08 AM","dateAddedUTC":"2018-03-16T15:38:08.426Z","index":9,"parentId":"1448","title":"Killer Instructional Staff Checklist - Google Docs","url":"https://docs.google.com/document/d/1FZBc6RU6xx_Lf7WysWbRMgtXnuB8NU6fu9aW9vrsNlM/edit#"},{"id":1478,"dateAddedLocal":"3/16/2018, 11:43:43 AM","dateAddedUTC":"2018-03-16T15:43:43.922Z","index":10,"parentId":"1448","title":"Try Panopto","url":"https://www.panopto.com/try-panopto/?utm_source=ppc&utm_medium=adwords&utm_content=panopto&utm_campaign=panopto&gclid=EAIaIQobChMImeisv5fx2QIVg7jACh02eghEEAAYASAAEgK7j_D_BwE"},{"id":1479,"dateAddedLocal":"3/16/2018, 11:43:51 AM","dateAddedUTC":"2018-03-16T15:43:51.820Z","index":11,"parentId":"1448","title":"MAD MAN tactic: Movement - YouTube","url":"https://www.youtube.com/watch?v=Yp3zTHKA6Do&list=PLQHSrcR-RsBSvHNrPI8zIibewvURhpzRf&index=2"},{"id":1480,"dateAddedLocal":"3/16/2018, 11:57:11 AM","dateAddedUTC":"2018-03-16T15:57:11.109Z","index":12,"parentId":"1448","title":"SOP: Class Project Recordings - Google Docs","url":"https://docs.google.com/document/d/1HT5GvbWGVG93kuLWBSXz-afHbEKC8ITOPjFqi53AiXI/edit"},{"id":1481,"dateAddedLocal":"3/16/2018, 11:57:23 AM","dateAddedUTC":"2018-03-16T15:57:23.106Z","index":13,"parentId":"1448","title":"SOP: Class Project Recordings shortened - Google Docs","url":"https://docs.google.com/document/d/11xs9XxsQmwdCSnxNfcGU5BQqpXv3BbMMBnqz36WKeTY/edit"},{"id":1484,"dateAddedLocal":"3/17/2018, 11:16:46 AM","dateAddedUTC":"2018-03-17T15:16:46.195Z","index":14,"parentId":"1448","title":"BootcampSpot","url":"https://www.bootcampspot-v2.com/"}]